id,title,content,likes,collects,date,image
6411942c00000000130065bf,自由职业必看！跨境收款问题全解密,国内的小伙伴，如果你是远程办公或者自由职业，你的雇主或者客户在海外，下面三种跨境收款方式。 1️⃣银行电汇 银行电汇是一种传统且常用的方式。其优点是只要确认公司账户或个人使用的身份不在管制国家内，支付手续费后就可以将钱汇入国内。但缺点也比较明显，需要在国内进行备案和审批的程序，手续费相对较高且不同银行收费标准不同，计算方式也不同，到账时间也会不同，有的可能当天到账，而有的则需要等待1-3天或者更久。 2️⃣第三方支付平台 第三方平台是比较流行的一种支付方式，比如Payoneer和Wise。其中，Payoneer采取虚拟银行的运作策略，节省一笔手续费。公司需要申请Payoneer的Partner Account付款到对方绑定的Payoneer账户，再通知对方将款额转回国内或者让对方申请专用的储蓄卡，在国内的ATM上取款即可。但公司需要申请Partner Account，需要审核过程，如果支付性质不属于白名单属性，申请可能会被驳回。同时，账户管理费和手续费也需要考虑。Wise类似Payoneer，公司可以通过该平台将账户的钱直接转入指定的银行账户，支持批次付款和某些国家的商业账户。但公司账户需要认证，如果公司所在地没有Wise的本地银行账户，还需要承担外汇转换的手续费，Wise的储蓄卡也有限制，时效性好，收款方可以立即收到款项，但是收费高。 3️⃣第三方人力服务机构 第三方人力服务机构是一种比较简单直接的方式。公司或者个人可以找对应的第三方人力服务机构，对口客户一般是需要跨境支付薪资的企业。一旦与第三方人力服务机构合作，公司就可以按照自己的工作计划设定付款时间，告诉第三方即可，省去了时间成本、财力成本以及奔波搜集材料等麻烦。,168,0,2023-03-15T17:47:00,"""https://ci.xiaohongshu.com/5c07cc83-6161-2617-3d8d-3410b40e755e?imageMogr2/format/jpg/quality/92/auto-orient/strip/crop/450x300/gravity/center"""
6448f2ab000000000703bf47,不上班计划的笔记, 来稿要求 	 1.内容要求：参评作品应为未取得电影公映许可证，具有完整电影剧本架构、符合电影剧本篇幅长度（剧本字数在2.5万至5万字）和形式的电影剧本，仅限于中文剧本。小说、散文、电视剧等其他体裁的稿件不在参评范围。 	 2.编剧年龄：独立编剧、合作创作中第一编剧年龄在60周岁以下（至投稿截止日期2023年6月15日）。 	 3.数量要求：每位作者限投一部。 	 4.已获得中宣部电影局有关各类资助的电影剧本，不在参评范围。,230,0,2023-04-26T17:45:00,"""https://ci.xiaohongshu.com/ea1e3c68-d8fc-2524-d34d-6901755ef825?imageMogr2/format/jpg/quality/92/auto-orient/strip/crop/450x300/gravity/center"""
6348f9f2000000000601c90d,📂远程居家办公岗位分享！在线招聘啦！,♨️今日远程居家办公岗位新鲜出炉！ 来看看有没有适合你的吧！ - 如果你对以上的远程工作感兴趣，记得👍&amp;🌟， 然后发📧备注你需要应聘的岗位给小灵哦~ （ps：备注了应聘岗位的会优先回复哦~）,272,0,2022-10-14T18:00:00,"""https://ci.xiaohongshu.com/2403f47c-b327-bbbd-9e4a-1d23c72f3c32?imageMogr2/format/jpg/quality/92/auto-orient/strip/crop/450x300/gravity/center"""
63fdf2030000000012030786,出海翻译挣美金不得不知的网站-2：Upwork！,出海翻译不得不知的网站-2：Upwork！（附近期翻译兼职机会）,363,0,2023-02-28T20:22:00,"""https://ci.xiaohongshu.com/bc951e53-63cb-c26e-3714-39e5a3794e26?imageMogr2/format/jpg/quality/92/auto-orient/strip/crop/450x300/gravity/center"""
63f775af000000001303219a,数字游民的尽头还是定居下来吗？,看了许多案例，听过各类分享，浅浅总结一下国内数字游民人群我观察到的几个特点： 	 - 1️⃣ 年轻人体验生活/gap/辞职/新游民（&lt;3年）多 2️⃣ 老游民（3-10年）加入或建立线下社区 3️⃣ 单身人数&gt;情侣&gt;带娃&gt;带学龄娃 	 - 🫤 所以目前我觉得这事儿没法闭环，大多数人最终还是会定居下来的主要原因如下： 	 - 1️⃣ 自由还是折腾？假设每Q换个地方生活，就算每年换个地方，过个三五年我是觉得蛮累的。因为这不像旅游，数字游民每天还是有工作的（且通常是自己事业的owner 	 - 2️⃣ 社交需求。追求自由的同时也总希望能与其他人深度链接，而数字游民已经自给自足自洽了，不太容易因为生活/工作必须与其他人产生交集。所以要么是在一个地方待久一些，要么有社区等第三方因素的推动 	 - 3️⃣ 教育、医疗等解决方案。适合数字游民的替代方案肯定是有，但如果因为我想在不同国家和地区工作生活，就需要花大气力去研究一套现行社会惯例之外的做法，我会思考这事儿的性价比… 	 - 🗣️ 一定会有人说“那体验一下不也可以吗？谁规定要一直游呢？”没错！只是对我个人现阶段而言，我的需求不是去看世界，在哪都无非是生活而已。我也喜欢工作，只是讨厌上班。所以我寻找的是长期解决方案，让我能时间地点自由，做我喜欢的事情。目前看起来数字游民比较符合，但仍在推敲中。 	 - 🤔 不知道大家都是怎么想的呢？,34,0,2023-02-23T22:18:00,"""https://ci.xiaohongshu.com/bcd75c33-7d2a-38b0-4bba-7f02061e0acb?imageMogr2/format/jpg/quality/92/auto-orient/strip/crop/450x300/gravity/center"""
63e0cfb7000000001a01e2f9,干货｜数字游民1年我是怎么赚到100万的,工作背景： 沪广深杭新餐饮一线网红品牌营销人 MCN媒介主管（PR）；十八线野生博主 ⚠️ 基本上有一部手机📱就可以实现短途旅游的办公自由 手机+ipad或笔记本电脑+相机 就可以一直人在旅途且办公两不误 . 教育背景： 世界排名前100英国排名前10院校硕士；国内211本科，双学位；台湾交换生 . 数字游民的一天…可能是 1⃣️ 在机场赶提案PPT；在咖啡店视频会议 2⃣️ 去高铁路上顺便探店 3⃣️ 在路上帮客户选方案 . 什么职业适合数字游民 1⃣️ 可以远程办公的 2⃣️ 已有长期稳定合作的业务 3⃣️ 我身边的插画师/摄影师/旅行博主…以及做风险投资的等等 . 心得 1⃣️ 年轻的时候要强制储蓄 哪怕月入5k，也要按照一定比例逼自己储蓄。最好是一发工资就先存一部分。这样万一有事急用或年底计划旅游的💰都出来了。 👉 刚毕业工作的时候我也是月光族，钱都用在国内国外满世界旅游+买包上。奔三路上觉得女生还是要靠自己买房，于是开始开源节流。 . 2⃣️ 开源节流同时进行 结合自己的兴趣爱好，副业整起来。自媒体流量的风口，抓住了就有可能早日跨越阶级。比如：热爱运动的，是否可以周末节假日兼职教练或相关工作人员？喜欢写写画画拍照摄影的，凭一技之长是否可以逐渐接单兼职文案或跟拍？,147,0,2023-02-06T18:00:00,"""https://ci.xiaohongshu.com/7cf3bed2-8b87-9876-41f1-ea8b33c24795?imageMogr2/format/jpg/quality/92/auto-orient/strip/crop/450x300/gravity/center"""
642e84f10000000027000187,不想坐班｜10个平台帮你找国内外远程工作！,在这个数字化时代，越来越多的人开始认识到远程工作的好处。不仅可以避免通勤时间和交通拥堵，还可以让人们更加自由地掌控自己的时间。如果你不想上班，或者想要探索一下远程工作的机会，以下是20个平台可以帮助你找到国内外的远程工作。 Upwork - Upwork 是一个全球性的自由职业者平台，提供各种类型的工作机会，包括网页设计、软件开发、写作等。 Freelancer - Freelancer 是另一个自由职业者平台，提供的工作机会也非常丰富。 Fiverr - Fiverr 是一个以任务为基础的平台，提供的服务包括设计、写作、音乐制作等。 Guru - Guru 是一个全球性的自由职业者平台，提供各种类型的工作机会，包括网页设计、软件开发、写作等。 99designs - 99designs 是一个专注于设计工作的平台，提供的服务包括logo设计、网站设计、标志设计等。 Toptal - Toptal 是一个高级自由职业者平台，提供的服务包括软件开发、设计、项目管理等。 FlexJobs - FlexJobs 是一个专注于远程工作的平台，提供的职位包括数据分析、客户服务、写作等。 Remote.co - Remote.co 是另一个专注于远程工作的平台，提供的职位包括营销、客户服务、人力资源等。 AngelList - AngelList 是一个专注于初创公司的平台，提供的职位包括软件开发、营销、设计等。 We Work Remotely - We Work Remotely 是一个专注于远程工作的平台，提供的职位包括软件开发、设计、营销等。,49,0,2023-04-06T20:38:00,"""https://ci.xiaohongshu.com/e4e93481-150b-e099-9b11-59e70dcc0902?imageMogr2/format/jpg/quality/92/auto-orient/strip/crop/450x300/gravity/center"""
64169fd400000000070383ce,5本书带你走向自由职业之路,"1️⃣《数字游民：如何在全球范围内工作、旅行和生活》 (The Digital Nomad) by Tsugio Makimoto and David Manners 这本书是数字游民的必读之作！让你了解数字游民的定义、历史和发展趋势，还有成功的数字游民必须具备的技能和策略。走到哪儿都能工作和旅行，轻松愉快！ 2️⃣《远程：数字游民的自由之路》 (Remote: Office Not Required) by Jason Fried and David Heinemeier Hansson  远程工作是数字游民的代名词。这本书详细介绍了远程工作的优势，包括更高的生产力、更大的自由度和更低的成本，还有如何建立和管理远程团队。让你尽情享受数字游民的自由之路！ 3️⃣《数字游民手册》(The Digital Nomad Handbook) by Dan Prescher and Suzan Haskins 不想定居在一个地方，又想旅行又想赚钱怎么办？这本书给你提供数字游民的生活方式和旅行策略，还告诉你如何在任何地方找到工作和赚钱。让你随时随地享受自由自在的生活！ 4️⃣《一人企业：如何成为一位自由职业者，摆脱繁琐事务，赚取更多的钱》 (The One Person Business: Make Great Money, Work the Way You Like, Have the Life You Want) by Elaine Pofeldt 想要摆脱繁琐事务，实现自由职业？这本书是你的绝佳选择！它告诉你如何通过建立一人企业来实现自由职业，利用数字化技术和网络资源来最大化收益并获得更多的自由时间。 5️⃣《数字游民生存指南》 (The Digital Nomad Survival Handbook) by Robert McGuire -数字游民虽然自由自在，但也需要面对各种挑战。这本书提供了数字游民需要面对的挑战和解决方案，以及如何在任何地方建立和管理自己的数字工作。让你轻松应对数字游民的生存挑战！ 这5本书带你开启数字游民的自由生活，让你成为自己生命的设计师！",27,0,2023-03-19T13:38:00,"""https://ci.xiaohongshu.com/dc202079-aaa1-3c26-56a5-5f7d5fddebb8?imageMogr2/format/jpg/quality/92/auto-orient/strip/crop/450x300/gravity/center"""
63ec3a73000000000800eeab,💻数字游民｜找工作的25个远程工作平台,本文将介绍国内外最受欢迎的25个远程工作平台，希望你能够找到一份适合你的远程工作。 	 🌍国际远程工作平台 1. Upwork 2. Fiverr 3. Toptal 4. Guru 5. Microworkers 6. FreeLancer 7. Remote.co 8. Remotive 9. FlexJobs 10. Hirable 11. AngelList 12.We Work Remotely 13. NoDesk 14. JustRemote 	 🇨🇳国内远程工作平台 1. 圆领 2. 电鸭社区 3. Brix Labs 4. FreeLab自由客实验室 5. RW数字游民社区 6. Boss直聘 7. 小蜜蜂云工作 8. 程序员客栈 9. 码市 10. 云队友 11. 甜薪工场 	 网站🔗链接🔗放不了，小窗👋网址，或在知乎上🔍这篇文章可以直接跳转各个网站。 	     #你觉得远程工作在未来会是趋势吗,20,0,2023-02-15T09:50:00,"""https://ci.xiaohongshu.com/dc342525-2e0e-6de1-e6ca-69746d3b86d9?imageMogr2/format/jpg/quality/92/auto-orient/strip/crop/450x300/gravity/center"""
6326fff0000000000801c329,新媒丨如何找到远程实习,首先，我要先说明。 1⃣我的所有远程实习/项目都是在gzh上面找到的。 2⃣我先后做过的大厂远程项目实习包括但不限于哔哩哔哩、网易云音乐、斗鱼、36氪等等。 3⃣我对项目的判断——“靠不靠谱“，源于我大量的实践和证明，开始我和你们一样，都不了解，但即便如此，我也不能判断每日涌动的新信息。 4⃣我对远程实习的敏感性源于我每天都看20+个gzh的相关实习信息。 - ⏩其次，我想问大家一个很简单的问题，当你们在问 “可以给我一些靠谱的远程实习吗” “有什么适合我的远程实习的渠道吗” “gzh是什么呀” 你们有没有想过，这些东西 - 1⃣完全可以靠自己寻找，而且更好 但凡略微上点心，在wx里搜索远程实习，你就能收获到一大堆关于远程实习的推文和公号，这并不是信息差，只取决于你的个人意愿是否强烈。 - 你想找传媒相关的，你就搜索传媒的，其他是一样的道理，这样还能精准打击你想要的。 - 同样，sxs也是可以的。 - 2⃣靠谱不靠谱，不是渠道可以决定的 大部分开始找远程实习的同学们都在意“它到底靠谱吗”，“有绝对靠谱的渠道吗”。 我想告诉你们的是，这个世界上的信息本来就是真假混杂的，很多时候，假的信息隐藏得越来越深，这些都需要我们自己去辨别。 - 话说回来，传媒实习僧上还发过假的呢，你能去怪他们团队的审核吗？ - 很多人只是想要一个答案，可是人生的答案没人能告诉你。也没有人有资格。你们问我的大多数问题“xx靠谱吗”，我没有尝试过，我也没有时间去尝试，无法回答。 - 一个简单的道理是，大厂可能会更靠谱，公司可能比机构更靠谱。 - 3⃣如果你真的需要，你一定要亲力亲为 是的，有一些靠谱的经验可以让人少走不少弯路，但是对于很多个性的问题“我需要实习证明”“这个xx实习证明是否有效”“出国申请可以用吗”……我真的回答不了。 - 现在的信息量太冗杂了，大家都要学会对自己的未来负责。我每每看到“可以给我一些靠谱的远程实习吗”类似这样的问题，我都会很头疼。我都在想一件事情——我只是分享经验而已，我如何能帮你找到一个靠谱的实习再推给你呢？ - 希望大家都能找到自己想要的远程实习和项目。,709,0,2022-09-18T19:24:00,"""https://ci.xiaohongshu.com/4bbf6d0d-ded1-0915-e41f-81fbcca5bc5d?imageMogr2/format/jpg/quality/92/auto-orient/strip/crop/450x300/gravity/center"""
64221d5d0000000013031168,怪我发现太晚😭这个远程控制太好用了‼️,打工人有救了🤩 再也不用担心下班后，老板突然来急活了😩 直接用它就可远程控制办公室的电脑，超方便，我怎么才发现☹️ 白在公司加那么多班，嘤嘤嘤😭～ - ❤️爱屁屁：To Desk ✅设备不限：iOS+安卓+平板+电脑👉均可 - 1⃣️无论是电脑、手机还是平板，都可以远程控制其他设备，也可以被其他设备控制 Ps ：跨系统也可以控制哦 - 2⃣️轻松实现电脑远程开关机，传送文件，日常办公 - 3⃣️隐私性好，完全不用担心远程控制电脑时，被控制的桌面会被别人看见 - 4⃣️AnQuan性超高，这点很关键，也是我pick它首要理由，所以不用担心在控制的时候，泄漏个人信息 - 💁🏻‍♀️如何使用？ 先下载⏬爱屁屁，然后电脑💻和手机📱/ipad同时登陆同一个账号，即可实现远程控制，使用起来也是毫无延迟，顺🉐️狠👍 - Ps : 也可以通过远程控制，查看对象的手机📱，给足对方an全感，哈哈哈 - 🌟所以有远程控制需求的姐妹👭，用它就对了，反正免费，不用白不用‼️,91,0,2023-03-28T06:49:00,"""https://ci.xiaohongshu.com/56cf3b1a-55be-83d8-7178-311b961e1fc1?imageMogr2/format/jpg/quality/92/auto-orient/strip/crop/450x300/gravity/center"""
6360fcb0000000000602ab50,远程软件对比：向日葵🌻 VS TeamViewer,转眼已经11月，本来想在10月分享的……奈何游戏太好玩。 Anyway，国庆内蒙的疫情突然爆发，本来还在苦恼国庆节后连上7天班，结果在一轮轮静默之后，竟然喜提16天国庆假期，估计往后再不会有这种机会了…… 虽然我的城市静默了，我们公司还是要求居家办公的，于是深度体验了TeamViewer，加上之前向日葵的经历，下面就从我的使用体验来对比下这两款远程软件。 	 🉑️共同点： 都可以在一定条件下免费🆓使用（如限速、牺牲清晰度、电脑台数等方面限制下） 都可以付费获得更好的使用体验 都简单好用，易上手 都可以无人值守远程（不需要被远程的电脑同意/接受，即可远程） 都可以文件互传（可以直接复制/粘贴、文件框、传文件界面互传） 	 🌻向日葵 免费版向日葵可以多端登录同一账号（PC，手机，平板），账号下可以添加多台设备 可以手机/平板投屏，共享移动端屏幕 平板/手机控制电脑时，有手指触控、虚拟鼠标和指针模式（移动端作为触控板）三种 有辅助外设，即使电脑关机也可以远程开机 入门付费更加便宜，但是好像入门付费只是买了清晰度和速度 	 🌟TeamViewer 一个账号只能登录2个设备，而且申请账号需要手机号，所以我只能办公室电脑+平板一个账号，家里电脑+手机一个账号 平板/手机控制电脑时，有鼠标模式（把平板/手机作为触控板）、触控模式两种 电脑控制电脑时，有会议功能（没用过，不知道是否需要付费） 平板连接鼠标控制电脑时，个人感觉TeamViewer更好用点 有远程时间限制，大概3-4小时？在家远程工作时，上午和下午各会强制中断一次。 同样免费版的情况下，感觉TeamViewer更加流畅，更加清晰，向日葵有延迟。 🪲移动端用键盘打字时出现吞字现象，但是电脑控制时候没有，希望将来能修复吧 	 之前我是向日葵付过费的，今年到期以后转到TeamViewer。如果设备固定而且没那么多，多数使用电脑控制电脑，个人更建议TeamViewer，毕竟免费版就可以有不错的操控体验和清晰度了。如果用移动端控制比较多，推荐向日葵。向日葵在外设、客服和产品多样化方面可能还是比TeamViewer更好的，而且国内好像使用人数更多，我们公司之前安装箱标打印机驱动，供应商也是通过向日葵远程的。 	 以上，希望能够帮到大家。,96,0,2022-11-01T19:02:00,"""https://ci.xiaohongshu.com/ccaab2a4-ccf9-cdef-984f-af95474de4b0?imageMogr2/format/jpg/quality/92/auto-orient/strip/crop/450x300/gravity/center"""
63ca033a000000001c0360c0,远程设计师薪水天花板是不是有点低？,补充: 需要链接的私信下我,129,0,2023-01-20T10:58:00,"""https://ci.xiaohongshu.com/d54131b8-a388-fad7-cdc2-94fd354c3e44?imageMogr2/format/jpg/quality/92/auto-orient/strip/crop/450x300/gravity/center"""
62977be5000000002103e2aa,读书期间找IT相关实习或兼职之粗略总结篇,刚才我收到好多私信提问这个问题，所以我现在赶紧出一篇这个，先给大家一个思路，之后会细说步骤。 	 大家常说毕业第一份工作特别难找，然后公司都想要找有经验的。但是总归是有一些中小型公司，他们是可以招实习生和毕业生的，如何是在这么多的人中脱颖而出呢？ 	 我认为每个学生求职者都要有某种优点突出。特别是对于IT的毕业生来说。 	 1.要不然你就是编程很厉害，github 上面有很多的记录，你自己的兴趣都在这上面，公司一看就知道你水平。就算你自己不是很厉害，你都可以跟着网上的视频做，然后保存在你自己github，上面公司问了你问题，你都可以侃侃而谈，你显示出你懂就可以。 	 2.要不然就是你读书很厉害，你的成绩接近满分，公司觉得你是一个quick learner，外加非常有可能在学校老师那里得到机会。 	 3.要不然就是你的沟通和人际交往都很好，你能跟当地人打成一片从当地人那里得到内推的机会。又或者是你做了很多的志愿者，公司看到这些觉得你是值得的人，也会给你一个机会。当然你做了志愿者也可以跟当地人打成一片得到内推的机会。 	 4.IT其实也有很多证书，现在可以考比较火的AWS云证书，公司最爱，不管你是开发还是DevOps 都要懂云 	 5.Leetcode刷题乃王道 	 我自己本人做到了第2点外加一点点的第3点，我自认为不是天赋异禀的人，编程也就一般，所以我保证我自己的成绩非常高，外加去做很多志愿者认识很多人。 	 此为粗略总结篇，之后会每一点的trick说一下，因为我不是书呆子死读书的人哈哈，里面有小脑筋的点。,841,0,2022-06-01T22:47:00,"""https://ci.xiaohongshu.com/4790773f-d3ec-1d21-e0fa-41f6aae194bf?imageMogr2/format/jpg/quality/92/auto-orient/strip/crop/450x300/gravity/center"""
63e3bd10000000001d022031,иӢұдё“з”ҹеҸҜеҶІпјҒдёҚйҷҗж—¶й—ҙең°зӮ№пјҒзәҝдёҠиӢұиҜӯиҖҒеёҲе…јиҒҢ,иӢұдё“з”ҹеҸҜеҒҡпјҒиҜӯиЁҖиҜҒд№ҰеҠ еҲҶпјҒзәҝдёҠиӢұиҜӯиҖҒеёҲе…јиҒҢйңҖиҰҒвҖјпёҸрҹҷӢрҹҸ»вҖҚвҷҖпёҸрҹҘ°рҹ’җрҹҚғ е–ңж¬ўзҡ„рҹҢҹвһ•follow рҹ’¬е‘ҠиҜүжҲ‘гҖҗ111гҖ‘еҚіеҸҜgetз”іиҜ·ж–№ејҸпјҒ                   #,495,0,2023-02-08T23:17:00,"""https://ci.xiaohongshu.com/0bf72529-76b8-4322-20c6-0d25c6dbe2bb?imageMogr2/format/jpg/quality/92/auto-orient/strip/crop/450x300/gravity/center"""
62b009a9000000000e02bdda,转行心理咨询师：度过0-100小时个案尴尬期,昨天问大家对我转行经验最感兴趣的是哪部分，选的最多的是「如何接到个案」，那今天就先从个案篇说起，其他内容后续更新😁。 . 先说说我的情况。我是从去年1月开始接个案的，3月开始全职接，中间去玩冲浪摔骨折了做了手术😭，经历了一波来访者的转介和流失，今年2月入驻了简单心理，入驻之后主要从平台接个案。一年半下来，我目前付费个案小时数200+，前100小时比较困难，入驻平台之后就不缺个案了，现阶段我已经个案量饱和。 . ✨我的个案来源： 👭朋友推荐：万事开头难，我宝贵的第一批来访者主要是朋友介绍来的。最开始要发自己的咨询师简历也很忐忑，但发了之后有很多朋友家人积极帮我转发打call，也有之前来和我聊过自己情绪问题、我帮忙推荐过咨询师的朋友跟我说我收费太低了（当时收费200元/次），让我挺感动的。因为大家的信任和帮忙，我第一个月就有了5位来访者。 . 🎬自媒体：我其实从2020年就在某站发过视频，但是那时候只是因为YQ在家一时兴起，又经常有朋友问我找心理咨询的问题，就尝试了做视频。开始接个案以后，苦于暂时不满足平台入驻要求，需要更多的个案来源，就决定继续更新视频。自媒体之前一直做的断断续续，但每个月还是会有零星的咨询过来。 . ✅平台：今年2月入驻简单心理以来，平台是我的主要个案来源。上个月开始我基本就停止接新个案了。入驻平台之后确实省心很多，减少了很多事务性的沟通，能更聚焦在咨询上了。平台也做了很多心理教育的工作，相比其他渠道，平台的来访者对心理咨询有更多了解，稳定性也相对更强。 . 🗣同行推荐：在行业慢慢积累，也会有同行推荐个案，同样的我也会推荐或者转介个案给同行。通过上课、团体督导等机会会结识不同地区、不同流派和专长的咨询师，当我遇到有双重关系的，或者可能不适合我的工作风格/设置的来访者，我就会介绍给同行。相应的，也会有同行介绍给我他们觉得适合我的来访者。 . 从最开始焦虑接不到个案，到现在需要婉拒一些来访者（容我嘚瑟一下！🤫），在我看来最重要的是度过0-100小时的困难时期。要学会如何在符合伦理的情况下营销自己，在个案稀缺的时候保持成长型心态持续学习，在感到辛苦的时候及时寻求督导、同行的支持。 后续还会再浅说一下前期营销自己的经验和注意事项，感兴趣的小伙伴留步喔😉,318,0,2022-06-20T13:46:00,"""https://ci.xiaohongshu.com/e9ae422a-663e-d37c-1eb0-329b2eaf894b?imageMogr2/format/jpg/quality/92/auto-orient/strip/crop/450x300/gravity/center"""
