id,title,content,likes,collects,date,image
634fb4670000000008017f76,“终南杯”电影文学故事（剧本）征集,z在这里，开始你的不上班计划 	  征集对象 所有热爱影视文学的创作者 	  	 征集时间 即日起至2023年4月20日 	  	 征集内容与要求 1、反映大秦岭保护、脱贫攻坚、乡村振兴以及青年人创业励志的故事。投稿请关注微信公众号：不上班计划。 2、尤其欢迎讲述长安区的、具有正能量的、新颖感人的当下老百姓现实生活故事。 3、故事具有感染力，有较强的矛盾冲突，有优美的爱情情节，有饱满的人物形象，有深刻的思想内涵。 4、作品要求3000字以上，20000字以内。  奖励办法 一等奖1名，奖金10000元 二等奖2名，奖金各5000元 三等奖3名，奖金各2000元 优秀奖10名，奖金各500元 以上均颁发获奖证书,451,0,2022-10-19T16:25:00,"""https://ci.xiaohongshu.com/ae49ab7e-de00-c13d-f760-e13d1f34282a?imageMogr2/format/jpg/quality/92/auto-orient/strip/crop/450x300/gravity/center"""
64888df2000000001303cd98,科普｜数字游民入门必看🙋🏻,⛱️&quot;数字游民&quot;（Digital Nomads）是指那些通过利用数字技术和互联网，可以在不同地点工作和生活的人。他们依靠远程工作、在线业务或数字化的方式来赚取。 数字游民通常具备技术能力和自主性，可以通过互联网进行工作，如编程、写作、设计、营销、翻译等。 🗺️一些国家已经开始推出数字游民签证或类似的计划，以吸引远程工作者和数字游民。以下是一些已经开通或计划推出数字游民签证的国家的例子： 1. 爱沙尼亚（Estonia）：爱沙尼亚是首个推出数字游民签证的国家，其数字居民计划（Estonian Digital Nomad Visa）于2020年启动。 2. 格鲁吉亚（Georgia）：格鲁吉亚于你2021年推出了远程工作签证（Remotely from Georgia），允许数字游民在该国居住和工作。 3. 克罗地亚（Croatia）：克罗地亚在2021年引入了远程工作签证计划（Croatian Digital Nomad Visa），允许数字游民在该国停留并进行远程工作。 4. 巴巴多斯（Barbados）：巴巴多斯推出了12个月的远程工作签证（Barbados Welcome Stamp），允许远程工作者在该国居住和工作。 🚦如何找远程工作： 1. 远程工作平台：许多在线平台专门为远程工作者提供了机会：Upwork、Freelancer、Remote OK、FlexJobs等。 2. 社交媒体和专业网络：利用社交媒体平台，如LinkedIn、Twitter、Facebook等，与其他专业人士和公司建立联系。加入相关行业的专业群组和社区，参与讨论并了解远程工作机会。 3. 独立合同工作：作为数字游民，你也可以成为独立的合同工，通过建立您自己的个人品牌、网络推广和口碑传播，吸引客户并接受远程工作项目。 4. 远程工作招聘网站：Remote.co、We Work Remotely、Remotive等。 5.还可以直接联系公司或组织，了解他们是否提供远程工作机会,6,0,2023-06-13T23:40:00,"""https://ci.xiaohongshu.com/6eb5a4db-3510-a6b0-9fae-e95172b1c80c?imageMogr2/format/jpg/quality/92/auto-orient/strip/crop/450x300/gravity/center"""
648d63b000000000130151c3,🌍远程工作offer必备：掌握时区套利！,很多集美在寻找远程工作offer时， 心中充满美好的想象： 赚美元英镑， 然后在大理或东南亚享受生活， 高收入，低生活成本，这是多么美好的憧憬！ 	 但实际上，我们生活在亚洲， 在与欧美团队/客户合作时会遇到许多问题， 除了文化差异，时区问题是一个重要挑战。 因此，在寻找远程项目时， 我一直按照以下公式进行; 	 远程工作offer时区公式：⏰⌚️ 选择与自己时区相差 +/- 3小时内的工作， 最好在2小时内更适宜。 	 举个例子： 作为一个长期旅居在大理的人， 我所在位置是中国的时区GMT+8。 GMT+8时区包括澳洲、新加坡、台湾、马来西亚、菲律宾以及印尼（还有香港）。 	 我可以尝试寻找薪酬更高的澳洲和新加坡的工作。 同时，也可以关注GMT+6到GMT+10之间的国家的工作机会。 	 我目前有一个与泰国公司合作的自由职业工作， 泰国的时区是GMT+7， 我与泰国的客户进行会议和沟通 从未遇到时间对不上的问题。 	 当锁定适合时区的国家列表后， 不要只专注于提供远程工作机会的网站， 也可以在这些国家/城市的求职网站上寻找远程工作机会。 	 例如： 新加坡和香港：JobsDB 澳洲：Seek、Indeed、Ethical Job... 	 希望大家早日找到合适的远程工作offer， 成为环游世界的数字游民！🌐💻🌍,392,0,2023-06-17T15:41:00,"""https://ci.xiaohongshu.com/b0f88d41-000d-36cb-3293-1f9842c2f3ce?imageMogr2/format/jpg/quality/92/auto-orient/strip/crop/450x300/gravity/center"""
6478637f00000000140240b6,🐳直播预告｜数字游民的N种可能性🐳,"UniX《数字游民事业成长进化论》系列直播来啦！UniX会持续围绕着这个话题每月开展一次直播。 提到数字游民，很多人的理解是：做着一二线城市的远程外包工作，去三四线城市地理套利。而在真诚利他的UniX数字游民社UniX眼中，数字游民应该是长期主义+能带动当地经济的。这次的两位嘉宾文倩和斌斌就是我们眼中的这种理念的践行者，都在以商业化的方式带动了当地经济发展。通过他们的经历，我们来一同探讨数字游民的N种可能。 🎙️嘉宾介绍 文倩 ✨2022年环球旅行, 游历40+国家； ✨TED演讲者，706青年空间·香港共创 ✨自然爱好者，大凉山支教老师，世界公民 ✨2023年海南·巴厘岛数字游民旅居空间共创 ✨2023·6月 大湾区自由职业峰会香港场讲者 疫情伊始辞去香港体制工作，三年走出了一个人的环球生活体验， 从探索世界的广度回到向内的深度；环球归来，看到乡野的附近， 一直在路上，一直清晰、勇敢且坚定；直入不知的生命体验者。 阴斌斌 💕造梦公益创始人，国际免费午餐非洲负责人。 💕曾获得中国公益大赛金奖，在非洲从事国际援助6年，发起开展8个公益项目。现在为非洲援建五所学校，开展国际免费午餐，为非洲6个国家10000多名贫民窟孩子每天提供食物。举办贫民窟规模最大的达人秀，足球赛，艺术展，为贫民窟孩子提供奖学金，助学金。 💕建立国际志愿者平台，每年派送数百名国际志愿者前往非洲。与肯尼亚副总统办公室，乌干达教育局等建立了长期合作关系，在非洲开展的公益项目累计获得新华社，央视等媒体数百次的报道。 ⏰直播时间 6.05 20:00-22:00  嘉宾：文倩；主持：铁柱； 6.06 20:00-22:00  嘉宾：斌斌；主持：小楠； ✔️票价：所有用户均可免费预约直播并参与 ✴️报名方式：加入小红书*UniX数字游民活动群 🌏 对数字游民、UniX数字游民社区和社区活动感兴趣的大家，来📮星尘吧！我们都很期待认识你。 Stay tuned  ✨",24,0,2023-06-01T17:23:00,"""https://ci.xiaohongshu.com/245bea65-8120-4772-1df0-118ae76b0fee?imageMogr2/format/jpg/quality/92/auto-orient/strip/crop/450x300/gravity/center"""
63f8b9c90000000027001549,奖金60000元 |第七届谭木匠设计大赛, 	 栉为梳，佩为饰。在中国古代服饰文化里，梳子是重要的配饰之一。清晨栉发，代表一天的开始，亦被视作中华礼仪的起源之一。由古及今，小小一把梳子，既梳理发髻、装扮妆容，又规划礼仪，尽显栉佩之美。 	 栉佩之美，美在形态、美在功用、美在观念、美在创意、美在未来……你，如何定义心中的美？想必多样的生活态度，定会产生多元的艺术表达。文艺的、奇趣的、复古的、潮酷的……百花齐放，美美与共。 	  注册截止：2023年02月28日 	 提交截止：2023年02月28日 	  奖项设置 	 一等奖（1名）：20000元二等奖（2名）：  8000元三等奖（6名）：  3000元人气奖（1名）：  2000元特别奖（1名）：  2000元,16,0,2023-02-24T21:21:00,"""https://ci.xiaohongshu.com/b115b086-30a8-b112-d520-4e2d964653ba?imageMogr2/format/jpg/quality/92/auto-orient/strip/crop/450x300/gravity/center"""
64805ecc00000000110114f7,Web3工作这里找 | 热门岗位投递🔥,有小伙伴问有没有靠谱的Web3求职渠道 - 今天给大家推荐一个Web3求职小🍊序：NexJob - 看了一下Web3岗位具体的招聘要求，基本都是可以支持远程办公的 - ✨比较热门的岗位有：运营、商务、后端、客服、UI、测试等 - 👉如果大家想加入Web3行业，或者体验数字游民生活的，可以踊跃投递,38,0,2023-06-07T18:41:00,"""https://ci.xiaohongshu.com/8ad505aa-dfed-c4ed-5735-3d791551452b?imageMogr2/format/jpg/quality/92/auto-orient/strip/crop/450x300/gravity/center"""
648dafac000000001203d0d3,我不想再当别人的手了｜后期制作师离职故事,UniXer「勇敢Say No的离职故事」首篇来啦～ 🎤这次的嘉宾是后期包装制作师，UniXer村民B 🌹以下是她心声&amp;新生： 我之前的工作和生活可以用无尽的催促以及无尽的疲累来概括，经常看到日出的太阳🌄 为了工作日活下去，周末会放肆的寻找出口 项目反复修改，反复推翻，似乎永远交不掉，没有尽头。 审美折磨，身心折磨，既得不到钱和休息，也得不到个人价值输出的机会，老板没有❤️，没什么意思了 于4⃣️个🈷️前离职。离职的过程，心态上顺利，钱不顺利。现在在努力摸索成为创作者 现在的心态和生活，时而轻松愉悦，时而焦虑不安 🔆这两年身边的朋友随着自己生命的磁场和能量的改变而改变，我现在爱上了摇摆舞Swing💃，结识了不少朋友。 🎨离职之后的生活让我重新找到了对自己和对生活的感知力，现在专心学习绘画，创作自己的个人ip 以及他们的故事，希望可以转入文创行业。 🔥如果给几年前/还在职场的自己一个建议我会说 离职是对的，停下是对的，每一步选择都没有错！ 我还会对以前的自己说，从没有什么必须，只有自己的选择，牢牢记住自己的选择，和当初选择走向这条路的目的。 💭向往自由 及时行乐 绝不要自困 🌞人的本质大致都是矛盾的，喜欢沉迷温暖与美好，却对温暖和美好的是否持续存在存疑。 未知，毫无准备的事，以前的我总会怯懦。 我喜欢焦野绿的话，“除了死亡之外，一切活着的事情，都不必准备好，醒来，迎接美好的意外”🫶 对于过去，我已不再是搁置了，我选择主动地结束。 远去的朋友，既然路至岔路，那就相背而行吧，一切还会安好，未来，我们都可以成为内心、身体都同样强大的人。 最近从板绘又回归到手绘啦，铅笔在纸上的沙沙声才是最妙的👏，在画画的时刻得到内心的平静，捡起了一部分选择这条路时的热爱💗 对于未来，相比独自迎接，我更希望共同迎接很多未知的惊喜，期待在这里可以发现我真正想要的工作内容，期待我所了解的世界，对于世界的想象可以更高更远🪐 村民B期待在UniX与你共创！ 🐳在UniX，热忱和果敢是最高级的浪漫，如果你的内心有一丝觉得生活不该是这样，不只是这样的理想，这里是属于你那宇宙的一角✨         @耳朵,6,0,2023-06-17T21:05:00,"""https://ci.xiaohongshu.com/157e052b-c382-69e0-e49f-ee42b5b51e1f?imageMogr2/format/jpg/quality/92/auto-orient/strip/crop/450x300/gravity/center"""
64883e34000000002702b60c,原来Web3工作是到这里找！数字游民新方式,🥺原来还有这么多小伙伴不知道Web3工作怎么找吗？ - 因为这个行业是一个新兴行业，所以小伙伴们在一些招聘软件上可能不太容易找到Web3企业 - 今天给大家推荐一个Web3求职小🍊序：NexJob - ✨是专门做Web3垂类招聘的，也有跟Web3企业直接合作内tui，投递进度也有专人负责跟进 - 👉如果大家想加入Web3行业，可以滴滴~,31,0,2023-06-13T18:00:00,"""https://ci.xiaohongshu.com/f7afaeb5-7f46-9c0a-9d43-21a28df778f5?imageMogr2/format/jpg/quality/92/auto-orient/strip/crop/450x300/gravity/center"""
645bb3d000000000110130da,一个兼职远程工作平台,刚注册看了一下，可以用来找兼职或者招人。注册的时候，选择一些标签，就会推荐相关的职位。或直接上架自己的技能。有空闲时间的或者找工作的小姐妹可以看看有没有适合自己的。不要下载app不要下载app！不是app，直接搜索官网 。,2172,0,2023-05-10T23:10:00,"""https://ci.xiaohongshu.com/934c93ea-2d1c-1ddf-01a0-704177ae71c8?imageMogr2/format/jpg/quality/92/auto-orient/strip/crop/450x300/gravity/center"""
645b9885000000002702824e,第三届读客科幻文学奖来了！30万大奖, 详情看图,73,0,2023-05-10T21:13:00,"""https://ci.xiaohongshu.com/64de29b2-17e3-d4d7-5de2-e823fb9ed3f0?imageMogr2/format/jpg/quality/92/auto-orient/strip/crop/450x300/gravity/center"""
6454e5dc0000000013034374,🔶远程工作平台海外篇攻略｜数字游民,数字游民们如何找到一份合适的远程工作呢❓我想挣美元怎么开始呢❓如何地理套利呢❓ UniX数字游民社区的小伙伴们真实测评了5⃣️个最适合起步的海外远程工作平台，发挥你的特长，人人都可以成为数字游民！🎉 1⃣️LinkedIn 最大众求职网站，20%的工作机会是远程的 ❤️适合所有数字游民 2⃣️Upwork 全球最大的，经典远程工作平台，已经上市。 很多大公司会在这里找外包员工 工作门类很全，包括技术开发、设计、财务、管理、法律、营销、写作翻译，视频剪辑等等。 时薪自己填写也对小白很友好 ❤️适合技能型的数字游民 3⃣️Toptal “高端的自由职业平台”，slogan是&quot;只招全球3%的顶尖自由职业者&quot; 注册时需要选一个专业技能领域申请，有简历筛查和面试，合作的企业相对比较知名 ❤️适合资深数字游民寻找体面又高收入的远程机会 4⃣️RemoteOK: RemoteOK是专业远程工作招聘网站 可以通过筛选地区、薪酬、优势来选择最适合自己的自由工作，跟世界500强企业的合作 ❤️适合想找到长期远程工作的数字游民 5⃣️Fiverr 起步门槛低，很多人在上面进行对外中文教学，简历及文章修改，交互设计等工作 ❤️适合准数字游民 👀远程工作小Tips： 🌟强烈建议大家从Linkedin开始注册账户并上传简历和完善英文版工作经历，超过一半的其他平台支持LinkedIn账号登陆，一个完善的LinkedIn账号可以省去很多注册的时间！ 🌟学会包装自己，让别人一目了然地看出你的一技之长。艺术设计类工作提前准备作品集，个人网站。 🌟开始前先想好自己想做的技能的类型，给客户提供多个合作模式 🌟注明是否可以独立完成一个工作模块，比如设计师注明可以完整地设计品牌手册，程序员注明独立开发的经历。 🌟选择一到两个平台开始，一旦决定开始，就尽量保证每天在线，客户的问题及时回复 🌟可以主动跟潜在客户打招呼，在LinkedIn上面添加connection，寻找校友及前辈进行networking，主动才有故事！ 💗5大远程工作平台都由UniXer真实使用过，在评论区留下你的问题吧，我们在听👂 @星尘 ｜UniX无所不知的小助理,103,0,2023-05-05T19:17:00,"""https://ci.xiaohongshu.com/67924f89-282f-5b7d-a827-01baacbe3601?imageMogr2/format/jpg/quality/92/auto-orient/strip/crop/450x300/gravity/center"""
64799706000000000703b8b8,「古籍活化，传承书香」征文, 	 活动奖励· 	 所有签约参赛作品都有机会收录于国家图书馆数字化馆藏，供大众读者阅读·所有签约参赛作品都有机会与国家图书馆相关机构达成合作进行实体书出版、周边产品制作等版权开发·所有获奖作品都将获得承办方提供的荣誉证书、国家图书馆线下座谈会活动名额、番茄小说推广资源，此外还将获得现金大奖（奖励将随11月稿费一同发放）&gt;一等奖（共1名）：现金奖励20000元&gt;二等奖（男女频各1名）：现金奖励10000元&gt;三等奖（男女频各1名）：现金奖励5000元&gt;优秀奖（若干，1-10名，基于作品质量由评委确定最终获奖人数）：现金奖励3000元 	  征文赛道 	 1）特定赛道：·创作主题：自古籍中某个或某些故事/事件出发，发散思维进行合理化的改编及扩写，让古籍中的故事在网络文学中重新“活”起来，指定古籍《西厢记》《长生殿》《桃花扇》《牡丹亭》《世说新语》《儒林外史》《子不语》《阅微草堂笔记》· 	  	 赛道说明：本赛道签约参赛作品优先获得评奖与实体书出版机会，建议完结字数不低于8万字 	  	 2）普通赛道：·创作主题：作品满足历史/悬疑/古言相关分类要求（具体请见参赛方式说明），不限故事背景与内容主线，可聚焦于朝堂争辩，可着眼于江湖风波，可描绘深邃的情感，可畅想超然的技艺，亦可编织万般波云诡谲；作者可使用「识典古籍」平台查看古籍并从中获取资料及知识进行创作· 	  	 赛道说明： 	 本赛道签约参赛作品建议完结字数不低于15万字，鼓励作者创作医术、技艺、职业、传统文化相关题材的小说及不被广为人知的历史朝代背景下的小说，向读者展示瑰丽的中华文明,227,0,2023-06-02T15:15:00,"""https://ci.xiaohongshu.com/db7fab03-9ab9-fee1-49ce-27bafcfb3a4d?imageMogr2/format/jpg/quality/92/auto-orient/strip/crop/450x300/gravity/center"""
645bf7c30000000011012bc8,🇺🇸🇨🇦远程工作&amp;项目推荐｜非中介不收费,这周试用了一个远程工作平台，看到几个不错的🇺🇸🇨🇦都能在家上班的职位和项目，分享给需要积累工作经验的NG，或者喜欢在家办公的小🍠们。 ⭕️声明：我不是中介，不会收取你的费用，看到感兴趣的岗位可以评论留言，我再分享职位相关的详细信息，欢迎讨论。 1⃣️Tableau+数据短期项目：适合已经掌握Tableau知识，上过课或者考过证的人，需要会SQL，通过这个短期项目来积累数据可视化+搭建数据库相关的工作经验。 时薪：$75-165 类型：远程 + Part time 	 2⃣️职位-数据工程师 DE： 需要3-5年相关工作经验。 技能要求：Python， AWS，详情见图四 时薪：$60-70 类型：远程 + Full time 3⃣️ 职位-后台Engineer （私信或评论回复3，我会发给你详细信息） 基本要求：有Platform和Payment相关经验 时薪：$70-90 类型：远程 + Full time 4⃣️职位-软件工程师 （私信或评论回复4，我会发给你详细信息） 基本要求：需要3-5年相关工作经验。 年薪：$10-15万 类型：北美远程 + Full time 申请流程：把感兴趣的岗位告诉我，留下邮箱和contact方式，我看到以后会把职位详细信息发给你，了解岗位要求以后，自行申请，申请过程中有什么问题可以随时问我。 💮我的初衷是希望大家都能找到合适的工作，把平时看到可靠的工作岗位分享给大家，再次提醒🔔内容纯属分享，不涉及任何付款转账哦❗️,211,0,2023-05-11T04:00:00,"""https://ci.xiaohongshu.com/55f4db8e-a7c8-81cf-0915-546d82549de8?imageMogr2/format/jpg/quality/92/auto-orient/strip/crop/450x300/gravity/center"""
645c96c400000000130137d1,🌍👨‍💻只工作不上班？寻找远程办公程序猿！,✈️今日推荐数据工程师、视觉设计师、后端工程师三个岗位 🏄‍♂️感兴趣的小伙伴点击图片查看岗位详情,27,0,2023-05-11T15:18:00,"""https://ci.xiaohongshu.com/53748e5b-b094-b3c0-43ff-6f22e277d11e?imageMogr2/format/jpg/quality/92/auto-orient/strip/crop/450x300/gravity/center"""
63427414000000001d010fd3,📥你准备好成为一名自由职业者了吗？,首先，你需要有一项能实现远程工作的技能。 可以是：内容创作类的技能、技术开发类的技能、绘画设计类的技能、运营类的技能以及市场营销类的技能... 无论是怎么样的技能，只要能通过一台电脑工作，就能够实现远程办公。 - 其次，你还需要有一个能够帮助你实现远程办公的工作环境和心态。 远程办公必备的硬件有： 1️⃣一台能正常运作的电脑或笔记本 2️⃣一个良好的网络环境 3️⃣安静且独立的办公环境，或者至少有一套独立的办公桌椅 4️⃣清晰的摄像头（部分企业可能会需要监督员工工作） 另外，远程办公缺少了环境的束缚，因此，自律也是非常重要的。 - 如果你都满足了以上条件，恭喜你！你已经能够成为自由职业者啦！ 最后，如果你想加入远程办公的行列，欢迎入驻灵灵招平台，在灵灵招，有海量优质的远程工作岗位任你选！ - 另外，灵灵招平台不会主动添加任何人，请大家谨防假冒诈骗。,204,0,2022-10-09T17:00:00,"""https://ci.xiaohongshu.com/b83b26fd-95a0-3f43-4a39-4e39bed8080f?imageMogr2/format/jpg/quality/92/auto-orient/strip/crop/450x300/gravity/center"""
6465c0f4000000000800c021,还有比在家上班更爽的事吗？Web3打工日记(1),不得不说，全职Working from home 是我做过最舒服的工作 	 上一篇笔记很多小伙伴说想蹲关于wfh的经历，我就来啦 在大家找wfh的机会之前首先要想清楚自己想要寻找的是全职还是freelancer的机会，避免浪费不必要的时间。这两者各有利弊，大家可以根据自己的情况来选择 	 还有需要注意的就是，wfh不是对所有岗位都适用的，至少我看到的情况是这样 对于一些可能需要在办公场所对接业务的岗位来说，这样的机会就会相对难找一些 最后就是在哪可以找工作啦！我自己的机会大部分都是在LinkedIn上找到的，全职和兼职岗位都有但是如果你专注寻找freelancer机会的话建议可以去一些更有针对性的网站 	 最后，如果你也想入行Web3工作，请一定不要轻视相关经历的重要性‼️如果你想在这个行业长期发展的话，我建议可以先从参与一些小项目做起，积累经验，等到对行业更熟悉之后再去申请头部公司的岗位成功率会更高 我的经验是，招聘时企业看重个人能力&gt;=web3从业经历&gt;其他行业从业经历 	 我会持续分享一些关于在Web3工作的经验心得，如果大家有什么想了解的话题也可以评论留言，我来写,176,0,2023-05-18T14:08:00,"""https://ci.xiaohongshu.com/7b39f917-3ee0-8761-6b60-049784863222?imageMogr2/format/jpg/quality/92/auto-orient/strip/crop/450x300/gravity/center"""
648be6d70000000013011f82,远程工作中哪些岗位非常缺人？,希梦团队成立以来，每天都会收到大量的咨询与简历。有童鞋问过希梦，目前远程市场上的候选人是否供大于求？一方面确实是的，很多人对于远程办公是很向往的，所以目前已经收到不少简历。但是另一方面，其实很多招聘方也存在找不到合适人选的情况。曾经有招聘方跟希梦说，能够找到符合度80%的已经很不错了。所以，其实选好赛道和岗位，会比盲目海投更重要。 -- 那么下面希梦就来跟大家解读一下，哪些岗位是很好找远程工作的。大家或许可以接触一下，为将来实现远程打好基础。 -- 1.海外投放类。这类的岗位还是很稀缺的，因为国外的投放目前还处于起步阶段，哪怕是国内知名广告公司，基本上也不会涉及出海业务。主要涉及的媒体类投放平台有Facebook、Google还有tiktok，其中tiktok最缺人。 -- 2.运营类。主要是国外独立站运营，这部分人才也十分缺乏，因为市场上大部分的运营是个人，还处于不算成熟的阶段。没有形成专业化的模式，投放的cost和ROI也没有达到一个公司或者品牌的标准。 -- 3.SEO优化师、UI设计师。这类型的岗位的候选人其实也不少，但是大部分招聘方都会要求很细致，比如具体到某个行业某种技能，在这种情况下，就会很难找到符合度高的候选人。另一方面，这些岗位需求量相对较大，导致出现缺人的情况。 -- 以上是岗位的维度，行业的话基本上就是人工智能、新兴品牌、跨境电商等。 “任何时候，选择大于努力。”,48,0,2023-06-16T12:36:00,"""https://ci.xiaohongshu.com/59888dcf-cac1-ff22-5f9f-a072ca3bbca3?imageMogr2/format/jpg/quality/92/auto-orient/strip/crop/450x300/gravity/center"""
