id,title,content,likes,collects,date,image
642567680000000027029e48,伦敦打工人溜回🇨🇳鹤岗办公的快乐谁懂啊！,"家人们，在英国蹲了三年了，终于回家了！ 	 没错我的家乡就是这两年突然就红了的… 打工人的精神北上广——鹤岗！！ 	 感谢天时地利人和! 	 ✈️终于能直飞不隔离！大家也不再谈冠色变了！ 	 👷‍♀️我司每年允许在世界各地远程办公30天 	 ⛱️年假有25天，加上去年没用完的5天，今年可以休假30天！ 	 🇨🇳我司对CN友好，没有数据安全限制，挂个🪜就可以开心上班了 	 ⌚️时差也很友好！ 在伦敦规定工作时间是早9:30 到晚18:30但是没有打卡，具体时间可以灵活安排， 回国之后我就是 下午1点到9点上班，所以可以早上先出去浪再回来打工~ 	 回来什么感受？ 	 🌃可能我在剑桥村儿里呆的太久，回来竟然觉得鹤岗也挺大，尤其是马路非常的宽敞！ 	 👪每天的视频也抵不过面对面的陪伴，在父母身边卸下重担重新做回了小孩子！ 	 👩‍💻回国远程办公根本无心工作😂 好在同事领导知道我三年没回了都理解，都尽量在这期间没有安排太多任务，和我的一对一会议也都按我的时间调整了！ 	 🧍‍♀️又过上了有阿姨的生活！有人给洗衣服打扫房间的快乐谁懂啊！ 	 🛍️实现了网购自由和外卖夜宵自由, 消费的时候脑子里自动除以8，然后狂喜！ 	 🍱随便找个馆子搬去英国都是数一数二的好馆子，人均30RMB吃到爽！ 	 🍚不吃对的，只吃英国贵的和吃不到的！争取回去后三个月内不馋中餐😂 	 🍲花了25块钱吃了伦敦中国城50镑同款的张亮麻辣烫！花了100块吃到了伦敦要200镑分量的东北烧烤！再多吃几顿机票钱就省出来了！ 	 附上一个回国活动清单做参考，妥妥赚回机票钱 ✅体检 ✅配眼镜/近视手术 ✅检查牙齿，拔牙洗牙修牙 ✅做头发 ✅美容院，各种项目安排起来！ ✅囤点日韩系衣服，定制几副穿戴甲！ ✅洗浴泡澡搓澡按摩！",5356,0,2023-03-30T18:41:00,"""https://ci.xiaohongshu.com/8dd3334b-c7e2-c933-b1b1-da03fbb2241d?imageMogr2/format/jpg/quality/92/auto-orient/strip/crop/450x300/gravity/center"""
64067b33000000001300d9c8,27岁 远程办公19个月，我真的太喜欢工作了,如果你也不想上班，应该怎样找远程工作？大部分人可能觉得只有码农，身在海外，进入互联网大厂，才能实现work from anywhere的梦想，做快乐的打工人。并不是。 . 我今年27岁，不是名校毕业生，现在是一家外企的远程打工人。 . 记得我的上一份工作，早上8点出门挤地铁，晚上7点才回到家，每天最大的感受就是精疲力尽。 . 如果你也想远程办公，以下是几点建议： .Linkedin领英 我是通过领英接到offer的，要找远程工作选择Remote（远程）就行。 然后再根据个人的工作经验，去匹配合适的工作岗位和所在的行业。 很多外企会有远程办公的岗位开放，对于远程办公的接受度普遍也更高，有规范的管理制度，同时以结果为导向。 . .快消公司的公z号 很多外资的头部快消品公司，比如日化和食品行业，可供选择的行业范围还是很大的，它们内部都有混合办公或居家办公的选择，不同岗位情况会不同，上面会有招聘的岗位信息，也分为校招和社招。 . .小而美的外企公司 Home base的岗位为销售岗为主，需要有相关行业的渠道经验，或者相关行业证书等等，有留学或海外工作经历也是加分项。 岗位一般不会出现在各种招聘平台，基本靠内推或者猎头公司推荐，难度较高。 . ❌远程工作，时间空间相对自由，不一定适合所有人： 1⃣.销售岗很卷，会有业绩压力 我们公司今年就在优化，从最高峰的十几个调整为个位数，不断提高公司的人效比。 . 2⃣.居家办公容易摸鱼，要主动向上管理和有自我管理能力，确保工作高效完成。 . 3⃣.社牛的人在家呆久了，表示会有点孤独；本社恐表示很满意，不用天天和同事见面，有工作需要可以直接打电话。 . 远程工作≠不工作，希望我们都能做自己喜欢的工作，或者通过不断试错，努力向自己喜欢的工作状态去靠拢。 . 我是沙律，喜欢思考和解决问题，希望和你一起成长。,4263,0,2023-03-07T07:45:00,"""https://ci.xiaohongshu.com/d7ca9992-a348-0d5f-d974-e4dbb55a086f?imageMogr2/format/jpg/quality/92/auto-orient/strip/crop/450x300/gravity/center"""
641832410000000013032512,乡村数字游民：今日工作状态,我的游民生活可能没有那么有意境，那么有氛围，日常可能就是门口拉个小凳子，边晒太阳边工作，休息时间就当村口的gai溜子。 干了几个月，我发现有几件事情真的非常非常重要： 1. 一定要有自己固定的工作时间，高效工作，到点休息，否则你会陷入工作和生活难以区分的状态，压力累积，效率降低。 2. 要坚持每天写任务清单，学习清单，如果不够自律，很容易真的变成gai溜子 3. 和你的合作方保持沟通，积极从对方那里获得反馈，持续改进自己的远程工作和管理方式。 4. 拥有项目管理能力，由于你的同事都是远程或者兼职，永远不要预期他们会替你考虑，要培养自己的项目管理能力，不错过每一个细节 	 希望大家都找到自己喜欢的工作生活方式,351,0,2023-03-20T18:15:00,"""https://ci.xiaohongshu.com/c9235aa8-3cec-4bca-179a-e15f8cd0eab1?imageMogr2/format/jpg/quality/92/auto-orient/strip/crop/450x300/gravity/center"""
640f4cb2000000002700386d,30个100%远程工作公司,"1. 10up 2. Achieve Test Prep 3. Ada Support, Inc. 4. Aha 5. Alleyoop 6. Andela 7. Articulate 8. Avvinue 9. Big Time Studios 10. Coalition Technologies 11. Counterplay Games 12. DiXiO Experts 13. Equivity 14. Feeld 15. GitLab 16. Hopper 17. Goodway Group 18. Green Dot Corporation 19. Hotjar 20. Path Mental Health 21. SitePen 22. Ria Health 23. Toptal 24. Theoremone 25. Vaniam Group 26. Voldex 27. Wing Assistant 28. Working Solutions 29. Yodo1 30. Zone &amp; Co",7821,0,2023-03-14T00:17:00,"""https://ci.xiaohongshu.com/f47d239c-01ea-e327-f253-085479edc95e?imageMogr2/format/jpg/quality/92/auto-orient/strip/crop/450x300/gravity/center"""
6300d95800000000190284ab,远程工作｜自由职业工作怎么找！10+平台推荐,"前阵子发了数字游民生活的笔记，许多小伙伴希望我们能分享找远程工作或是自由接案的平台。 因此整理10+个找寻远程工作及自由接案的免费网站，分享给大家！ 我们也相信远程工作是未来趋势，一起成为数字游民吧！ 1.LinkedIn 多数求职者都听过领英，直接在上面filter 100%远程工作就会看到可以WFH 的工作啦！ 2.glints 主要提供亚洲地区科技新创职缺，有许多远程工作的机会！ 3.Fiverr 这是国外很常用的自由工作者接案平台，只要你有一技之长，都可以在上面建立档案开始接案，不过初期没有太多评价价钱要稍微低一点，争取曝光度！ 4.Working Nomads 可依照自己喜好的工作类型去做选择，程序员、设计、行销、客户服务等自由选择，有些工作会直接列出email 可以直接投递过去！ 5.Upwork 也是国外常用的自由接案平台，里面提供许多接案机会！ 6.Workew 许多公司都有提供远程工作，一样是将履历发给刊登职缺的人，大多数是HR,许多职权也都有标明薪资！ 7.Cake Resume 这是台湾的求职平台，里面可以filter 远距工作，几乎都有标明薪资结构！ 8.Yourator 同样也是台湾求职平台，公司基本上都是新创，提供许多远距工作机会！ 9.圆领 国内远程工作、自由接案平台，求职者可以自行建立档案，把能够提供的技能、服务建上去，就可以和公司媒合啦！ 10.电鸭 国内远程工作平台，大多是开发人员、工程师职位！ 再来还有小蜜蜂、云队友、甜新工厂、Indeed 也都是远程工作平台，不过因为我们没有实际使用过，只能分享这些给大家了！ 有帮助到大家的话，请按赞收藏吧！",6646,0,2022-08-20T20:53:00,"""https://ci.xiaohongshu.com/99dce50f-0b16-15fe-e450-bd5597cb2c99?imageMogr2/format/jpg/quality/92/auto-orient/strip/crop/450x300/gravity/center"""
6343dd32000000001d014af3,远程工作怎么找？时薪10-100美金的工作,"本期重点介绍： 领英LinkedIn, Fiverr, Remote.co, Toptal, 电鸭社区，远程客。 还有很多很棒的远程工作网站我没来得及介绍，今天只是点个题。本期重点是介绍全球著名的远程工作网站，下棋将会介绍全球范围内数字游民中优秀的领导者，内容创作者和nomad社区，敬请期待。",12289,0,2022-10-10T16:52:00,"""https://ci.xiaohongshu.com/f1af4d45-196d-a9b0-5280-3500ba337a05?imageMogr2/format/jpg/quality/92/auto-orient/strip/crop/450x300/gravity/center"""
6370eacb00000000220285e8,分享一家全员远程办公的公司 (3),"2022年4月28日，Airbnb 联合创始人兼 CEO Brian Chesky 宣布：Airbnb 员工可以自行选择远程办公。 Airbnb 向远程工作模式的转变受到了高度评价。根据其新政策，美国和加拿大员工的薪水将由给定职位的单一薪酬层级而不是基于位置的层级决定，从 9 月开始，Airbnb 的 6,000 多名员工将可以选择最多为三个来自 170 多个国家/地区的数月。 	 7月7日消息，当地时间7月6日，Airbnb（爱彼迎）宣布将与全球20个目的地合作，让包括巴厘岛、加那利群岛、哥伦比亚、开普敦、加勒比海在内的任何地方的生活和工作都变得更加轻松。在接下来的几个月里，Airbnb将与每个组织密切合作，为他们的目的地创建专门的定制中心，展示当地最好的长期住宿清单以及与入境要求和税收政策有关的重要信息。平台还将与目的地合作开展教育活动，以促进负责任的托管和作为远程工作者的旅行。目的地枢纽预计将在今年晚些时候启动。此前，Airbnb今年4月份在宣布允许员工自由选择办公地点的同时，推出了“在任何地方生活和工作”（Live and Work Anywhere）的计划。 	 Airbnb爱彼迎携手合作的全球20个目的地包括： 墨西哥，南下加利福尼亚州 印度尼西亚，巴厘岛 意大利，普利亚大区，布林迪西 阿根廷，布宜诺斯艾利斯 加勒比海 西班牙，加那利群岛 南非，开普敦 哥伦比亚 阿拉伯联合酋长国，迪拜 意大利，弗留利-威尼斯朱利亚 葡萄牙，里斯本 马耳他 墨西哥，墨西哥城 美国，加利福尼亚州，棕榈泉 澳大利亚，昆士兰 法国乡村地区 奥地利，萨尔茨卡默古特 美国，佛罗里达州，坦帕湾 泰国 美国，俄克拉荷马州，塔尔萨 	 这个计划建立在新冠疫情期间的工作基础上，爱彼迎与160多个政府及旅游目的地营销组织（DMO）合作，全力支持旅游业复苏。这其中就包含鼓励包括塔尔萨、马拉加、布宜诺斯艾利斯和法国农村市长协会等地在内的远程办公计划。 	 Airbnb的官网显示，中国地区还有正在开放中的岗位。感兴趣的同学可以加入这场远程工作和数字游民的浪潮中来！",2781,0,2022-11-13T21:02:00,"""https://ci.xiaohongshu.com/ba563a54-4d6f-8eea-a8c4-65540550e690?imageMogr2/format/jpg/quality/92/auto-orient/strip/crop/450x300/gravity/center"""
647b10a10000000013010316,这里有年薪$200k神仙远程工作机会🔥,"哈咯我又来啦 今天想跟大家分享一下我收集到的四个神仙小众远程工作招聘网站+ 分享我在家工作的一天 	 🔮crossover是我个人很推荐的一个平台，在这里你可以先做系统的技能和语言测试，如果通过的话还会有工作技能相关测试，最大程度减少了大家对于自己没有很耀眼工作经历的顾虑 Skills &gt; experience，web3精神🎉 上面的机会少而精，很多＄100k以上的岗位 	 🔮weworkremotely的优势在于可以找到大量很优秀项目的远程机会，大部分都是已经完成1-2轮融资，深耕某个细分领域的潜力股 这些公司大部分都是年轻人组成，也有较为完善的远程工作系统 	 🔮remotely是一个面向所有想要找远程机会的求职者的平台，岗位覆盖很全面，包括法务，hr，产品等机会相对较少的方向网站上还有很多对想成为数字游民的友友们很有用的教程，包括在哪些地区可以拿哪些证件合法做游民等等 	 🔮nodesk.co 上你可以找到来自各行业头部公司的远程机会包括reddit, Shopify, coursera, Figma等大家耳熟能详的公司，值得关注 	 其实我在家工作的一天比较简单，因为时间可以自己掌握分配，所以我会尽量花一些时间去做一些健康的食物吃+运动，健康漂亮和努力工作都是为了可以变成更好的自己，一样重要 	 大家有什么感兴趣的话题都可以留言，我在后面的笔记会分享",991,0,2023-06-03T18:06:00,"""https://ci.xiaohongshu.com/b0466f62-ab70-40fa-3a21-166227f512f0?imageMogr2/format/jpg/quality/92/auto-orient/strip/crop/450x300/gravity/center"""
637b50cc000000000a038d03,远程工作给我带来的意外惊喜,10月初终于找到了工作，直到这个月转正才敢发这篇小红书 毕竟今年试用期没通过的例子太多了 果然，我的一个同期在试用期最后一天被辞退了，又万幸我通过了 因为是远程工作，公司大本营base在美国 所以我的上班时间是早上6点到下午3点 一开始接这个offer只是为了先生存下去 现在慢慢地却喜欢上了这份工作 少了通勤，少了办公室社交 多了自主安排的时间 还间接改变了我熬夜的坏习惯 	 这半年的失业经历让我明白了 在现在这个不安稳的日子 唯有好好沉淀自己，努力提升 好好赚钱，好好攒钱，才是正确的生存之道 	 所以，为了省钱，省房租，为了减少无效社交，我回家了，还回到了农村老家，远离一切尘嚣浮华 	 接下来就一起来看看我是如何升级打怪，如何开启低物质的人生,199,0,2022-11-21T18:19:00,"""https://ci.xiaohongshu.com/9a7597e1-a892-e02d-b7c2-77fd67648556?imageMogr2/format/jpg/quality/92/auto-orient/strip/crop/450x300/gravity/center"""
646f220c0000000013005567,月薪上万却无所事事的工作,全职的远程工作，没有kpi不用打卡，经常性每日工作时长不足1小时 每天都要对抗无聊，今天是在咖啡厅看蓝天,450,0,2023-05-25T16:53:00,"""https://ci.xiaohongshu.com/9cfd5f1c-3647-0f3d-dee1-54523e7ea042?imageMogr2/format/jpg/quality/92/auto-orient/strip/crop/450x300/gravity/center"""
6485471300000000270001f2,建议女生都去找远程工作·国内（1）,"如果你也不想上班，应该怎样找远程工作？ . 我是沙律，在外企远程工作中，希望所有女生都能找到喜欢的工作，一起远程办公吧~ . 前面笔记的评论区，对远程工作的询问特别多，以下是base国内且不限城市的： .TELUS International 行业：IT 服务与咨询 城市：国内 岗位：Work From Home China 具体见图二 . .Go City® 行业：旅游观光 城市：国内 岗位：Business Development Manager, China - FTC 具体见图三 . .LONGi Energy/隆基新能源 行业：新能源行业 城市：国内 岗位：海外专业服务经理 具体见图四 . .Premier Research 行业：生物技术研究 城市：国内 岗位：Associate Director, Business Development - China 具体见图五 . 总结：以上岗位都是base在国内的，需要有相关的学历背景和行业经验，详见图片的JD。 . 关于常见的工作问题，去翻一翻我的笔记： ☑️建议女生：找工作，一定要去投递的快消外企 ☑️建议女生都去找远程工作·广州（一） . 评论区留下：你想了解的岗位或者城市的分享，我会尽量整理新鲜出炉的公司清单。",1176,0,2023-06-12T07:30:00,"""https://ci.xiaohongshu.com/f0d3e981-f53f-b582-9596-65a681878f13?imageMogr2/format/jpg/quality/92/auto-orient/strip/crop/450x300/gravity/center"""
6367ae3e000000000600a97f,分享一家全员远程工作的公司 (2),"今天和大家介绍这家公司——Gitlab 全球知名开源代码托管和DevOps平台GitLab是世界上全面践行远程办公最深入的一家公司，自2014年成立之初就一直在执行 All-Remote 全员远程办公，是当之无愧的远程先驱。无论是其产品、工作方式、还是工作文化，处处都流露着浓浓的“远程风”和“透明风”。对于GitLab来说，远程办公要么不用，要用就要用得彻底。在多年的实践中，GitLab摸索出一条独特的远程办公道路。 	 当前很多公司尝试远程办公都是被迫的 (如由于疫情)，或者是混合的，如一周三天在办公室两天在家。而GitLab在远程办公上并没有扭扭捏捏，而是干干净净、彻头彻尾的全员远程办公 (All-remote)。员工可以选择在任何地方工作，无论是自家的床上、还是楼下的咖啡店、甚至是沙滩躺椅上，只要能完成任务就没有任何问题。这种全员远程办公并不是一时兴起，也不是追逐潮流，而是公司联合创始人兼CEO Sid Sijbrandij的主动行为。 远程工作绝不是简简单单地把传统线下办公的方式照搬到线上而已。 	 下面是 GitLab 针对远程办公提出的七项原则： Work from anywhere you want（随时随地工作，消除所有干扰） Communicate Asynchronously（异步沟通，减少任务切换并且避免电子邮件满天飞） Recognize that the future is unknown（对风险的敬畏，先落实后承诺） Have face-to-face meetings online（在线视频会议，沟通很重要，即使只有一分钟） Daily stand-up meetings are for bonding, blockers and the future（每日站会是为了建立人与人之间的联系 ，解决阻塞，规划任务，不必谈论昨天做了什么） Bond in real life（现实生活中的纽带，线下团建，玩在一起很重要） Give credit where it&#39;s due and remember to say thank you（给予应得的赞扬和感谢，不要吝啬您的赞扬）",1976,0,2022-11-06T20:53:00,"""https://ci.xiaohongshu.com/ecd61f3d-2323-74e8-42cb-1e1acb7cb350?imageMogr2/format/jpg/quality/92/auto-orient/strip/crop/450x300/gravity/center"""
6368643e000000000602bfbf,找远程工作渠道盘点💰在家就能额外多挣1w+,hi大家好我是桃子皮🍑之前笔记有小伙伴问我如何读研还能有稳定的1.5-2w收入，主要是做了份国外公司的part-time哈哈，大家平时工作不忙也可以考虑做一份远程增加收入，每月轻松多一些小钱钱还是很香的～ . 之前答应给大家整理可以找远程工作的渠道，作业太多一直拖到今天才整理好，希望对大家有帮助呀～ . 🌟海外靠谱平台 薪水非常可观，差不多是国内的3-4倍，但大部分需要英语作为工作语言 . 1️⃣Remotive：我个人常用的一种，远程工作岗位种类多且正规，也有时下的内容策划、新媒体运营等岗位，对国内互联网小伙伴适配性比较高 . 2️⃣Linkedin：直接搜索“远程”“jian职”等关键词，会有大把大把的工作，这是我用过特别靠谱的渠道了，而且还会持续给你推大量远程岗位，缺点是需登海外版才行 . 3️⃣Romote OK：海外比较成熟和专业的远程工作招聘网站，全职、jian职和实习都有，很正规可以签合同，设计、市场、hr、销售等岗位都有招，相对来IT、技术岗会更多些 . 4️⃣Working Nomads： 这个网站非专业性岗位会丰富一点，从设计、人力、文案、电商等各领域都有招人，强专业的法务、金融、IT也有，这个有对雇主收不少的保证金来确保岗位真实正规~ . 5️⃣Up Work：类似国内的&quot;猪八戒外包”平台，很多像亚马逊等全球名企都在上面找jian职，也有一单一结的设计、文案、翻译派单 . 🌟国内靠谱平台 薪资较低大概每个在3-5k左右，也有大量次结项目，但门槛低很多工作0经验也ok，大部分是国内小伙伴熟悉的岗位好上手 . 1️⃣云队友：集合了远程固定工作+远程外包单子，里面文案、翻译、视频剪辑、账号运营、市场策划等等都有，也可注册自己的profile等雇主找你 . 2️⃣小蜜蜂云工作：远程短期、长期、派单都有，也是种类很多可以按照岗位类别、经验要求搜索自己合适的，门槛相对较低 . 3️⃣bs直聘：也跟linkedin一样，搜“远程”“jian职”等关键词，网易腾讯这种大厂也会不定时放出可远程jian职的岗位 . ⚠️再次提醒：不论怎样的远程工作，让你提前交钱的不要🙅🏻‍♀️过度索取个人信息的不要🙅🏻‍♀️ . 大家还有啥想看的内容，欢迎评论区留言我有空就码字呀~     @校园薯,4524,0,2022-11-07T09:49:00,"""https://ci.xiaohongshu.com/428df86a-a8a6-c768-ad5e-9f5aeca8b472?imageMogr2/format/jpg/quality/92/auto-orient/strip/crop/450x300/gravity/center"""
6343d206000000001d019cd5,App｜这就是我梦想中的远程自由工作吗🔥,🔍圆领🔍 苹果✔️  安卓✔️  网站✔ 	 🔸不用把时间浪费在经营职场人际关系上，不用融入五花八门的企业文化，只“售卖”自己的技能和时间，这才是工作的本质啊～～ 🔸建议每个想尝试自由职业的朋友都用一用这个平台，包装介绍自己的专业技能，明码标注你的时间价值，自由选择想接的短期任务or长期合作🆒以后一边旅行一边工作不是梦！ 🔸上面互联网行业的任务比较多，短期的比如做PPT、设计海报、写一篇推文等等，没有什么特别高的门槛，有一技之长都能做；长期的有运营、研发、市场、设计、产品五类，可以建议稳定的合作关系～,4348,0,2022-10-12T19:04:00,"""https://ci.xiaohongshu.com/0cc57318-e36b-0162-625f-528e1f1d2f06?imageMogr2/format/jpg/quality/92/auto-orient/strip/crop/450x300/gravity/center"""
644a8d6c00000000120311b1,数字游民的新身份证,终于到了嘿嘿,208,0,2023-04-27T22:57:00,"""https://ci.xiaohongshu.com/2f80255b-964a-233f-0e74-a82eb2e5d26b?imageMogr2/format/jpg/quality/92/auto-orient/strip/crop/450x300/gravity/center"""
633428ab00000000170391ce,为野兽派做的远程静物美术指导📃,好久没有写和工作相关的贴文～ 	 五月在上海还在封闭中的时候收到了工作邀请为野兽派端午节新品拍摄做美术指导的工作。今年的端午節可以說是意義非凡，意味著也許能從艱難中和家人相聚？意味著一些可走上街去的希望，在當時我這麼想著。於是希望整一個campaign應該是具有暖意的。 	 由於被封在家所以所有的溝通對接工作都是在線上完成，再請當地的小夥伴進行執行。遠程工作最重要的就是能夠有準確清楚的拍攝方案，對靜物來說還必須要有具體的道具使用和擺放方式。在視覺溝通為主的方式上我們採用PS進行效果圖的繪製。效果最好的毫無疑問應該是3D渲染圖因為可以模擬燈光質感還可以進行後期角度調整等等，但由於時間預算等問題利用PS繪製的效果圖還是最理想的視覺溝通方式。除此之外，以實際拍攝為主的campaign，效果圖只是中途溝通的方式，實際拍攝會有其他很多的細微變動，所以只要效果圖能夠表達清楚意思（草圖/PS/3D…）都是適合的方式。效果圖雖然限制了一部分的想像空間和臨場發揮的能動力，但也能確保遠程工作安全順利地進行。 	 對於不需要做出具體layout的set，往往我們用1-2張最精準的參考作為主要mood，加以推薦道具的使用和擺放形式說明（例如P8） 	 之前有朋友問說做set design 或是 art direction 你最喜歡的是哪個部分，以前會覺得思考創意的時候以及真正拍攝當天的隨機應變讓我覺得很痛快，但現在也許我開始enjoy這個職業中的任何一部分，抱著把每一部分最好的心情在工作（當然除了報銷😑） . . .,223,0,2022-09-28T18:57:00,"""https://ci.xiaohongshu.com/4ea25381-06f6-615a-6707-8f13149c0835?imageMogr2/format/jpg/quality/92/auto-orient/strip/crop/450x300/gravity/center"""
