id,title,content,likes,collects,date,image
647174370000000011010f52,月薪11k🔥大专即可🔥携程英语客服内推,这只是其中一个，不知道大家喜不喜欢🔥 我们那边类似的、门槛更低有更多✅ 这个工作真的非常好✅ 不知道各位外语人喜欢嘛嘛喜欢的❤️★ 告诉我111吧 	                 #,8,0,2023-05-27T11:08:00,"""https://ci.xiaohongshu.com/6b2131a0-4cfe-0310-8050-07a2be5e452f?imageMogr2/format/jpg/quality/92/auto-orient/strip/crop/450x300/gravity/center"""
647d53d6000000001300d0b5,20k/月的英专生英语远程教育兼职🔥,这只是其中一个，不知道大家喜不喜欢🔥 我们那边类似的、门槛更低有更多✅ 这个工作真的非常好✅ 不知道各位外语人喜欢嘛嘛喜欢的❤️★ 告诉我111吧 	                 #,4,0,2023-06-05T11:17:00,"""https://ci.xiaohongshu.com/70334ba6-dc9f-1d65-981c-45e90bb0f73d?imageMogr2/format/jpg/quality/92/auto-orient/strip/crop/450x300/gravity/center"""
644f3d5400000000130130eb,30/h的远程中文转写实习🔥英专/小语种🉑️,真的非常适合外语专业的宝宝呀～ ♥️ 和小星星 扣111告诉我！ 我教你！,52,0,2023-05-01T12:17:00,"""https://ci.xiaohongshu.com/de96fe40-d0e2-a0cc-956e-34d7dde799d9?imageMogr2/format/jpg/quality/92/auto-orient/strip/crop/450x300/gravity/center"""
648b35d50000000013010102,「Web3新动态」ChatGPT突发重磅更新！,当地时间 6 月 13 日，OpenAI 发布函数调用及其他 API 更新，具体包括： 在 Chat Completions API 中新增新的函数调用，能让模型在需要的时候调用函数并生成对应的 JSON 对象作为输出；函数调用使开发人员可以更可靠地从模型中获取结构化数据 更新了更可操纵版本的 GPT-4 和 GPT-3.5 Turbo； 3.16k 上下文版本的 GPT-3.5-turbo（标准的是 4k 版本）； 先进的嵌入模型（embeddings model）成本降低了 75%；  GPT-3.5-turbo 输入 token 成本降低 25%，低至每 1K token 0.0001 美元； 宣布 3 月发布的 GPT-4 和 GPT-3.5-turbo 的初始版本将进行弃用和升级应用程序将使用更稳定的模型 GPT-3.5-turbo、 GPT-4 和 GPT-4-32k，这些模型将于 6 月 27 日自动升级。 我是一只咚咚酱，一个Web3从业者｜老运营人｜新辅导员。 	 点赞👍+关注follow+收藏👌🏻，持续运营知识｜面试方法｜Web3干货｜职场妙招｜自我提升,1,0,2023-06-16T00:01:00,"""https://ci.xiaohongshu.com/026ad76b-8ac3-64c7-6373-fe37bce30897?imageMogr2/format/jpg/quality/92/auto-orient/strip/crop/450x300/gravity/center"""
648b3de10000000013001cdd,🇨🇦 近期startup内推&amp;面试 更新,推了几个朋友和网友，但进展略慢。 	 转码上岸2年，很庆幸有这些机会。 结合组里project来找leetcode problem、总结checkponts、挑选设置coding platform… 准备面试也是学习的过程。 找工作面试也是个双向选择的机会，双方都要擦亮双眼。 	 anyways，希望各方都顺利。,20,0,2023-06-16T00:35:00,"""https://ci.xiaohongshu.com/45174035-82bc-3690-2d27-8670dc8c2a74?imageMogr2/format/jpg/quality/92/auto-orient/strip/crop/450x300/gravity/center"""
647424710000000013001f59,不坐班🔥在校英专生可🔥爱奇艺远程兼职,这只是其中一个，不知道大家喜不喜欢🔥 我们那边类似的、门槛更低有更多✅ 这个工作真的非常好✅ 不知道各位外语人喜欢嘛嘛喜欢的❤️★ 告诉我111吧 	                 #,6,0,2023-05-29T12:05:00,"""https://ci.xiaohongshu.com/4a41e54a-f7eb-49c5-da43-8fc6484d9678?imageMogr2/format/jpg/quality/92/auto-orient/strip/crop/450x300/gravity/center"""
646651f7000000001303c9de,Day2「海外运营工具分享」热门内容搜索工具✅,今天分享的是BuzzSumo，一款广受欢迎的内容分析和社交媒体工具，旨在帮助用户发现热门内容、分析竞争对手和行业趋势，以及提高其内容营销和社交媒体策略的效果。 	 工具：BuzzSumo 咚咚推荐指数：四颗星 适合人群：需要搜集关键词时事热点的新媒体人 	 BuzzSumo的主要功能包括以下几个方面： 🔍 内容发现：用户可以使用BuzzSumo搜索关键词、主题或特定领域，找到与之相关的热门文章、新闻、博客或社交媒体帖子。它还提供了筛选和顺序选项，使用户能够找到在特定时间范围内受欢迎或具影响力的内容。 📊 社交媒体分析：BuzzSumo可以帮助用户分析在社交媒体上获得比较大影响力的内容。它提供关于文章或页面在各个社交媒体平台上的分享次数、互动指标和影响力评分的数据。这有助于用户了解哪种类型的内容在社交媒体上更受欢迎，从而指导他们的内容战略. 🕵️ 竞争对手分析：用户可以使用BuzzSumo来研究竞争对手在社交媒体上的表现。通过输入竞争对手的域名或社交媒体账号，用户可以查看竞争对手的热门内容、社交媒体分享情况以及他们的受众互动。这有助于用户了解竞争对手的策略并找到自己的优势. 🎯 受众洞察：BuzzSumo提供有关特定主题或领域的受众洞察。用户可以了解目标受众对特定主题的兴趣和互动程度，以及他们在哪些社交媒体平台上活跃。这使用户能够更好地了解受众需求，并针对他们的兴趣创建有针对性的内容. 总之，BuzzSumo是一个强大的工具，通过提供内容发现、社交媒体分析、竞争对手分析和受众洞察等功能，帮助用户优化其内容战略和社交媒体策略，提高内容的影响力和在线表现. 🚀💡 	 我是一只咚咚酱，一个Web3从业者｜老运营人｜新 辅导员。点赞👍+关注follow+收藏👌🏻，我将持续分享运营知识｜运营工具｜面试方法｜Web3干货｜职场妙招｜自我提升 @知识薯     @薯队长     @薯管家     @薯条小助手,3,0,2023-05-19T00:27:00,"""https://ci.xiaohongshu.com/d44c40e1-a087-bf9e-d2c6-6d0a2b739aa3?imageMogr2/format/jpg/quality/92/auto-orient/strip/crop/450x300/gravity/center"""
64571af30000000027028b64,50/题的英专生作业帮英语审核实习✅,真的非常适合外语专业的宝宝呀～ ♥️ 和小星星 扣111告诉我！ 我教你！,56,0,2023-05-07T11:28:00,"""https://ci.xiaohongshu.com/764c33a6-1885-d5a1-3dcf-67132ee06117?imageMogr2/format/jpg/quality/92/auto-orient/strip/crop/450x300/gravity/center"""
648908780000000013001027,远程工作机会｜Intelliswift商业分析,"今日整理的岗位新鲜出炉，这些你可能不知道的H1B公司，扩大北美求职投递范围  	 公司名称：Intelliswift Software, Inc. 岗位名称：Business Analyst 办公地点: Remote 	 🖇公司简介&amp;H1B申请情况： Intelliswift软件公司构思、建造和支持世界上最令人惊叹的技术产品和解决方案 	 H1B情况：从 2020 财年到 2022 财年，Intelliswift Software, Inc. 已提交 107 份 H1B 申请，平均薪资水平在119，109 美元 	 🖇岗位要领： -与业务团队成员合作，通过利用有效的数据收集技术确定业务需求 -评估和发展各种影响战略举措的分析和项目规划的方法 -分析和评估从多个来源收集的数据 -调和差异，并将一致的方法应用于数据解释和性能测量结果 -与业务部门、开发团队和技术部门持续联络 -可以领导业务部门分析、部门或操作程序、报告、财务分析、沟通和/或战略规划活动的发展工作等 	 📌📌📌 公司筛选自2022年Top 100 H1B Sponsors 排名今年最新开放岗位机会。岗位公司不定时有变化，以公司官方信息为准 	 在美国还有很多规模大提供身份支持的公司，只不过不在留学圈里那么响亮。蔓藤会推荐更多不同领域的公司机会，将朋友们投递范围尽可能扩大 	 需要【求职帮助】和【内推资源】或者公司更多的信息可以留言或私✉蔓藤哦。投递了很多岗位但都没有结果，想要了解自己的问题所在可以找🆓蔓藤咨询哦",19,0,2023-06-14T08:23:00,"""https://ci.xiaohongshu.com/031f77c3-6887-2e8c-2f86-75d6890be042?imageMogr2/format/jpg/quality/92/auto-orient/strip/crop/450x300/gravity/center"""
6457ae1800000000270011e5,住进村里后，再也不想回城市卷了,出来旅居一年了，选择的都是风景优美，气候宜人的地方。这段时间住进了海南文昌的一个小村子里。 这里有成片成片的椰林，超级nice的农村居民，非常亲民的物价，椰子6块一个，炒粉10块，冰红茶3块一杯，而且还能续杯。 每天早上，我会睡到自然醒，然后起来工作一会儿。之后，我会骑车去镇上吃个早茶。如果不想在房间里工作，我会到椰林里工作。工作忙完之后，我会去数字游民空间找居民聊聊天，喝喝咖啡，玩玩陆冲，或者骑上电瓶车漫无目的的穿梭在各个村庄椰林里。有时候，我也会和小伙伴一起去海边泡水、赶海或者敲生蚝。 我深刻地感受到，开心快乐的生活并不需要太多的物质。每天吃好一日三餐，健健康康的就很好了。想想之前在大城市的生活，其实那不是生活，只能叫活着。现在的生活，虽然简单，但是充满了乐趣和美好。 	 住进村里后，就再也不想回城倦了，城市里的节奏太快了，人们都在追逐更多的物质和金钱的成功，而这种追求往往会让我们失去内心的平静和快乐。我们不断地追求更高的工资、更好的房子、更好的车子，但是这些东西并不能带给我们真正的幸福和满足感。反而，过度的物质追求会让我们感到疲惫、焦虑和失落。 因此，我不想再回到城市的卷帙浩繁和压力中。相比之下，村庄的生活更简单、更自然、更幸福。这里的人们不会被繁琐的工作压垮，也不会在物质的追求中迷失自己。他们享受着生活的乐趣，感受着自然的美好，过着自己喜欢的生活方式。这种生活方式，让人们感到轻松、自在和快乐。 所以希望我们可以停下来，放慢脚步，感受生活的美好。不要过度追求物质和金钱的成功，因为那样会让我们失去自己的内心。相反，我们应该注重内心的满足和平静，享受每一个简单而美好的瞬间。只有这样，我们才能拥有真正的幸福和快乐。,72,0,2023-05-07T21:56:00,"""https://ci.xiaohongshu.com/1f538a20-e73d-b5ff-a780-078ac53995ba?imageMogr2/format/jpg/quality/92/auto-orient/strip/crop/450x300/gravity/center"""
648ada00000000002701303c,🔖AppleMagazine July 2022 数字牧民专题,“越来越多的人选择将远程办公与旅行结合起来，以换取最大限度的旅行时间。” 	 从核心城市离开，选择游牧的远程办公者会拥有更低的生活成本，甚至更为优越和税收激励措施，也带来更多自由。这对于传统上依赖气候与假期的旅游行业也更具裨益，甚至可以在繁忙的“假期”中进行更长时间的旅行，从而拉平旅行高峰期的“峰值”。 	 “数字牧民已经改变了旅行的格局，也许是永远地改变。虽然高管们仍在喋喋不休地讨论员工坐班的决定，但远程工作者正轻松惬意地在远方发送着电子邮件。”,3,0,2023-06-15T17:29:00,"""https://ci.xiaohongshu.com/0497e9f4-9c56-9a77-397e-5d78ae9d346e?imageMogr2/format/jpg/quality/92/auto-orient/strip/crop/450x300/gravity/center"""
648a3ef20000000013035fed,远程工作机会｜GETIDA商业智能分析师,今日整理的岗位新鲜出炉，这些你可能不知道的H1B公司，扩大北美求职投递范围  	 公司名称：GETIDA 岗位名称：Business Intelligence Analyst - RevOps 办公地点: Remote 	 🖇公司简介&amp;H1B申请情况： GETIDA是SIB控股公司的一部分，是全球第一大市场审计和恢复解决方案 	 H1B情况：Getida Llc  公司在 2020 至 2022 财年提交了 4 份 H1B 申请，平均薪资水平在71，011美元 	 🖇岗位要领： -在ETL流程、分析驱动的报告和微软BI栈，包括SSIS方面有丰富的经验 -熟练掌握微软Excel和SQL是必不可少的 -优秀的沟通和人际交往能力 -注重细节，关注数据的准确性和质量 -具备跨团队合作和管理多个优先事项的能力 -熟悉Tableau或类似的数据可视化工具是非常必要的 -拥有计算机科学、信息系统或商业分析等相关领域的学士学位者优先 	 📌📌📌 公司筛选自2022年Top 100 H1B Sponsors 排名今年最新开放岗位机会。岗位公司不定时有变化，以公司官方信息为准 	 在美国还有很多规模大提供身份支持的公司，只不过不在留学圈里那么响亮。蔓藤会推荐更多不同领域的公司机会，将朋友们投递范围尽可能扩大 	 需要【求职帮助】和【内推资源】或者公司更多的信息可以留言或私✉蔓藤哦。投递了很多岗位但都没有结果，想要了解自己的问题所在可以找🆓蔓藤咨询哦,5,0,2023-06-15T06:28:00,"""https://ci.xiaohongshu.com/7f97141e-e8d5-ed7b-d5ca-2d274ac559ab?imageMogr2/format/jpg/quality/92/auto-orient/strip/crop/450x300/gravity/center"""
6468497f0000000013011b24,100/h🔥proudkid远程英语教育兼职✅,真的非常适合外语专业的宝宝呀～ ♥️ 和小星星 扣123告诉我！！ 我教你！,13,0,2023-05-20T12:15:00,"""https://ci.xiaohongshu.com/fc61cda3-4fdc-fd04-cc0a-7a22869630b4?imageMogr2/format/jpg/quality/92/auto-orient/strip/crop/450x300/gravity/center"""
6487b046000000001203dd5c,🏥 每周中英翻译对照表：hospital 医院,🔴 Public Health Agency of Canada  加拿大公共卫生署 🔴 Chief Medical Health Officer  首席医疗卫生官 🔴 teaching hospital  教学医院 🔴 referral hospital  转诊医院 🔴 trauma centre  重创护理中心 🔴 triage  检伤分类站 	                                                    	 @SFU 口笔译课程,0,0,2023-06-13T08:54:00,"""https://ci.xiaohongshu.com/86fcd866-9c51-7107-12b9-41a3cf53b48a?imageMogr2/format/jpg/quality/92/auto-orient/strip/crop/450x300/gravity/center"""
63f019450000000012031264,不想上班，远程工作怎么找 2/3,"上一篇分享了10个海外远程工作网站，继续分享海外远程工作网站 part2 	 11.	flexJobs-该网站收集了来自不同行业和领域的远程工作机会，包括编程、写作、设计、客户服务和营销等。 12.	We Work Remotely 该网站收集了来自不同领域和行业的远程工作机会，包括软件开发、设计、客户服务和市场营销等。 13.	LinkedIn (领英) 是一个全球性的职业社交网络,企业可以在LinkedIn上发布招聘信息.个人用户可以在LinkedIn上展示自己的职业经历和技能，拓展人脉和职业发展机会。 14.	Virtual Vocations 帮助人们找到各种类型的远程工作，包括编程、设计、教育、营销和医疗保健等。 15.	Jobspresso https:包括软件开发、设计、客户服务和写作等 16.	Working Nomads 	 17.	Remotive 18.	Pangian 19.	NoDesk 20.	JustRemote 是一个提供各种类型远程工作机会的网站，他们收集了来自不同领域和行业的远程工作机会，包括软件开发、设计、营销、客户服务和管理等。该网站还提供远程工作的建议和资源，帮助人们实现自由职业和远程工作。",299,0,2023-02-18T08:18:00,"""https://ci.xiaohongshu.com/d226af01-a8f6-931d-752d-30e09f0609dd?imageMogr2/format/jpg/quality/92/auto-orient/strip/crop/450x300/gravity/center"""
6489ef300000000013011839,数字游民毕业倒数第97天,白天在湖边的咖啡厅办公 跟要见面的KOL电话了1个小时 可真能聊 估计见面就更能说了 我毕业之后的第一份工作是在电商公司做直播运营 每天早9晚12 甚至通宵 被PUA了2年之后终于下定决心小命要紧 离职之后去了一家做软件的公司 主要负责日本KOL拓展 这时候我已经决定之后往日本KOLBD方向发展了 这是我转行之后第一份工作 月薪6000扣完5险1金到手5000多 感觉没花什么钱但是月月光 转行穷3年是真的 但我在这家公司只干了3个月 之后在朋友的介绍下 在目前所在行业的公司兼职了3个月 积累了一些同类型KOL资源 后来由于业绩过差（团队已存在6个月业绩还没破10万）团队被解散 各种投简历➕面试后进入了这家行业top5的公司 一开始top5公司觉得我资历不够说我没通过面试 当我正在准备接受另一家公司的offer时 top5公司的hr又跟我说可以让我来试试 于是果断放弃了另一家 入职了现在这家公司 我想可能是BD这个岗位门槛比较低 在行业干了3个月的小白也能进入大公司 所以说如果有想转行的小伙伴 也可以先从这个岗位开始 但是这个岗位也有它的优点和缺点 之后还想说说面试经验 但是今天太困了要睡了明天还要去出差 改天再聊        @小红书成长助手 @小红书创作学院,2,0,2023-06-15T00:47:00,"""https://ci.xiaohongshu.com/f0475dbd-23bc-7ee7-3542-4fe35a86ee48?imageMogr2/format/jpg/quality/92/auto-orient/strip/crop/450x300/gravity/center"""
64854ed00000000013010a37,播客推荐 | 聊聊数字游民 远程工作 个体户,这是我的播客「市井雄心」的第二期节目： 	 本期是单口，讲讲我对于数字游民、远程工作、自由职业、个体户、副业… 等等一系列概念的的一些观察和理解。也是我近段时间来在职业和工作这条人生主线上的一些思考： 	 00:42 在互联网上赚钱的四种方法 01:39 远程办公的福利与副作用 06:45 不改变生产关系就要面临脆弱性 14:46 自由职业/个体户可能是一种主流出路 20:38 个体户拥有对抗周期的反脆弱性 30:04 创作者手中有着无边际成本的杠杆 35:02 作为个体的独特优势 41:46 AI是新时代的个体杠杆 51:31 做这档播客我的个人收获 56:42 我就是那个朝气蓬勃的行业 	 欢迎在小宇宙app，苹果播客，Spotify或其他泛用性播客客户端收听。期待反馈和交流呀。,8,0,2023-06-11T12:34:00,"""https://ci.xiaohongshu.com/9587c2eb-cd85-a1fc-a402-fe73374f95c4?imageMogr2/format/jpg/quality/92/auto-orient/strip/crop/450x300/gravity/center"""
633eab4c000000001d0176fd,那些导师认为你会，却无人教你的科研入门46,那些导师认为你会，却无人教你的科研入门46,140,0,2022-10-06T20:30:00,"""https://ci.xiaohongshu.com/98be75e3-c67e-dcd8-38eb-ac8a7ec481ca?imageMogr2/format/jpg/quality/92/auto-orient/strip/crop/450x300/gravity/center"""
648ca8390000000013013abf,6月远程全职职位推荐,需要沟通学习能力要强 必须的是会python 金融知识要有基本的概念,4,0,2023-06-17T02:21:00,"""https://ci.xiaohongshu.com/06aac246-2fa8-78d2-2c2f-d88b466078aa?imageMogr2/format/jpg/quality/92/auto-orient/strip/crop/450x300/gravity/center"""
642eb708000000001203c4a0,翻译不只有口笔译，戳图详解～,翻译不只有口笔译，戳进来看看这些你不了解的翻译工作！,26,0,2023-04-06T20:11:00,"""https://ci.xiaohongshu.com/f2a30433-6168-cf91-0e52-91716cfcad9b?imageMogr2/format/jpg/quality/92/auto-orient/strip/crop/450x300/gravity/center"""
64800e360000000013003387,恢复对外汉语线上教学｜美国小朋友返回上课,由于上一份临时工作较忙，在老板的要求下暂停了线上对外汉语教学，现在较忙的活结束了，开始恢复线上教中文。 	 今天是很早就已经成为我学生的美国初中生小朋友，他的中文很好，我不需要用英文辅助便可完成教学。在我恢复上课后，他也是尽早回来了我这里。这节课马上开始。 	 这个线上工作也是我广交天下朋友，练习英语听说的同时，还能赚点生活费零花钱的主要途径。,3,0,2023-06-07T12:57:00,"""https://ci.xiaohongshu.com/a20eb640-ac8c-8698-6799-c54f2192fa68?imageMogr2/format/jpg/quality/92/auto-orient/strip/crop/450x300/gravity/center"""
6454c86100000000130301c2,关于35+职场危机、副业和远程工作那些事儿,坐标二线城市，女儿上三年级。老公在一家小型公司做研发。 我在一家中国业内排名前50的大型公司，办公室及出差大概各占一半。目前title是总监，但是光杆司令一枚，活都是我干。顶头上司是公司副总。 以下就是职场碎碎念了 	 最近被各种职场危机感染，每天都无比焦虑。外加上个月被领导打探性的问了句“你愿不愿意转岗去**部门”，感觉危机在眼前了。 最近下载了猎聘前程无忧还有boss直聘领英，每天一遍遍刷新岗位和留言信息。不得不说，对于35+的我来说，适合的岗位其实并不多。 	 先说说35+的职场困惑吧，这个年龄其实在任何一个行业，都应该是壮年时期，但是在中国的职场里，35岁已经属于被优先裁员的对象了。为什么会出现这样的情况呢？最近看到的一个说法我是比较认同的: 目前国内大部分的岗位不需要大量的、有丰富经验的、超过10年工作经验的资深打工者留在公司里。我们国家的职场文化竞争太激烈，当你到了35岁，你的职场性价比会急剧下降。公司不再需要这帮年薪100万、或者是大几十万的、工作可以被刚毕业的2、3年的人替代的人了。因为大部分企业没有给你提供转型的空间，也没有更深度的技术供你学习，因为学了也没用——国内大部分企业大部分岗位压根没有这些更深度的技术研发和产业环境，也就是说知识技能储备你已经到头了，而公司可以花三分之一甚至更低的价格去让更有激情的年轻人来做，比起大几十万的疲于奔命又老油条的中年人更好用。 	 再来说下远程工作 我想着万一再生个老二（虽然老大已经9 岁），后面想更多精力放在生活和家庭，毕竟公司和工作总有可能无情的抛弃你。所以开始转战关注一些时间较为自由、压力不那么大的岗位。于是看到了远程工作。除了大家熟知的线上接活：圆领、云队友、小蜜蜂云工作、电鸭、BOSS直聘-远程工作、云工、乐小活、行家、多牛云工作、程序员客栈，另外就是正儿八经的找公司签合同做远程办公，比如图片的那些。不过重点来了，我把领英的职位都看完了，基本上也是需要专业或经验对口 	 所以 在大环境不好的情况下，各位今年尤其注意以下几项：不辞职 不买房 不离婚 不要承担太大的债务或风险,52,0,2023-05-05T17:12:00,"""https://ci.xiaohongshu.com/55d0f6b2-ef2d-1ace-5dae-ed26bdc0de2c?imageMogr2/format/jpg/quality/92/auto-orient/strip/crop/450x300/gravity/center"""
64372ce500000000270292d6,JP Morgan要求全部MD每周5天出勤,JP Morgan正放弃在疫情期间采用的混合出勤政策，要求高管返回办公室。这一新规将引起华尔街其他公司效仿。 	 本周三，资产规模最大的投行JP Morgan表示，现在要求所有董事总经理每周五天到办公室工作。 	 JP Morgan运营委员会在一份内部备忘录中写道：“我们的领导人在巩固我们的文化和经营我们的业务方面发挥着至关重要的作用。他们必须在现场可见，他们必须与客户会面，他们需要教导和建议，并且他们应该随时可以为即时反馈和即兴会议提供支持。” 	 戴蒙一直是华尔街对抗疫情期间实施的在家办公政策最直言不讳的批评者。2021年，他在给股东的年度信中写道，他准备要求JP Morgan员工全职到场办公。 	 戴蒙在信中写道：“大多数专业人士是通过学徒模式学习工作的，这在Zoom世界中几乎不可能复制。 	 Bloomberg首先报道了JP Morgan政策改变的消息; 	 在对手高盛那里，CEO大卫·所罗门在10月份接受CNBC采访时表示，大约三分之二的银行员工现在每周五天上班。 	 与此同时，美国银行则敦促员工重返办公室，但至少在去年，尚未实行每周五天的政策。 	 JP Morgan最新举措可能源于该行在纽约市的不断扩大业务，CFRA股票研究部主管肯·莱昂告诉Insider。摩根大通位于曼哈顿中城的新总部目前正在建设中，预计将于2025年底完工。 莱昂告诉Insider：“如果你和我正在Park Avenue上建造一个全新的大楼，我也希望我的员工回到工作岗位。” JP Morgan关于董事总经理新政策的全文备忘录： 来自运营委员会的消息亲爱的同事， 随着我们在生活和工作中回归更正常的模式，我们都能深刻体会到面对面交流的诸多好处。我们认为这一点尤其体现在办公室工作的重要性上——在一起可以提高决策速度，同时为自发的学习和创造力提供宝贵的机会，让我们的专业人士通过学徒模式学习。我们还认为，面对面相聚是建立和加强我们文化的最佳方式——正是这种文化让我们的公司与众不同。 。。。 字数受限，中英全文放在小兰鸟了，见图2,313,0,2023-04-13T06:12:00,"""https://ci.xiaohongshu.com/d3801741-3ca6-ffaa-24c4-17afdeb516bc?imageMogr2/format/jpg/quality/92/auto-orient/strip/crop/450x300/gravity/center"""
