id,title,content,likes,collects,date,image
648d63b000000000130151c3,🌍远程工作offer必备：掌握时区套利！,"很多集美在寻找远程工作offer时，心中充满美好的想象： 想赚美元，然后在大理或东南亚享受生活， 高收入，低生活成本，这是多么美好的憧憬！ 但实际上，我们生活在亚洲，在与欧美团队/客户合作时会遇到许多问题， 除了文化差异，时区问题是一个重要挑战。 因此，在寻找远程项目时，我一直按照以下公式进行： 远程工作offer时区公式：⏰⌚️ 选择与自己时区相差 +/- 3小时内的工作， 最好在2小时内更适宜。 举个例子： 作为一个长期旅居在大理的人， 我所在位置是中国的时区GMT+8。 GMT+8时区包括澳洲、新加坡、台湾、马来西亚、菲律宾以及印尼（还有香港）。 我可以尝试寻找薪酬更高的澳洲和新加坡的工作。 同时，也可以关注GMT+6到GMT+10之间的国家的工作机会。 我有一个与泰国公司合作的自由职业工作， 泰国的时区是GMT+7， 我与泰国的客户进行会议和沟通从未遇到时间不对的问题。 当锁定适合时区的国家列表后， 不要只专注于提供远程工作机会的网站， 也可以在这些国家/城市的求职网站上寻找远程工作机会。 例如： 新加坡和香港：JobsDB 澳洲：Seek、Indeed、Ethical Job... 希望大家早日找到合适的远程工作offer， 成为环游世界的数字游民！🌐💻🌍 	      #数字游民 #全球工作 #远程办公 #工作与旅行 #自由职业者 #远程团队 #时差管理 #灵活工作 #工作生活平衡 #远程工作技巧 #远程招聘 #远程工作机会 #全球就业 #工作周游世界 #远程工作生活 #远程协作 #时区灵活 #虚拟办公",25,0,2023-06-17T15:41:00,"""https://ci.xiaohongshu.com/b0f88d41-000d-36cb-3293-1f9842c2f3ce?imageMogr2/format/jpg/quality/92/auto-orient/strip/crop/450x300/gravity/center"""
648d5a6200000000130173e2,旅居吧！数字游民— 长沙篇,"本系列为借工作之余考察国内城市对数字游民来说各方面的宜居度。本篇为第一篇。 -- 长沙，对中国人尤其长居海外的朋友一定不陌生。在国外想念国内烟火气和美食的我们，多少个日夜都是吃着代购买来的国内零食，抱着湖南台的综艺度过的。从这点上来说，非常感谢湖南卫视，为几百万海外华人提供了精神食粮。 	 因工作需要短暂路过长沙，年纪大了没时间跟年轻人排队挤热门打卡点，但短短时间还是感受到了这座城市独特的气质。 	 长沙目前定位新一线城市，可以说是国内我去过最有“烟火气”的地方之一了。吃喝玩乐应有尽有，无论多晚都能看到本地人在街边或江边享乐，聚会。年轻人多，娱乐气氛浓。满街都是小吃小店。和一线城市比，这里没有压力满满的压迫感，多了一份从容。 	 因时间太短没有来得及考察生活成本。但对喜欢吃喝玩乐，好热闹，以及想追星的朋友，相信这是一座不错的旅居城市。 	 Ps： 茶颜悦色真的很好喝！",0,0,2023-06-17T15:01:00,"""https://ci.xiaohongshu.com/348b0168-764d-ccee-d542-d630945104c1?imageMogr2/format/jpg/quality/92/auto-orient/strip/crop/450x300/gravity/center"""
648d5a23000000000800d1b1,移动办公的下午,本来想去    结果来了这里 ,0,0,2023-06-17T15:00:00,"""https://ci.xiaohongshu.com/f647c403-8adc-738d-ebdd-a589f832e610?imageMogr2/format/jpg/quality/92/auto-orient/strip/crop/450x300/gravity/center"""
648cecf70000000013032a2a,远程工作机会｜Calance营销数据分析师,"今日整理的岗位新鲜出炉，这些你可能不知道的H1B公司，扩大北美求职投递范围  	 公司名称：Calance US 岗位名称：Marketing Data Analyst 办公地点: Remote-Medford, NY 发布时间：6.15.2023 	 🖇公司简介&amp;H1B申请情况： Calance是一家总部设在美国的IT服务公司。 重点领域包括： 定制应用开发；IT服务台、服务台和桌面支持；基础设施管理；云和数据中心迁移；安全服务；建筑技术集成；人员配置和招聘服务 	 H1B情况：从 2020 年到 2022 财年，Calance Corporation 已经提交了 2 份 H1B 申请，平均薪资水平在132，000美元 	 🖇岗位要领： -优秀的书面和口头沟通能力 -擅长Excel和操作数据 -熟悉SQL，数据准备，谷歌分析，微软套件 -有数据可视化工具的经验，如PowerBI、DOMO和/或Tableau -有MCIF和细分模型的经验 	 📌📌📌 公司筛选自2022年Top 100 H1B Sponsors 排名今年最新开放岗位机会。岗位公司不定时有变化，以公司官方信息为准 	 在美国还有很多规模大提供身份支持的公司，只不过不在留学圈里那么响亮。豆豆会推荐更多不同领域的公司机会，将朋友们投递范围尽可能扩大 	 需要ℹ【内推资源】公司更多的信息或者【求职帮助】可以留言或私✉豆豆子哦。投递了很多岗位但都没有结果，想要了解自己的问题所在可以找🆓豆豆咨询哦",8,0,2023-06-17T07:15:00,"""https://ci.xiaohongshu.com/d56532a2-1a08-8b77-0dce-ca62a4f07682?imageMogr2/format/jpg/quality/92/auto-orient/strip/crop/450x300/gravity/center"""
648cec74000000001300e869,远程工作机会｜PeaceHealth数据分析,"今日整理的岗位新鲜出炉，这些你可能不知道的H1B公司，扩大北美求职投递范围  	 公司名称：PeaceHealth 岗位名称：Data Analyst - Risk Management 办公地点：Remote 	 🖇公司简介&amp;H1B申请情况： PeaceHealth是一个非营利性的医疗保健系统，在美国西部拥有并经营十家医院和许多诊所 	 H1B情况：从 2020 年到 2022 财年，Peacehealth 已经提交了 123 份 H1B 申请，平均薪资水平在$215，597 	 🖇岗位要领： -需要计算机科学、医疗保健研究、医疗保健或相关领域的学士学位；同等学历和培训可以替代 -至少两年的分析经验，包括汇总、平均等统计方法的经验，以及商业智能/查询/报告工具，如水晶报告、SQL、TSQL、Visual Basic等分析工具 -具有以可用格式检索和显示数据的经验，从客户的角度来看是可操作的 -对数据库查询原理和架构有深入了解 -有应用编码系统（ICD9、DRG、CPT）的经验者优先。 -有医学术语、解剖学/生理学或物理学知识者优先 	 📌📌📌 公司筛选自2022年Top 100 H1B Sponsors 排名今年最新开放岗位机会。岗位公司不定时有变化，以公司官方信息为准 	 在美国还有很多规模大提供身份支持的公司，只不过不在留学圈里那么响亮。豆豆会推荐更多不同领域的公司机会，将朋友们投递范围尽可能扩大 	 需要ℹ【内推资源】公司更多的信息或者【求职帮助】可以留言或私✉豆豆子哦。投递了很多岗位但都没有结果，想要了解自己的问题所在可以找🆓豆豆咨询哦",10,0,2023-06-17T07:12:00,"""https://ci.xiaohongshu.com/66ef04a2-ae50-bf06-3351-9877bbc1adae?imageMogr2/format/jpg/quality/92/auto-orient/strip/crop/450x300/gravity/center"""
648ca8390000000013013abf,6月远程全职职位推荐,需要沟通学习能力要强 必须的是会python 金融知识要有基本的概念,3,0,2023-06-17T02:21:00,"""https://ci.xiaohongshu.com/06aac246-2fa8-78d2-2c2f-d88b466078aa?imageMogr2/format/jpg/quality/92/auto-orient/strip/crop/450x300/gravity/center"""
648c71ad00000000140253bb,今天在海龟农场远程工作,今天在海龟农场远程工作,2,0,2023-06-16T22:29:00,"""https://ci.xiaohongshu.com/b5b029a8-4a05-f3df-27a6-6f51af806e36?imageMogr2/format/jpg/quality/92/auto-orient/strip/crop/450x300/gravity/center"""
648c707600000000110120b2,浅谈自由职业带徒,也带小徒弟们一阵子了，发现大家都羡慕自由职业，不用通勤也不用去与同事交际，看似灵魂是自由的。但是其实西安线下面基过我的小徒弟就知道，平时居家也是工作10小时左右。好处是居家以后工作效率高，收入也比较可观一点。在带小徒弟们过程中，发现工科类的小徒弟们学习力真的很棒，好几个小徒弟也已经远超我了。像很多建筑类，设计类，计算机等工科类的小伙伴学习力非常强，很多时候缺就是机会。但是可悲的是发现大多数情况下机会又属于原本已经有很多机会的人手里。加油吧～～,2,0,2023-06-16T22:23:00,"""https://ci.xiaohongshu.com/e3b15c92-bdf4-e25b-a510-a322904416e0?imageMogr2/format/jpg/quality/92/auto-orient/strip/crop/450x300/gravity/center"""
648c5a9f000000001300d755,大理 706 数字游民社区,位置：大理古城南门附近 住宿：单人间，双人间，需要填写一个比较长的表单申请入住，可以只住一两天，不要求居住长度。 办公空间：一楼有两个长桌，顶楼可以对着洱海办公。整栋楼有很多个wifi。 附近：距离古城步行非常近，到洱海边比较近的点是才村和龙龛码头，打车十几分钟。 人员组成：数字游民和裸辞gap的人较多。 活动：这边离古城近，参加大理的各种活动都比较方便，可以看大理好在的各种活动。706内的人会一起约着吃饭或者做饭，晚上也经常会有读书会或者主题聊天。,3,0,2023-06-16T20:50:00,"""https://ci.xiaohongshu.com/7ae549f3-30d0-00fd-9639-a3b7abaa68bf?imageMogr2/format/jpg/quality/92/auto-orient/strip/crop/450x300/gravity/center"""
648c51b00000000027013e24,вҡ пёҸйӮЈдёӘиҜҙиҰҒеҒҡз¬¬дёҖзҡ„е…Ёзҗғж•°еӯ—жёёж°‘зӨҫеҢәжқҘдәҶвҖјпёҸ,6вғЈпёҸрҹҲ·пёҸиө·пјҢ UniXж•°еӯ—жёёж°‘зӨҫеҢәе…ЁйқўеҚҮзә§пјҒрҹҗі жҲ‘д»¬еҲқеҝғрҹҘ°е§Ӣз»ҲжңӘеҸҳпјҢиҰҒе°ҶUniXжү“йҖ жҲҗе…ЁеӣҪд№ғиҮідё–з•Ңз¬¬дёҖзҡ„ж•°еӯ—жёёж°‘зӨҫеҢәвңҢпёҸ рҹҘҒUniXзҡ„зӨҫеҢәж–°е®ҡдҪҚпјҢе°ҶжҳҜпјҡдәәе’ҢдәәгҖҒдәәе’Ңиө„жәҗзҡ„и¶…зә§й“ҫжҺҘеҷЁрҹ‘ЁвҖҚвқӨпёҸвҖҚрҹ‘Ё рҹҢҹжҲ‘д»¬иҝҷж¬ЎйҖҡиҝҮдёүеӨ§еҚҮзә§пјҢеӣӣдёӘжқҝеқ—пјҢжһ„йҖ дәҶвҖңUniXејҸвҖң зҡ„й•ҝжңҹдё»д№үж•°еӯ—жёёж°‘гҖӮдёҖеҗҢе…ұеҲӣдёӘдәәд»·еҖјгҖҒе•Ҷдёҡд»·еҖје’ҢзӨҫдјҡд»·еҖјрҹҸғ йҖҡиҝҮиҝҷз®ҖеҚ•5вғЈпёҸжӯҘпјҢжҲ‘д»¬йӮҖиҜ·дҪ дёҖиө·зҺ©иҪ¬е…Ёж–°зҡ„UniXжҙ»еҠЁеҸҠе№іеҸ°пјҢе…ұеҲӣгҖҢж–°иҮӘз”ұгҖҚрҹ‘Ү Step1вғЈпёҸпјҡе……еҲҶжҢ–жҺҳиҮӘжҲ‘пјҢжүҫеҲ°е…ҙи¶Је’ҢжҠҖиғҪеҸҳрҹ’°зӮ№ -еңЁUniXNomad.comдёҠеҒҡAIжөӢиҜ• -еҸӮдёҺгҖҢBeingи·Ёз•ҢеҲҶдә«дјҡгҖҚ Step2вғЈпёҸпјҡрҹҘіжҲҗдёәгҖҢжҠҖиғҪIPгҖҚ -еҸӮдёҺгҖҢжҠҖиғҪIPеҠ йҖҹеӯөеҢ–и®ЎеҲ’гҖҚпјҢиҺ·еҫ—UniXжҠҖиғҪIPи®ӨиҜҒеӢӢз« пјҢи§Јй”Ғжқғйҷҗе’Ңиө„жәҗ Step3вғЈпёҸпјҡрҹ‘ЁвҖҚвқӨпёҸвҖҚрҹ‘Ёж·ұеәҰй“ҫжҺҘпјҢжӢ“еұ•и·Ёз•Ңиө„жәҗе’Ңдәәи„ү -з”ЁUniXзҪ‘з«ҷзҡ„зӨҫдәӨеӣҫи°ұеҠҹиғҪпјҢзІҫеҮҶеҜ»жүҫеҗҲдҪңдјҷдјҙ -еҸӮдёҺзәҝдёҠ/дёӢж·ұеәҰй“ҫжҺҘжҙ»еҠЁгҖӮеңЁиҝҷйҮҢпјҢиў«зңӢеҲ°пјҢиў«дҝЎд»»пјҢиў«й“ҫжҺҘрҹ”— Step4вғЈпёҸпјҡеҝ«йҖҹиЎҢеҠЁдҪ“йӘҢеҗ„з§ҚеҸҜиғҪжҖ§ -еҸӮдёҺзӨҫеҢәеҶ…еҗ„з§ҚдҪ“йӘҢеһӢжҙ»еҠЁпјҢи§Јй”Ғдәәз”ҹдёҚеҗҢеҸҜиғҪжҖ§ Step5вғЈпёҸпјҡе…ұеҲӣе’ҢеҸҳрҹ’° -еҸӮдёҺзӨҫеҢәеҶ…е…¶д»–UniXerеҸ‘иө·зҡ„е…ұеҲӣйЎ№зӣ® -еҸӮдёҺUniXе®ҳж–№е…ұеҲӣйЎ№зӣ®пјҡжҠұеӣўе…ұеҲӣдёӘдәәеҪұе“ҚеҠӣгҖҒе…ұеҲӣе•ҶдёҡеҢ–д»·еҖјгҖҒе…ұеҲӣзӨҫдјҡд»·еҖјгҖӮ рҹ‘ҖжғіжҲҗдёәUniXerе°ұиҜ·жқҘрҹ“©гҖҢжҳҹе°ҳгҖҚжҲ–иҖ…еңЁдёӢж–№рҹ‘ҮеҠ е…ҘUniXВ·е°Ҹзәўд№Ұжҙ»еҠЁзҫӨеҗ§пҪһ,13,0,2023-06-16T20:12:00,"""https://ci.xiaohongshu.com/b1991b5f-d249-48cf-87ad-3c2ca822660e?imageMogr2/format/jpg/quality/92/auto-orient/strip/crop/450x300/gravity/center"""
648c4f850000000013015dcc,🇬🇧Web3 远程工作，欧洲地区同学均可,"团队 Base 在伦敦 初创web 3 SocialFi 公司 	 📒工作内容：与合作伙伴(KOL)建立和维护关系 ⚠️要求：在校学生，英文流利，对web3 有兴趣 😄加分条件：在 Web3领域有相关的BD经验 🗺️地点：需要base在伦敦或者欧洲，可以远程 💰100 USDT/每周",12,0,2023-06-16T20:03:00,"""https://ci.xiaohongshu.com/249b1acb-4515-bf83-b617-79de361b7205?imageMogr2/format/jpg/quality/92/auto-orient/strip/crop/450x300/gravity/center"""
648c37cf000000002702a8df,不想上班❓试试这8个远程工作平台（三）,"我是36岁裸辞大厂的Junes， 裸辞一年了，现在远程办公中， 有朋友问我，上班太痛苦了， 在那儿可以找到远程办公的工作， 远程办公虽然不用坐班，但任务也是很明确的。 成年人的世界没有容易二字， 也不打没有准备的仗， 建议想要裸辞的朋友先试试这些远程工作的平台， 为辞职多一分底气❗️ 裸辞之后可以做什么❓ 🌈今天给大家整理了8个国外知名远程工作平台： 都是世界上蕞早践行全员远程办公的平台， ✨主要职位：编程，产品，设计师，市场营销，数据分析，客户支持，运营等 1⃣️Automattic：这是WordPressh和WooCommerce等知名产品的背后公司，他们拥有一个分布在全球的员工团队，采用全员远程办公方式。 2⃣️GitLab：GitLab是一个知名的代码托管平台，他们以全员远程办公著称，并通过工具和流程支持远程协作和沟通。 3⃣️Buffer：Buffer是一家社交媒体管理工具公司，他们的团队完全远程办公，并且致力于分享远程工作经验和实践。 4⃣️Zapier：Zapier是一个自动化工具平台，他们的员工遍布世界各地，通过远程办公协同工作。 5⃣️InVision：InVision是一个设计和协作工具平台，他们的团队采用全员远程办公模式，并提供了一系列远程工作资源和指南。 6⃣️Doist：Doist是Todoist和Twist等产品的公司，他们通过全员远程办公模式实现了高度的灵活性和工作效率。 7⃣️GitBook：GitBook是一个在线文档创作和协作平台，他们的团队完全远程办公，并专注于提供高质量的远程工作环境。 8⃣️Hotjar：Hotjar是一家行为分析和用户反馈平台，他们的全球团队通过远程办公实现了gao效的工作和协作。 	 👩36岁大厂裸辞的职业教练 👉我的👩主页，查看更多干货~ ❤️欢迎+关，一起实现只工作不上班的梦想 🌟分享搞💰干货｜裸辞生活｜创业经验",24,0,2023-06-16T18:22:00,"""https://ci.xiaohongshu.com/6487965b-9ef3-aadc-b69e-33e410b4cd67?imageMogr2/format/jpg/quality/92/auto-orient/strip/crop/450x300/gravity/center"""
648c37190000000013007c17,月入3w❗️对外汉语老师的赚💰法则,"🙋🏻‍♀️大家好，我是对外汉语教师邵雅雅。 🙋🏻‍♀️雅雅在22年就已经实现月入3W，全国旅居啦~ 6月29号雅雅就要飞往泰国开始环球旅居啦。今天给大家唠唠雅雅得赚米跟自由法则。 . ✅线上中文教师 这个工作雅雅从21年开始，现在在多家机构跟平台任职。 有LingoAce，旭源中文，preply，Amazing talker。 这时候很多人会想，“假的吧”这么多怎么忙的过来，还有时间出国旅居？ 我是如何好好得balance这份工作呢？严格来说,我是上2休5的。 LingoAce要求一周至少开放20h，雅雅就开放20h时间，在周四跟周五得6am-4pm 旭源中文本来就是一个自由请假得平台，我刚入职半个月，目前有4个长期学生，一般都是工作日晚上上课。 当天我要出去玩，我就会跟家长商量调整下时间。所以既能赚米又不耽误旅游。 preply也是可以随时调节，我只开放我有空得时间，要想调课就跟学生说。 这种工作是我的老本行，我遵循不把几蛋放在同一个篮子得原则，在多个地方上课，更有an全感。 . ✅博主 从22年初开始，雅雅做博主，不仅体验了接广告赚米，还开启了创ye项目，开了自己得工作室。 23年雅雅研究如何去外网做博主，发了十多条视频后，有一个视频小火，一夜涨了1100个粉丝。 现在有小2千粉丝。我做的中文博主赛道，目的是直接获取外国生源，自己有这份能耐，就能不用再付机构得手续费了。 雅雅决定出国旅居，也是为了更好的发展，做博主，自己得生活就要有意思，自己本人也要有意思有能力。 出国之后雅雅会更新视频，记录我环球旅居得见闻。读万卷书，不如破万里路。 . 🙋🏻‍♀️我是对外汉语教师邵雅雅，分享更多教师干货，自媒体感悟，搞💴点子。 主页有《时薪30美金|手把手教你成为在线中文教师 《时薪可100/h|对外汉语机构面试成功经验分享》 《40个对外汉语机构平台大盘点》......",23,0,2023-06-16T18:19:00,"""https://ci.xiaohongshu.com/cd4bfc5f-649f-820c-c14e-e0740c39c024?imageMogr2/format/jpg/quality/92/auto-orient/strip/crop/450x300/gravity/center"""
648c291a00000000270298c0,快乐赚💰！20个全球远程工作的网站 （上）,"🌍这次给大家带来全球、不限行业的远程工作。 	 ▪️亚马逊 微软等公司都在使用的远程工作招聘网站。 	 ▪️职位覆盖软件开发、设计、编程、营销等多类别。 	 ✅1.FlexJobs 排名第一的求职网站，职位种类分为远程工作、全职远程工作、兼职工作等。有一个专门的种类是全球工作。 职位覆盖：创意、设计、财务、策划等分类。 	 ✅2.WeWorkRemotely 大多数工作在软件工程、数字营销和客户支持类别。 	 ✅3.JustRemote 提供商业、软件工程、设计、写作、HR等领域的职位，还可以订阅他们职位推送信息。 	 ✅4.Remote.co FlexJobs 创始人创立的另一家网站，只提供远程工作。 	 ✅5.RemoteOK 允许大家根据地点、薪水、雇主福利条件来查找工作。主要与软件工程职位相关。 	 ✅6.Remotive 适用于软件工程、营销、销售等职位。可以按职位招聘地点或类型进行筛选。还提供数字游民签证、求职技巧等资讯。 并能通过工程师薪资共享数据库，查看自己可以获得什么样的薪水。 	 ✅7.TheMuse 并不只是专门发布远程工作等网站，但可以选择远程工作类别。比较有趣的是招聘公司简介，包括：公司福利/办公室/产品/服务/使命介绍。 	 ✅8.Indeed 最大最受欢迎的招聘网站之一，可以在搜索条件里设置远程，来找相应工作。 	 ✅9.Jobspresso 除远程工作职位查找外，你可以免费向他们提交一份简历，并允许雇主在寻找具有这种技能的人时与你联系。 	 ✅10.Outsourcely 致力于外包工作的远程工作网站，大多数公司在全球范围内招聘员工。你可以浏览职位并申请，也可以创建自己的资料，让雇主联系你。@知识薯 	 🌍关注我 - 多年海外经验，中资品牌出海 - 前海外在线教育平台创业，国际组织 - 持续更新海外工作经验分享，出海招聘&amp;求职",107,0,2023-06-16T17:19:00,"""https://ci.xiaohongshu.com/28635d18-a24b-43c1-3fbd-4590eb9a3f7b?imageMogr2/format/jpg/quality/92/auto-orient/strip/crop/450x300/gravity/center"""
648bf8dc000000001300f15c,6月16日更新|运营同学、UI设计来看新机会！,关注我，及时获取最新远程工作岗位招聘信息。,3,0,2023-06-16T13:53:00,"""https://ci.xiaohongshu.com/003db1db-cd9c-1481-f93d-d30d1124957f?imageMogr2/format/jpg/quality/92/auto-orient/strip/crop/450x300/gravity/center"""
648be888000000001203008a,20k*16薪＋13语种🉑拼多多招外专毕业生,"这只是其中一个，不知道大家喜不喜欢🔥 我们那边类似的、门槛更低有更多✅ 这个工作真的非常好✅ 不知道各位外语人喜欢嘛嘛喜欢的❤️★ 告诉我111吧 	                 #",4,0,2023-06-16T12:43:00,"""https://ci.xiaohongshu.com/a52d5b40-83f1-503e-edcb-50c937d15e05?imageMogr2/format/jpg/quality/92/auto-orient/strip/crop/450x300/gravity/center"""
648be6d70000000013011f82,远程工作中哪些岗位非常缺人？,希梦团队成立以来，每天都会收到大量的咨询与简历。有童鞋问过希梦，目前远程市场上的候选人是否供大于求？一方面确实是的，很多人对于远程办公是很向往的，所以目前已经收到不少简历。但是另一方面，其实很多招聘方也存在找不到合适人选的情况。曾经有招聘方跟希梦说，能够找到符合度80%的已经很不错了。所以，其实选好赛道和岗位，会比盲目海投更重要。 -- 那么下面希梦就来跟大家解读一下，哪些岗位是很好找远程工作的。大家或许可以接触一下，为将来实现远程打好基础。 -- 1.海外投放类。这类的岗位还是很稀缺的，因为国外的投放目前还处于起步阶段，哪怕是国内知名广告公司，基本上也不会涉及出海业务。主要涉及的媒体类投放平台有Facebook、Google还有tiktok，其中tiktok最缺人。 -- 2.运营类。主要是国外独立站运营，这部分人才也十分缺乏，因为市场上大部分的运营是个人，还处于不算成熟的阶段。没有形成专业化的模式，投放的cost和ROI也没有达到一个公司或者品牌的标准。 -- 3.SEO优化师、UI设计师。这类型的岗位的候选人其实也不少，但是大部分招聘方都会要求很细致，比如具体到某个行业某种技能，在这种情况下，就会很难找到符合度高的候选人。另一方面，这些岗位需求量相对较大，导致出现缺人的情况。 -- 以上是岗位的维度，行业的话基本上就是人工智能、新兴品牌、跨境电商等。 “任何时候，选择大于努力。”,44,0,2023-06-16T12:36:00,"""https://ci.xiaohongshu.com/59888dcf-cac1-ff22-5f9f-a072ca3bbca3?imageMogr2/format/jpg/quality/92/auto-orient/strip/crop/450x300/gravity/center"""
648be127000000001203230a,20k*14薪🔥短期出差🉑️7语种外语应届生岗,真的非常适合外语专业的宝宝呀～ ♥️ 和小星星 扣123告诉我！！！！ 我教你！,9,0,2023-06-16T12:12:00,"""https://ci.xiaohongshu.com/fb10553b-39cc-c469-77ea-4c9b01dd62ba?imageMogr2/format/jpg/quality/92/auto-orient/strip/crop/450x300/gravity/center"""
648b9ed7000000000703a54e,远程工作机会｜Informa Tech数字营销助理,"今日整理的岗位新鲜出炉，这些你可能不知道的H1B公司，扩大北美求职投递范围  	 公司名称：Informa Tech 岗位名称：Digital Marketing Associate 办公地点: Remote-New York, NY 	 🖇公司简介&amp;H1B申请情况： 通过研究、媒体、培训、智能活动和数字需求生成来提供市场洞察力和市场准入的领先供应商 	 H1B情况：从 2020 年到 2022 财年，Informa Tech Holdings Llc 已经提交了 2 份 H1B 申请，平均薪资水平在67,500美元 	 🖇岗位要领： 有营销自动化平台的经验，最好是Eloqua，但不是必须的 -有开发和执行A/B测试的经验，以不断提高性能和推动价值 -注重分析，有将数据转化为商业和消费者洞察力的经验。精通Excel和BI工具 -分析数据并向营销利益相关者展示 -对入境活动的工作和电子邮件请求进行项目管理 -从事过大量的以期限为导向的电子邮件活动和资产的工作 -中级Excel技能 -对营销的分析方面有浓厚的兴趣 -有能力在一个动态的快节奏环境中工作 -具有同时管理多个项目的能力 	 📌📌📌 公司筛选自2022年Top 100 H1B Sponsors 排名今年最新开放岗位机会。岗位公司不定时有变化，以公司官方信息为准 	 在美国还有很多规模大提供身份支持的公司，只不过不在留学圈里那么响亮。豆豆会推荐更多不同领域的公司机会，将朋友们投递范围尽可能扩大 	 需要ℹ【内推资源】公司更多的信息或者【求职帮助】可以留言或私✉豆豆子哦。投递了很多岗位但都没有结果，想要了解自己的问题所在可以找🆓豆豆咨询哦",19,0,2023-06-16T07:29:00,"""https://ci.xiaohongshu.com/31b4faaa-ca0e-397c-adc2-d7f5ae93d5ba?imageMogr2/format/jpg/quality/92/auto-orient/strip/crop/450x300/gravity/center"""
648b3de10000000013001cdd,🇨🇦 近期startup内推&amp;面试 更新,"推了几个朋友和网友，但进展略慢。 转码上岸2年，很庆幸有这些机会。 结合组里project来找leetcode problem、总结checkponts、挑选设置coding platform… 准备面试也是学习的过程。 找工作面试也是个双向选择的机会，双方都要擦亮双眼。 	 anyways，希望各方都顺利。",19,0,2023-06-16T00:35:00,"""https://ci.xiaohongshu.com/45174035-82bc-3690-2d27-8670dc8c2a74?imageMogr2/format/jpg/quality/92/auto-orient/strip/crop/450x300/gravity/center"""
