id,title,content,likes,collects,date,image
646c5a2c0000000007038300,分享一下找到远程工作生活发生了哪些变化,大概是21年12月最后几周，得到了现在远程工作的机会。公司地址在加拿大，国内是技术团队，都是远程工作。自去年入职到现在已经有一年多了，这一年多真的跟过往数年的工作比起来真的有很多不同。 首先最大的不同就是，通勤时间没有了。曾经在上海飘过一段时间，那段时间每天花在通勤的时间大约是2.5小时，每天必须6点半起床，在7点十分之前到地铁站，不然上海地铁一号线会教做人。几乎做过的所有工作，每天起床面临的最大压力就是上班通勤。曾经有同事跟我说，可以在公司附近租房，减少通勤时间，公司附近要么商业中心，价格昂贵，要么就是产业园区，周边真的荒凉。曾经在成都西部智谷工作过一年左右，早上出发要趁早，不然公司附近地铁站没有共享单车，就要想办法徒步2km去公司。远程工作中，我最喜欢的部分就是不再需要大量的时间精力耗在通勤上。每天的上班路就是从卧室走到书房，打开电脑，就能开始工作。一天结束，关掉电脑，离开书房就能等着吃晚餐，吃了晚餐还能有时间和家人一起去散步。这是每天花费数小时通勤的工作中无法感受的幸福。 第二个最大的不同就是，每天的时间安排自由了。如果没有什么很突发的任务，或者有同事找自己，只要愿意，可以睡到晚上再起床。每天只需要盯紧自己的任务，及时办结，至于是在一天中的什么时间处理完全不重要。我个人每天的周期特别明显，每天效率最高的是下午三点到六点的三个小时，在办公室里，这三个小时之外的时间总是让人痛苦，因为效率极低，并不能进行有效的工作，办公室里有很多双眼睛，不能光明正大摸鱼，只能自己憋着。那种干不了又不得不干的感觉，真的像便秘了几天蹲在厕所努力的那种。 因为每天时间自由安排，相对空余时间多起来过后，又迎来了第三个不同，远程工作更需要自驱力。坐班的时候各种任务，各种会议，各种事情会推着人往前走，每天不需要很细致地思考具体今天应该如何安排，计划是一定会被办公室各种事情打断的。除此还有，工作地点的自由，能够更有机会去到处走走，给自己换换环境。2020年买了东航随心飞，受限于工作的地点和时间，其实并没有去很多地方。现在虽然没有了随心飞，却能更自由地去探索整个世界。过去的一年我有很多变化，跟工作有关的，无关的都有。在像小蜜蜂一样兜兜转转很多年，一直都在忙工作。现在终于有机会可以慢下来，自己好好想想什么是工作，什么是生活。,0,0,2023-05-23T14:16:00,"""https://ci.xiaohongshu.com/08057f4a-d77c-7ef1-277a-aea829b4a844?imageMogr2/format/jpg/quality/92/auto-orient/strip/crop/450x300/gravity/center"""
646c3eea000000001301763b,职场人的移动办公室👩‍💻迎着阳光☀️工作💻,"🌞作为一个对阳光有执念的人，偶尔喜欢跑去上海街头巷尾的咖啡厅或者餐厅🥗一边沐浴着阳光一边工作。 我喜欢的【移动办公室】必须满足以下4个条件😃 1⃣️有大大的落地窗能晒到太阳🌞 2⃣️有健康的食物🥗🌽🥙工作饿了能随时给自己补给能量 3⃣️有ins氛围感🌸美美的环境里办公我会觉得心情很棒 4⃣️相对安静，可以沉下心来思考，不被打断思绪 	 Wagas是我常去的【移动办公室】，完美满足👆的理想条件。这里有美美的环境，有健康的轻食饮料，来这里一坐就容易坐上一下午😃 	 🥗我的午餐🥗 全明星能量碗+杨梅荔枝多多 他们的牛肉火候一直很赞，口感鲜嫩。能量碗的配料很丰富，🈶️羽衣甘蓝、烤菠萝、🥑牛油果、泡菜等，能补充优质蛋白、维生素和优碳，帮助下午工作更加专注与精神。 饮料点了🍹杨梅荔枝多多，健康低卡，当季的杨梅、荔枝、西瓜和梨一起鲜榨，能吸到果肉，有种提前感受夏天的感觉🍉🍐 	 🥗我的晚餐🥗 血橙鸡肉牛油果芒果色拉+玫荔椰椰美式 敲了一下午电脑💻晚上给自己点了一碗色拉，鸡肉多汁不柴，芒果酸酸甜甜👍。搭配了一杯玫荔椰椰美式，不加水的Espresso+现剥的荔枝❤️深得我心 	 天气大好的时候，我喜欢走出办公室，换个舒适与放松的环境工作，更能激发我的工作灵感。在工作的同时可以吃到美味又健康无负担的食物YYDS！",133,0,2023-05-23T12:19:00,"""https://ci.xiaohongshu.com/ea9b5a31-228f-0aab-5544-090231b09d13?imageMogr2/format/jpg/quality/92/auto-orient/strip/crop/450x300/gravity/center"""
646c3afe0000000027000e32,编制|深圳中小学英语/法语教师🔥本科🉑️,真的非常适合外语专业的宝宝呀～ ♥️ 和小星星 扣123告诉我！！！！ 我教你！,13,0,2023-05-23T12:03:00,"""https://ci.xiaohongshu.com/4c66ec89-0a31-a5c5-73f8-619bb3c6cd43?imageMogr2/format/jpg/quality/92/auto-orient/strip/crop/450x300/gravity/center"""
646c3a6d000000001303774b,Web3.0远程BD商务岗~,找web3.0远程的伙伴，可以了解一下这岗位。目前BD岗是有一定的门槛的，需要一些web3.0的项目方资源，主要原因还是因为市场环境因素！ 想进这个圈子，还是需要努力努力，再努力！ 我晚点写一遍该如何进入这个web3.0的圈子吧！,12,0,2023-05-23T12:00:00,"""https://ci.xiaohongshu.com/9eb26b91-b6a5-e2ab-ca2c-45f576e886d9?imageMogr2/format/jpg/quality/92/auto-orient/strip/crop/450x300/gravity/center"""
646c34c8000000001300755c,远程150/天🔥埃森哲英语实习生🔥,"这只是其中一个，不知道大家喜不喜欢🔥 我们那边类似的、门槛更低有更多✅ 这个工作真的非常好✅ 不知道各位外语人喜欢嘛嘛喜欢的❤️★ 告诉我111吧 	                 #",5,0,2023-05-23T11:36:00,"""https://ci.xiaohongshu.com/f4b78520-b248-ee10-a5d8-82bc494d2d33?imageMogr2/format/jpg/quality/92/auto-orient/strip/crop/450x300/gravity/center"""
646c3279000000001303c5a6,英专生法专生时尚杂志实习生🔥,真的非常适合外语专业的宝宝呀～ ♥️ 和小星星 扣123告诉我！！！！ 我教你！,6,0,2023-05-23T11:26:00,"""https://ci.xiaohongshu.com/6ba0abc3-3a62-4c7c-a5d7-2ceab430aec0?imageMogr2/format/jpg/quality/92/auto-orient/strip/crop/450x300/gravity/center"""
646c2a70000000001101052d,远程办公。给你新的可能，新的希望,今天聊了一个全职妈妈，感触还是比较大的。小孩一岁半的时候查出来基础病，需要长期复建。职场妈妈辞职，全职带小孩。整个过程非常辛苦，也会有经济压力。整个沟通过程中，态度比较积极。10点的面试，9点20就告诉我，已经准备好了。我说，不用这么早。候选人说，我想提前准备好，以最好的状态来准备这次面试。线上办公的工作真的满足了我目前的诉求，我希望可以得到这份工作。最后我们俩在微信上聊了很多，大部分是孩子。。。生活，。。。希望这个候选人可以顺利入职。线上办公真的给了我们无限的可能，给我们在困境中突破重围的希望。,1,0,2023-05-23T10:52:00,"""https://ci.xiaohongshu.com/95c3f42c-be6d-3ed8-0fc6-82b9b5aed91d?imageMogr2/format/jpg/quality/92/auto-orient/strip/crop/450x300/gravity/center"""
646b7c99000000001402653e,在家上班摸鱼技巧😌,南方又到了🌧季，今天趁着上班不忙，把攒了两天的衣服洗完了 在家上班，不忙的时候可以顺便做做家务，下雨☔️也不用担心外面晒得衣服会淋湿，相比线下上班，还是很有优势的 但也是有技巧的，不是说想摸🐠就能摸🐠的哦 首先，忙的时候，肯定是不能摸🐠的，不然就是给自己找麻烦 闲的时候，可以去忙自己的事，但要时不时的看着🖥，以防有巡检 最保险的摸🐟时间：不忙的时候，正好又刚点过巡检，这种情况可以放心的利用哦 为了方便，我可是把办公地点搬到了客厅呢,0,0,2023-05-22T22:30:00,"""https://ci.xiaohongshu.com/a2490377-2cd7-eb44-891d-9d0afb5856e2?imageMogr2/format/jpg/quality/92/auto-orient/strip/crop/450x300/gravity/center"""
646b5da00000000013016a00,5.22 FreeLab远程工作机会合辑,今天给大家推荐32个远程工作机会 💻 包括运营、文案、设计、插画、开发、剪辑、翻译等远程兼职/全职/外包项目工作 🔍 感兴趣的小伙伴，可以点击图片查看岗位详情 🙌 只要你符合岗位要求，就能不限于地理位置，实现在家也能工作的自由！ 👇 报名方法可以后台踢踢哦～,4,0,2023-05-22T20:18:00,"""https://ci.xiaohongshu.com/7868f2eb-dd4a-8935-41b4-337d73931daa?imageMogr2/format/jpg/quality/92/auto-orient/strip/crop/450x300/gravity/center"""
646b432c000000001303da89,远程办公有哪些好用的辅助软件？,"🌟飞书 飞书是源于字节跳动内部使用的协作工具,因此产品本身带有字节的文化属性,强调个体创造能力,尽量减少管理层级。飞书的在即时聊天、日常管理的基础上,把协作文档提到了更高的等级,统一称为云空间。 飞书一大亮点就是群聊天即使新人入驻,之前的聊天记录也全部都在,为的就是信息的完整性。 飞书的日历模块也做了较大修改,可以关联成员、文档、地点等更多信息。工作台也已经有不少独立的第三方应用,包括日常审批、工资单等。 -- 🌟朝夕清单 一款高效时间管理应用，能够帮助远程工作者更好的进行自律。作为一款颇受欢迎的时间管理工具，朝夕清单凭借着其简洁易用的设计和强大的功能，在市场上获得了广泛的认可和好评。 -- 🌟腾讯会议 基于21年音视频通讯经验、并依托于腾讯云全球化网络部署出品的简单易用、高清流畅、安全可靠的云会议协作平台,界面清爽,操作简单,在线文档协作、小程序入会、会管会控、屏幕共享等功能一应俱全。 支持电脑/手机客户端、小程序、电话四大方式一键入会;会议期间,提供控制禁言、在线文档协作、实时屏幕共享等多个会议管控功能;还有美颜和背景虚化等功能,避免在家办公的尴尬局面。 -- 🌟Zoom 其实腾讯会议已经能满足需求了,但是如果不想下载APP,推荐一个在线的工具。功能强大,无需下载,即点即用! 可以自行安排会议,也能点击链接或者输入会议号参加会议,实时多人语音或视频通话,使用上非常简便,也没有杂七杂八的广告。 -- 综合来看目前市面上的远程办公软件都具备了远程办公、远程会议,远程文件传送,远程数据传输等功能。",1,0,2023-05-22T18:25:00,"""https://ci.xiaohongshu.com/c6d1a842-f553-fae0-e27f-24c31f51c41b?imageMogr2/format/jpg/quality/92/auto-orient/strip/crop/450x300/gravity/center"""
646b424a0000000013030722,【代转发】鸿孺苑成长中心诚招专职老师2名,"一、岗位要求 1. 大专及以上学历，专业不限; 2. 大学英语4级以上优先，有托管工作经验优先； 3. 身体健康，性格开朗活泼，细心、耐心，有爱心。 二、工作内容 1. 负责暑期托管班课程及学生管理相关工作； 2. 协助进行机构推广及活动策划等。 	 三、相关福利 1. 享国家法定假期，周末双休； 2. 月薪面议，外加社保、全勤奖、绩效奖、假期补贴、年终绩效等； 3. 工作环境舒适，包优质午晚工作餐及下午茶； 4. 工作地点：广州市越秀区淘金； 	 有兴趣者请带简历联系，欢迎介绍🌷",4,0,2023-05-22T18:22:00,"""https://ci.xiaohongshu.com/9d08b205-4d42-845e-4127-deee6c8c5e6e?imageMogr2/format/jpg/quality/92/auto-orient/strip/crop/450x300/gravity/center"""
646b2b91000000001300ea0d,逃离工作去大理？,"有没有想当数字游民或者已经是数字游民的小伙伴？ 	 如果你是马来西亚的数字游民，看过来，我要逃离工作去大理了。 	 也许，你已经知道数字游民这样的生活和职场性质。 也许，你已经厌倦了现在的工作环境。 来，逃离格子间， 去大理吧，我这个8月就去。 	 我知道目前，大理是中国数字游民社区的热点。 为何呢？ 大理有一批梦想着诗和远方的青年。 大理有美丽的风景和无拘无束的生活。 大理有远方的诗也有现实的工作。 	 所以，我要去大理看看。 你跟我一起不？",1,0,2023-05-22T16:45:00,"""https://ci.xiaohongshu.com/69ce168b-6713-434e-62da-b3e9a0c82788?imageMogr2/format/jpg/quality/92/auto-orient/strip/crop/450x300/gravity/center"""
646b0a5a000000001300e330,招web3客服，全职远程办公！还有运营岗,岗位职责： 1  为平台用户提供在线即时文字咨询与解答，解决操作问题 2  处理客户投诉、反馈，提高质量和满意度 3  记录客户咨询内容，并向相关部门反映客户需求，实现产品变更 4  为客户提供更新信息，确保客户及时了解重大变化 5  主管交办的其他事项,0,0,2023-05-22T14:23:00,"""https://ci.xiaohongshu.com/480a3584-6a49-68e8-5804-03354f91dfa4?imageMogr2/format/jpg/quality/92/auto-orient/strip/crop/450x300/gravity/center"""
646b00090000000007039bda,对工作好迷茫,哇地一声哭出来…学的专业与计算机啥的毫不沾边，但又想远程工作，各位姐妹有没有大龄转行找到远程工作的经验哇，都要做什么准备呢？读个跨专业的在职研究生必要吗？,1,0,2023-05-22T13:39:00,"""https://ci.xiaohongshu.com/82551dfb-ed6d-2e0f-b83d-116bc906cbde?imageMogr2/format/jpg/quality/92/auto-orient/strip/crop/450x300/gravity/center"""
646ae222000000002702a44e,100r/h🔥英专生线上教育副业🔥,"这只是其中一个，不知道大家喜不喜欢🔥 我们那边类似的、门槛更低有更多✅ 这个工作真的非常好✅ 不知道各位外语人喜欢嘛嘛喜欢的❤️★ 告诉我111吧 	                 #",94,0,2023-05-22T11:31:00,"""https://ci.xiaohongshu.com/9885c92c-a2ca-ff9d-22ea-6e71a26806db?imageMogr2/format/jpg/quality/92/auto-orient/strip/crop/450x300/gravity/center"""
646ae0a2000000000800d117,100/hрҹ”ҘиӢұдё“з”ҹиӢұиҜӯиҝңзЁӢж•ҷиӮІе…јиҒҢвң…,зңҹзҡ„йқһеёёйҖӮеҗҲеӨ–иҜӯдё“дёҡзҡ„е®қе®қе‘ҖпҪһ вҷҘпёҸ е’Ңе°Ҹжҳҹжҳҹ жүЈ123е‘ҠиҜүжҲ‘пјҒпјҒпјҒпјҒ жҲ‘ж•ҷдҪ пјҒ,15,0,2023-05-22T11:25:00,"""https://ci.xiaohongshu.com/c82cda45-5de8-b6f5-1543-98ae2f0d8fef?imageMogr2/format/jpg/quality/92/auto-orient/strip/crop/450x300/gravity/center"""
646adce00000000013016db5,数字游民/大理的每一棵树都好躺,"♦️在小红书刷到有人为了找某一棵树去拍照打卡 ♦️在这里只想说👇 『不要执着了,大理每一棵树都好躺！』 	 🔆来这里边工作边旅行的心态开始短期大理生活 🔆对于数字游民有什么想知道的可评论区告诉我 🔅我会在后面更新更具体的想法 	 @艺术薯 @旅游薯",20,0,2023-05-22T11:09:00,"""https://ci.xiaohongshu.com/155e18ac-b099-2e66-16a8-8f2ed09cb5dd?imageMogr2/format/jpg/quality/92/auto-orient/strip/crop/450x300/gravity/center"""
64696b08000000001300adde,怎样在中国赚美元,接上篇日志，因为感觉在国内生活好但是工作卷，于是自然产生了在国内赚美元的想法。这是目前我想到的一些点子，分享给大家，也欢迎大家分享自己的想法，集思广益。 另外我打算试水下其中的一些方案，关注我给大家汇报后续～,484,0,2023-05-22T00:50:00,"""https://ci.xiaohongshu.com/719c924f-fb2b-7a21-05b5-f2c13c9aeb73?imageMogr2/format/jpg/quality/92/auto-orient/strip/crop/450x300/gravity/center"""
646a389c000000001303297c,「Web3新动态」GoogleAI机器人Bard8️⃣大功能,"在加州举办的年度Google I/O大会上，Google发布了新一代语言模型 PaLM 2，为旗下AI聊天机器人「Bard」提供了更强大的能力。现在，「Bard」已正式开放给全球180多个国家和40种语言的用户使用。 以下是Bard即将上线的八大功能 	 1️⃣ 嵌入式交互，成为AI搜索引擎 资讯获取有实时性（目前仅限plus用户体验该功能），相较于ChatGPT，这是非常强有力的对抗点⚡ 2️⃣ 开放接口供各种插件访问使用 Spotify、Indeed、Uber Eats、Adobe Firefly等，基本围绕各种生活必用场景展开，扩大了接触面🔌 3️⃣ 可在手机上辅助对话 「Bard」还可以在与朋友对话时提供对话建议💬 4️⃣ 可根据输入需求提供相应的图片 Google预告未来「Bard」将能够自动识别图片，并根据用户需求提供更多功能📷 5️⃣ 可以语音方式下指令 现在在「Bard」的指令框中有一个麦克风符号，点击并授权后，你就可以使用语音方式下达指令🎙️ 6️⃣ 可将「Bard」回应结果输出 当你获得满意的答案后，你还可以在答案下方找到输出按钮，用户可以将其输出成Docs文件，或作为Gmail草稿存储✉️ 7️⃣「Bard」将与Gmail结合 未来，「Bard」可以直接与Gmail连接，在你想要撰写一封新信或回复Gmail时，可以提供及时的帮助📧 8️⃣「Bard」将支持20多种程式语言 Google表示「Bard」将支持ASP.NET、C++、Dart等20种程式语言，希望可以帮助工程师提升工作效率💻🚀 	 我是一只咚咚酱，一个Web3从业者｜老运营人｜新 辅导员。点赞👍+关注follow+收藏👌🏻，持续运营知识｜面试方法｜Web3干货｜职场妙招｜自我提升",3,0,2023-05-21T23:28:00,"""https://ci.xiaohongshu.com/be260107-b1b3-cc62-3d51-21a2efcda241?imageMogr2/format/jpg/quality/92/auto-orient/strip/crop/450x300/gravity/center"""
646a2f100000000012033de5,居家🉑服 今天夜班20-24/好困,今天来个晚班20-24在线接待 今天外面又🌧️下雨了 接待:76人，算不算多 4小时不能和8小时比，这个量还行吧 真想出去玩耍，又舍不得花💰啊 昨天出门加油和采购又是几百大洋 老夫何时才能退休啊,7,0,2023-05-21T22:47:00,"""https://ci.xiaohongshu.com/27424b6f-f22a-5a95-7d71-a650d958f8bd?imageMogr2/format/jpg/quality/92/auto-orient/strip/crop/450x300/gravity/center"""
646a28250000000027010220,泰国探索数字游民生活方式，GPT的建议是...,孩子说得还挺有道理 不过还是请大数据推给泰国的数字游民朋友们 需要一些你们的建议 泰国和巴厘岛都会去瞧瞧～,5,0,2023-05-21T22:18:00,"""https://ci.xiaohongshu.com/ea925222-f09a-ff82-e4b6-d27c10d7c34f?imageMogr2/format/jpg/quality/92/auto-orient/strip/crop/450x300/gravity/center"""
646a02510000000027000e07,没错！我找到了完全远程的工作！好自由,"算是我自己摸索的独家秘诀了！前前后后几份远程都是这样找到的，适用于工作经验不多，英语比较拉的宝们，因为远程真的很多都是外企或者偏web3的领域 	 1⃣某✖️✖️僧，虽然上面大部分都是实习，但是很多实习可以谈成远程，甚至长期，记得用关键词筛选投递！ 2⃣小红书，直接关键词“远程”之类的搜索，筛选最新，特别仔细地找！一些国内初创小公司会这样招远程 3⃣一些中介平台，但我目前没有通过这个找到，比如说传统的圆领啥的，或者比较新的rw，freelab等等，但又看到过帖子说真的可以找到，自己还没有成功过，某些这种还需要交钱才能入会害怕被割韭菜（499这种），就没有搞哈哈哈，打算多赚点钱之后试试 	 目前打算一直远程，主要是想旅居，一直到目前的工作把我辞退为止哈哈哈哈哈哈，就是说完全体验派！ 	 对了有没有除了东南亚国家以外的海外旅居城市推荐呀！暑假想去国外旅居，但东南亚赤道边好像太热子了哈哈哈哈哈哈",209,0,2023-05-21T19:36:00,"""https://ci.xiaohongshu.com/d7327629-f6ff-65b1-5364-04fd0ab809ea?imageMogr2/format/jpg/quality/92/auto-orient/strip/crop/450x300/gravity/center"""
6469f58e0000000013010ef5,【远程】数据运营，社群运营，招募啦~,"远程岗位，再度来袭咯~  	  关于工作  	 - 必须项：学历要求、语言要求 - 工作时间：9小时，单休 - 工作地点：不限，远程办公 - 转正后绩效须面议 - 远程岗位无任何企业补贴福利 	 感兴趣的小宝贝，请联系我呦！！  	 更多远程岗位/海外岗位，不定期更新，敬请期待！",17,0,2023-05-21T18:42:00,"""https://ci.xiaohongshu.com/b59e5170-be39-65d3-3104-403b9d8634ee?imageMogr2/format/jpg/quality/92/auto-orient/strip/crop/450x300/gravity/center"""
6469de68000000000800f29c,旅居体验｜安吉数字游民公社长啥样？,"随着疫情期间远程工作的兴起，数字游民的生活也越来越受到欢迎 最近通过项目伙伴的介绍，开启了一段浙江安吉的数字游民生活 这篇先讲讲我住的数字游民公社长啥样？ 	 地点：浙江安吉余村的DN余村。安吉比较早就开启了数字游民的尝试，最出名的是DNA数字游民公社。当地ZF非常支持吸引青年人才入驻，希望打造一个中国“硅谷”的vibe 	 居住：目前开放A栋，有4人间与6人间，比较类似青旅的设置。房间内配备以下物品，其中消耗品需要自行购买： -吹风机、台灯（带无线充电功能）、烧水壶、插线板、空调遥控器、脏衣篮 -床品三件套 -带锁柜子，可以保存贵重物品 因为公社目前还在内测阶段（暂未对外开放），我和朋友享受了一个超大的四人间 （小知识：听说这里的空间原先用于戏团演戏，房间是原来供演员休息的地方-&gt; 洗漱台超宽敞，好适合化妆） 	 公共区域： -设有办公桌、讨论桌、电话间等等，可以在白板、窗玻璃、甚至上墙柱子上尽情“brainstorm”想法与灵感💡可以自由地选择喜欢的空间“创作” -吧台餐区有咖啡机、微波炉、空气炸锅、小煮锅等，可以满足日常“轻料理”的部分。吧台旁边设有私人物品区、共享区以及售卖区，可以买到很多好喝的啤酒哦～！ -宠物友好：可以提前知会客服，携带宠物入住。我居住的这段时间，就有遇到两只可爱的🐶",12,0,2023-05-21T17:03:00,"""https://ci.xiaohongshu.com/14bdc0a6-40cd-2b5a-eddb-a2804b49c005?imageMogr2/format/jpg/quality/92/auto-orient/strip/crop/450x300/gravity/center"""
6469d554000000000703b9d9,不是职业适合做数字游民，而是人适合,"不是适合数字游民的职业，而是适合数字游民的人 我觉得很多信息是把因果搞反了 说到数字游民职业，主流的就是程序员、设计师、自媒体 事实上，数字游民也有一些做HR、财务、咨询等被认为不适合远程的工作的 除了自媒体这种因为数字游民才有流量的😅😅😅 还有web3这种行业性质远程为主之外 其他职业做数字游民，绝对收入相比正常上班，大概率是少的😔 且不说全职远程的机会少而又少竞争激烈，薪水也大概比不上坐班（赚境外公司钱除外） 如果自由接单，没有保障，没有公司交社保公积金，又少一笔收入 更不要说没有平台背书，马上就能认识到单打独斗的艰难 讲真，远程网站很多报价低得令人发指😭 在AIGC飞速发展的现在更是如此 如果没有足够的底气支持 普通工作尚且担心被裁员 怎么能安心自由职业朝不保夕 金字塔顶端的人只会告诉你光鲜 不会告诉你背后淋漓残酷的现实 其实最重要的是提高自己的议价能力，同时做出一定的让步 招聘永远是性价比为先 一种情况是本来就不需要坐班，那远程省钱两全其美 另种情况更常见，其实是希望坐班的，但是因为议价能力过强 所以 可以不坐班 只看到数字游民各地打卡 没看到其实可能只是换地方工作还可能朝不保夕 在看清数字游民的实质后仍选择数字游民的人 大概主要有两种 1⃣️ 真的在意自由的人 主要是地理自由，和心态自由 做数字游民 更需要有随时能赚到下一份钱的能力 那为了地理自由和部分时间自由，是否真的值得降薪呢 不一定吧 	 2⃣️物质需求不能特别高 个人也不是特别热爱城市繁华 不然，为啥人都在大城市 除了更多的就业机会 还有更多年轻活力有趣的人类 和多姿多彩的活动，公共设施，和没啥实际作用但是催人向前的繁华 算下来，其实钱赚的多一点，所谓地理套利也不过就是几千块的房租和饭钱 相比可能骨折的薪水简直不值一提😣 所以强烈建议从找一份全职远程/或是至少比较稳定的兼职/案源后再开始尝试 不能盲目跟风 毕竟十几万粉丝自媒体的收入，可能也比不上上班族 而中国的职场，其实重来的机会不那么多😞😞😞😞",28,0,2023-05-21T16:24:00,"""https://ci.xiaohongshu.com/e710b9b6-7f57-58ce-20c2-766e7dfb4784?imageMogr2/format/jpg/quality/92/auto-orient/strip/crop/450x300/gravity/center"""
