id,title,content,likes,collects,date,image
6459b0ec00000000140260b3,远程工作❤️居家办公丨薯薯热爱,2023线上教师，聘网课 | 录播课老师 招聘内容如⬆️图所示 一定要阅读上面要求报名哦！ ￼在校大学生实习可以放低要求，但要有有稳定的空余时间排课！ 祝愿大家都可以找到合适的工作和满意的薪资 有意向的可以下方留言“zx”，我们都会认真解答的,98,0,2023-05-09T10:33:00,"""https://ci.xiaohongshu.com/9caeab5e-96fc-8077-e7ed-be1a37c27819?imageMogr2/format/jpg/quality/92/auto-orient/strip/crop/450x300/gravity/center"""
6459ae8700000000130343b6,今日份实习来啦‼️均有正式人事,"2023实习岗位大汇总，大学生都能投 	 今日份实习汇总，正式人事，HR认可 	 快速提高实践能力 不仅岗位多、机会多、更能帮助你有效积累经验， 结合实际做出完美选择 	 目前很多大厂的暑期实习招聘就要截止啦！同学们抓紧时间补充经历啦！ 	 具体实习汇总学姐已经整理好啦 需要的同学们快来点赞收藏，私信了解哦 	 希望同学们都能顺利拿到offer呀",5,0,2023-05-09T10:23:00,"""https://ci.xiaohongshu.com/3f4c08cb-d0c8-7bf6-2610-4ebfb7f8b09d?imageMogr2/format/jpg/quality/92/auto-orient/strip/crop/450x300/gravity/center"""
6459939d0000000027011089,远程工作机会｜波士顿医疗中心金融分析,"今日整理的岗位新鲜出炉，这些你可能不知道的H1B公司，扩大北美求职投递范围  	 公司名称：Boston Medical Center 岗位名称：Financial Analyst II 办公地点：Remote, US 发布时间：5.7.2023 	 🖇公司简介&amp;H1B申请情况： 波士顿医疗中心（BMC）是一家拥有514张床位的非营利性学术医疗中心和安全网医院，位于马萨诸塞州波士顿南区附近。作为波士顿医疗中心卫生系统的一部分，该医院为大波士顿地区的居民提供初级和专业护理 	 H1B情况：波士顿医疗中心公司在 2020 至 2022 财年提交了 116 份 H1B 申请，平均薪资水平在80,693 美元 	 🖇岗位要领： -需要有3-5年的财务经验 -有医疗保健经验者优先，但不是必须的 -全面了解财务报表的编制，以及研究和解释数据的能力，并了解财务和业务系统 -对医疗保健会计和系统有广泛的了解是一个优势 -在总账系统以及类似的电子表格和文字处理软件方面有出色的计算机技能和经验，并有能力培训他人 	 📌📌📌 公司筛选自2022年Top 100 H1B Sponsors 排名今年最新开放岗位机会。岗位公司不定时有变化，以公司官方信息为准 	 在美国还有很多规模大提供身份支持的公司，只不过不在留学圈里那么响亮。豆豆会推荐更多不同领域的公司机会，将朋友们投递范围尽可能扩大 	 需要ℹ【内推资源】公司更多的信息或者【求职帮助】可以留言或私✉豆豆子哦。投递了很多岗位但都没有结果，想要了解自己的问题所在可以找🆓豆豆咨询哦",12,0,2023-05-09T08:28:00,"""https://ci.xiaohongshu.com/89a9cfa5-1417-155a-441f-c403ed3eee46?imageMogr2/format/jpg/quality/92/auto-orient/strip/crop/450x300/gravity/center"""
64598a1d000000002702ba5c,远程工作 #农村生活 昨天前同事问我远程工作感受，让我发觉远程工作久了有点忘记了远程的好了,昨天前同事问我远程工作感受，让我发觉远程工作久了有点忘记了远程的好了，还是要多记录记录。 回家半个月，几乎不出门。 回家的一大好处就是可以吃到各种各样的应季的东西，目前想起来的有：蕨菜、小笋、香椿、麻叶粑子、乌泡子。 这个季节种树可能有点晚了，但是还是买了葡萄、樱桃和月季苗，希望会活下来一些吧。 新孵了小鸡🐥，虽然只有两只，但数量少成活率应该会比较高。 前几天也和我自认为关系较好的两个朋友聊了会天，一个刚领证见家长，一个寡王脱单，而我好生祝福和羡慕。 最近工作又难得地进到了一个新的创作期，包括五一假期在内可能平均工作时长超过12小时（我爸都想拉电闸了……）现在基本框架和流程都完成了，提前完成了我自己对这个季度的期待。可能也是这份工作目前最后一个想要做的东西吧，希望后面能好好落地。,1,0,2023-05-09T07:47:00,"""https://ci.xiaohongshu.com/2c2aca2d-d768-a72d-ff92-e6f42f78d54a?imageMogr2/format/jpg/quality/92/auto-orient/strip/crop/450x300/gravity/center"""
64595491000000001402687c,每周中英翻译对照表：债务管理 Debt Managem,"🔴 debtor 债务人、负债的人 🔴 creditor 债权人、债主 🔴 down payment 头期款、履行保证金、首付款 🔴 grace period 宽容期、宽限期 🔴 late fee 迟滞罚金、滞纳金 🔴 payday loan 发薪日预支贷款、发薪日贷款 	                                                    	 @SFU 口笔译课程",1,0,2023-05-09T04:59:00,"""https://ci.xiaohongshu.com/db6e0c25-953c-dab0-5ae1-da419cb31890?imageMogr2/format/jpg/quality/92/auto-orient/strip/crop/450x300/gravity/center"""
64591a8c0000000013012121,宾州要求费城将远程工作者薪资税交其生活地,"按照目前的税务规定，不住在费城，但为费城的雇主工作的人，需要缴纳3.4%的非居民薪资税，包括远程工作的雇员。 	 有共和党参议员在宾州议会提案立法，要求费城将部分薪资税送回远程工作雇员所在的城市，因为他们没有使用到市政服务，但仍要为这些市政服务买单， 	 “他们没有利用警察的保护，或需要急救服务，或在市政道路上开车行驶” 	 如该法案通过，费城预估每年将损失近2亿美元市政收入。",4,0,2023-05-08T23:51:00,"""https://ci.xiaohongshu.com/9ff4a38d-8d9e-38fd-27b3-82b85f78fab4?imageMogr2/format/jpg/quality/92/auto-orient/strip/crop/450x300/gravity/center"""
6459142d0000000013017033,清迈数字游民如何找工作？,"清迈数字游民 如何找工作？ 	 在我所在的神仙公司做学习内容分析师快三个月了，觉得不夸一夸它无法表达我每天赶着去搬砖的快乐心情。顺便也和大家分享一下我是如何在清迈找到这个神仙工作的。给有同样需求的小伙伴们画个重点。 从去年来到清迈以后，就关注了脸*书上的一些小组，大家也可以自己去探索一下~对于职业发展最有价值的几个是： （划重点） 1. Digital nomad coffee club-Chiang Mai 2.Chiangmai nomad girls 3. Chiang Mai digital nomads. 4. Bitcoins in Chiangmai 大家也可以组合自己想要的关键词自行搜索。🔍 	 然后就在Chiangmai nomad girls的小组里看到公司创始人在推广一款泰语学习软件，logo是一个可爱的小猴子🐒。当时没有想找工作，只是对这个小猴子种了个印象。 	 我是学生签来的泰国，想着Gap一年好好学习泰语，学的过程中发现上课远远不够，还需要额外学习。市面上根本找不到好用的学习软件。于是想起那只很可爱的小猴子。然后找到了这款软件——Ling 	 用免费版学了两个单元，发现还不错以后，打算付费解锁后面单元的时候。突然又在Chiang Mai digital nomads的小组里发现他们在招语言学习内容分析师，这是一个语言学习类软件公司，在中国香港等多地有公司，远程办公，恰巧在清迈也有分公司！岗位职责和我学的课程设计差不多。于是就试着发了简历。几轮面试以后很幸运拿到offer，参与Ling的学习内容开发和维护工作。当然也成功拿到小猴子的终身使用权限。 	 虽然过程充满幸运但是有几件做对的事值得和大家分享，比如加入高质量的FB小组，或者加入digital nomad的一些社群网站。对于国内的远程工作，最近也见到好几个高粉大V搬到清迈生活，所以留意的话也能在自媒体领域找到满意的工作。当然，自身也要好好修炼学习才能在机会来临时牢牢把握。希望看到更多的朋友也能顺利找到满意的事情去做，顺便享受清迈，大家一起加油啊！ 	 下篇详细夸一夸我所在的神仙远程公司",23,0,2023-05-08T23:24:00,"""https://ci.xiaohongshu.com/ff5c319d-500d-6686-464e-51b6394d8593?imageMogr2/format/jpg/quality/92/auto-orient/strip/crop/450x300/gravity/center"""
6458f6bc0000000011011a0c,居家工作,有姐妹们问我怎么做？第一，那你肯定要有足够的时间，必须要是全职，如果你是一个新手，你肯定要有一定的学耐心去学习，有一个虚心学习的过程，不能有玻璃心哦 遇到一点问题就想要放弃的，这肯定是不行的，你们所遇到的问题，其实都是我们经历过的 就算有的客h情绪比较激动，我们也不能怼回去，要安抚客h.形形色色的都有，所以要有一个强大的内心,0,0,2023-05-08T21:18:00,"""https://ci.xiaohongshu.com/31fcfa20-d671-0b20-c588-564c5c104bb9?imageMogr2/format/jpg/quality/92/auto-orient/strip/crop/450x300/gravity/center"""
6458ede4000000002702b455,终于有外语专业能做的远程实习了🆘🆘,"上海/远程 尼尔森 创新咨询实习生 线上 Apple 在线内容翻译 上海/远程 华纳兄弟探索集团 销售部实习生 线上 新华社 英文客户端英文编辑实习生 远程 人民网 实习生 线上 网易 私域项目运营官 线上  翻译实习生 成都/线上 熊猫聘聘 新媒体运营实习生 远程 华南理工大学 英语翻译实习生 远程 微软亚太研发集团 战略和数据分析 - 实习生 远程 新浪微博 产品运营实习生 远程 英雄联盟手游 新媒体运营实习生 远程 腾讯 开放世界游戏玩家体验官 远程 暨南大学 线上实习生 远程 Kantar X 玖久 定性研究助理岗 远程 虹科电子 翻译编辑实习生 远程 字节跳动 国际电商实习生 远程 roselake 行业研究实习生 	 羡慕着其他同学进入大厂、年薪暴涨，而自己则一直无能狂怒抱怨:&quot;这个学校没教我&quot;、“都赖大环境”、“专业太坑”... 🤦‍♀专业情况如何大家也不是第一天知道，想要找到好工作、赚到更多的钱，大部分人都得从低年级开始准备 🆘无数的公司全年招着实习生，你如果无动于衷不去试试，大概率明年无能狂怒的人你也是一份子 ✅这半个月，我们精心筛选了140+外语人可做的岗位，100+国内外知名大厂，有线上/线下的，有外企/国企，有各种热门赛道行业，当然也有专业对口的... 🙌你离大厂差的就是这临门一脚，实习就是你通向大厂最容易的跳板 ✨无论你是大三还是大二、大一，每周都会免费更新超高含金量实习！机会不等人！",35,0,2023-05-08T20:41:00,"""https://ci.xiaohongshu.com/89e01ad3-f985-4943-cd29-724ae7c82254?imageMogr2/format/jpg/quality/92/auto-orient/strip/crop/450x300/gravity/center"""
6458e7de000000001300031e,5.8 FreeLab远程工作机会合辑,今天给大家推荐35个远程工作机会 💻 包括运营、文案、设计、插画、开发、剪辑、翻译等远程兼职/全职/外包项目工作 🔍 感兴趣的小伙伴，可以点击图片查看岗位详情 🙌 只要你符合岗位要求，就能不限于地理位置，实现在家也能工作的自由！ 👇 报名方法可以后台踢踢哦～,5,0,2023-05-08T20:15:00,"""https://ci.xiaohongshu.com/c2b58901-d767-44cc-dcc3-e646e7902ff3?imageMogr2/format/jpg/quality/92/auto-orient/strip/crop/450x300/gravity/center"""
6458bf30000000000703ad4d,📱数字简历上线了！专属域名抢注中🔥,"✨「数字简历APP」主打一个在线简历的交流互动平台。 	 🧰可以做什么？ 	 🔗【在线简历】：随时更新，让你的简历永远保持最新状态。 	 🔎【发现机会】：不喜欢投递简历？通常也不会主动申请职位？设置在线简历状态，让机会主动找上你。 	 🗣【我要找人】：在这里，遇见更多面向未来、充满创意的优秀人才，帮助你找到下一个出色的搭档。 	 🖨【制作PDF】：编辑风格样式，自定义模块内容，导出文件到手机。 	 📖【简历范文】：一键生成简历，稍微修改下，就是你自己的简历啦~ 	 🤩除了简历功能以外，其实还有很多玩法。 🔵设计师们的独立作品集 🔵本人所有社交平台账号一览 🔵记录自己曾经或者正在参与的🐂🍺项目 🔵自由职业者，数字游民，斜杠青年们的个人主页 能做的还有很多，我们期待和你一起发掘！ 	 👏第一批专属域名抢注中，目前苹果商店已上架。安卓的宝子们可以私信我，名字为你保留着。 	             @小红书成长助手 @小红书创作学院 @招聘薯",3,0,2023-05-08T17:21:00,"""https://ci.xiaohongshu.com/7cfe2061-b310-b5e8-0f91-de077e402ab4?imageMogr2/format/jpg/quality/92/auto-orient/strip/crop/450x300/gravity/center"""
6458a7940000000013012f86,50/题的作业帮英语远程审核实习🔥,"这只是其中一个，不知道大家喜不喜欢🔥 我们那边类似的、门槛更低有更多✅ 这个工作真的非常好✅ 不知道各位外语人喜欢嘛嘛喜欢的❤️★ 告诉我111吧 	                 #",19,0,2023-05-08T15:41:00,"""https://ci.xiaohongshu.com/f91fc494-b752-043a-43ce-61da98b5b5a8?imageMogr2/format/jpg/quality/92/auto-orient/strip/crop/450x300/gravity/center"""
64589d4b0000000013006d62,找海外的远程工作需要工作签证吗,孩子说的对吗家人们 税法上还可能有什么问题呢,3,0,2023-05-08T14:57:00,"""https://ci.xiaohongshu.com/c5e4d03f-fcd9-8f7f-99fb-a4000fbba560?imageMogr2/format/jpg/quality/92/auto-orient/strip/crop/450x300/gravity/center"""
645883a900000000140278a7,想认识在武汉远程工作的小伙伴,一枚互联网打工人，工作原因长期远程 太宅了，希望多认识些朋友 I型人，一点点社恐 爱好音乐电影，citywalk，在江岸区 找可以约咖啡一起外出办公的小伙伴呐,90,0,2023-05-08T13:07:00,"""https://ci.xiaohongshu.com/4d0687b3-ada7-2734-ed41-64605a95fb2c?imageMogr2/format/jpg/quality/92/auto-orient/strip/crop/450x300/gravity/center"""
64584b7d000000000800c582,公司开始要求回办公室上班啦😄,"公司这周开始终于要求大家回公司onsite上班啦，每周二和周四两天属于core days。经历了疫情好几年的fully remote work model，终于各个公司都开始陆续开始要求员工们回办公室搬砖了🧱💪 	 ☀️在fully remote vs hybrid vs fully onsite中间，个人最喜欢的就是hybrid模式。其实在疫情前，药厂的biostats group基本就是这个hybrid模式，一周可以在家工作1～2天。 	 ☀️有些药厂在夏天还有summer time，就是说可以选择周一到周四多工作1～2个小时，周五可以休假半天或者全天。说到这不得不赞一下药厂假期福利，除去常规15天的pto，10 days sick days这些，7月初整个公司有一周的summer break，圣诞也有一周的winter break。 	 ☀️这周在办公室里见到了很多不同组组员们❤️，面对面的交流真的有效很多。手里有个study的SAP正好在team review的阶段，和medical的大佬们一个个聊一遍，用简单的话语把要点难点先解释清楚，后续免去很多纯clarification的review comments，大大提高了review的效率。 	 ☀️其实对于team review的document， 有个小tip就是先找机会安排几个1:1，对最关键的team member逐个击破，获得他们对document里面关键点的赞同，后续和其它组员交流可以借力打力，推进工作便会大大的简化。 	 ☀️Onsite还有个好处就是和同事们有很多机会small talks，看起来5～10分钟的交流可以拉近人的距离更容易赢得信任。 	 🤔❗️对于年轻的事业处于起步期的朋友们，个人还是不推荐全远程工作，hybrid最佳，既能有work from home的自由又可以时不时去办公室刷个脸更有visibility。对于老板来说，即能高效完成任务又能时不时来些面对面交流的下属是不是感到更亲近呢？",13,0,2023-05-08T09:08:00,"""https://ci.xiaohongshu.com/6a527488-827d-2685-a2cd-7c225c8ef5a7?imageMogr2/format/jpg/quality/92/auto-orient/strip/crop/450x300/gravity/center"""
64583f670000000012030a20,还在用老旧和不专业命名的邮箱:会被减分！,"当代人都是视觉性动物，不要用老旧的邮箱服务了哦！ 这样会让人产生年龄偏见的同时，不专业命名的邮箱也会减分。 	 如果是在海外找工作，尽量不要用国内专属的公司邮箱地址例如163/QQ邮箱等📪 	 护士周（5/8-5/14）所有来报名参与快捷简历资深critique的都是50% OFF，私信联系我吧 有效期四个月，诚意满满啦",2,0,2023-05-08T08:16:00,"""https://ci.xiaohongshu.com/cdf0273a-aa5a-7116-061b-a1e82534e356?imageMogr2/format/jpg/quality/92/auto-orient/strip/crop/450x300/gravity/center"""
64574ad5000000001300d702,当我实现远程工作，每个城市都是我的office,打开我的手机相册，我发现在远程办公的时间里，去了很多不同的地方，周边城市比如说深圳、珠海、澳门等，省外的城市比如说厦门、长沙等。 . 在生活节奏慢下来之后，我终于明白：工作的目的，是为了更好的享受生活。 . 我想了想：在我的成长过程中，没有人告诉过我要学会休息，而我在目前的生活状态里，找回了我自己。 . 远程工作带给了我以下3个改变： .和早高峰的地铁说拜拜 我的通勤时间从原来的每天2个小时，到现在0通勤时间，这一个微小的改变极大的给予了我幸福感。 远程工作是一种有效率的模式，节约了办公室的租金，省去了上下班路上的时间，在规范的管理制度下，可以完全以结果为导向。 . .摘下社交中的微笑面具 在办公室里工作，和同事社交的这个环节少不了，包括打招呼和礼貌的微笑，省去了这些繁琐的礼节，我现在完全可以进入intj的节能模式。 远程工作是一种简单的模式，在虚拟团队的合作中，团队成员的地理位置具有离散性，采用线上的沟通方式，团队可以共同完成设定的任务。 . .把work life balance重新还给自己 我发现信息差真的是无处不在，19年我了解到有远程工作，这就是我梦想的工作方式，然后我开始想办法去fit into一份远程的工作。 远程工作是一种相对自由的模式，我可以自主地安排工作的时间，选择自己的工作场所，用自驱力去实现这种模式下的工作，也有充分的时间吃早餐或者锻炼身体。 . 关于如何找到远程工作： 1⃣.找对求职的平台，我是通过领英接到offer的 2⃣.找对行业和公司，外企的远程岗更常见，行业主要有IT等 3⃣.找对合适的岗位，如：销售、设计、工程师等 . 分享一个我看到的观点：我们对自律的误解，是把自律的状态作为终极追求的目标，与其责怪自己不自律，不如去寻找真正的热爱，找到喜爱的事情，坚持不再是难事。 . 与其去玩有限的游戏，追寻一个又一个的目标，我们不如尝试一下无限游戏，在探索当下的每一刻中感受快乐，我相信人生不是轨道，而是一片无边无际的旷野。 . 关于常见的工作问题，去翻一翻我的笔记： ✅建议女生都去找远程工作·广州（一） . 我是沙律，在外企远程工作中，希望所有女生都能找到喜欢的工作，一起远程办公吧~,24,0,2023-05-08T07:30:00,"""https://ci.xiaohongshu.com/e869e6aa-8103-c7b0-def9-70b4aef68ff2?imageMogr2/format/jpg/quality/92/auto-orient/strip/crop/450x300/gravity/center"""
645824f30000000013035fb8,英国公司回国办公的问题,申请回国办公两周被拒 理由是Data security 并告知不可将电脑带回国 请问有没有类似经验的uu请分享解决策略 如果强行带？,23,0,2023-05-08T06:23:00,"""https://ci.xiaohongshu.com/9c71a791-f0f2-95e7-051e-b6cf452ce404?imageMogr2/format/jpg/quality/92/auto-orient/strip/crop/450x300/gravity/center"""
6457ae1800000000270011e5,住进村里后，再也不想回城市卷了,"出来旅居一年了，选择的都是风景优美，气候宜人的地方。这段时间住进了海南文昌的一个小村子里。 这里有成片成片的椰林，超级nice的农村居民，非常亲民的物价，椰子6块一个，炒粉10块，冰红茶3块一杯，而且还能续杯。 每天早上，我会睡到自然醒，然后起来工作一会儿。之后，我会骑车去镇上吃个早茶。如果不想在房间里工作，我会到椰林里工作。工作忙完之后，我会去数字游民空间找居民聊聊天，喝喝咖啡，玩玩陆冲，或者骑上电瓶车漫无目的的穿梭在各个村庄椰林里。有时候，我也会和小伙伴一起去海边泡水、赶海或者敲生蚝。 我深刻地感受到，开心快乐的生活并不需要太多的物质。每天吃好一日三餐，健健康康的就很好了。想想之前在大城市的生活，其实那不是生活，只能叫活着。现在的生活，虽然简单，但是充满了乐趣和美好。 	 住进村里后，就再也不想回城倦了，城市里的节奏太快了，人们都在追逐更多的物质和金钱的成功，而这种追求往往会让我们失去内心的平静和快乐。我们不断地追求更高的工资、更好的房子、更好的车子，但是这些东西并不能带给我们真正的幸福和满足感。反而，过度的物质追求会让我们感到疲惫、焦虑和失落。 因此，我不想再回到城市的卷帙浩繁和压力中。相比之下，村庄的生活更简单、更自然、更幸福。这里的人们不会被繁琐的工作压垮，也不会在物质的追求中迷失自己。他们享受着生活的乐趣，感受着自然的美好，过着自己喜欢的生活方式。这种生活方式，让人们感到轻松、自在和快乐。 所以希望我们可以停下来，放慢脚步，感受生活的美好。不要过度追求物质和金钱的成功，因为那样会让我们失去自己的内心。相反，我们应该注重内心的满足和平静，享受每一个简单而美好的瞬间。只有这样，我们才能拥有真正的幸福和快乐。",72,0,2023-05-07T21:56:00,"""https://ci.xiaohongshu.com/1f538a20-e73d-b5ff-a780-078ac53995ba?imageMogr2/format/jpg/quality/92/auto-orient/strip/crop/450x300/gravity/center"""
64579345000000002702abda,远程办公助力渡过gap year,众所周知，对于职场人士而言，gap year一旦超过三个月，那么对于下一份工作是有一定影响的。 最近有小伙伴跟我说，刚从上一家远程公司离职，就收到了腾讯的面试电话，而且整个过程经历了一个小时以上，老板对她的远程项目很感兴趣。她之前选择远程工作是因为不想通勤，但现在又想去办公室了。 由此可见，远程办公对于之后找工作影响不大，不属于空窗期。而且这一新颖的工作模式，有时候也会引起老板的兴趣，比如可以体现自律的能力。 远程办公并不适合每个人，但它却在一定程度上发挥着不可替代的作用。 希梦远程办公致力于通过灵活的方式衔接求职者与招聘方，促进工作模式新发展。,3,0,2023-05-07T20:02:00,"""https://ci.xiaohongshu.com/3f63718e-5eaf-84f4-e36e-e7f980b160a2?imageMogr2/format/jpg/quality/92/auto-orient/strip/crop/450x300/gravity/center"""
