id,title,content,likes,collects,date,image
63fc3bae000000001303e449,2023年，我成为了Airbnb体验师和数字游民㊙️,"我喜欢李笑来老师的一句话：如果你想要的东西还不存在，那就亲自动手将它创造出来。2019 年，我在加拿大被困在朝九晚五的工作中，当时也找不到其它心仪的工作，就想实在不行，我自己创造吧。于是在摸索了两年后，我为自己创造了三份工作，Airbnb旅游体验师，小红书博主和跨境电商，我也过上了我想要的自由人生。今天分享下我的创业经验： 	 1⃣️ 找到人生关键词 我一直觉得人生前期，想的要比做的多，但不是眼高手低，而是想明白为什么做这件事，而不是如何做这件事。不能用战术上的勤奋掩盖战略上的懒惰，我利用了3个人生关键词，总结出了我想要的生活方式。 	 我的人生关键词是自由+创造+体验。我喜欢做工作自由的Airbnb体验达人，也喜欢做自媒体人创造内容，还尝试了产出被动收入的跨境电商。这些尝试都满足了我对人生体验的需求。先找到你认为重要的目标，再发力去实现它。而不是三分钟热度，兴趣来了才做。 	 2⃣️找到你的专长 确定目标，之后就是如何实现你的人生关键词。首先你要找到专长，那是你实现目标的秘密武器。当下你的工作，是利用你的什么技能和优势，总结出来，看看能不能把你的技能做成一个产品或者服务。 	 Eg我擅长归纳总结，组织能力和沟通能力强，那这三种专长就可以让我跨界成为Airbnb体验师，虽然和以前工作不一样，但是transfer我的专长到新的领域，就能让我成功跨界。 	 3⃣️得到市场的认可 上班你只需通过公司的认可，就能领工资。自由职业你想要赚到钱，需得到市场认可，满足市场需求。如果你有产品，就在社交平台分享，来测品。如果没有人买单，也许你的产品普通，或是你的消费群体定位不明确。通过你不断试错和总结，你就能找到属于你的用户，之后钱会被你吸引来。 	 当你有一天告别朝九晚五，凭你自己的能力，不受时间约束，为别人创造价值的同时还为自己创造了收入，你也就创造了你想要的自由人生，因为你所做的事就是你所爱之事。",179,0,2023-02-27T13:12:00,"""https://ci.xiaohongshu.com/89369df7-202a-c46e-18a9-343d01dfa489?imageMogr2/format/jpg/quality/92/auto-orient/strip/crop/450x300/gravity/center"""
63d8121b000000000400459d,旅居大理去哪逛？？？67个有趣店铺分享,右滑查看我大理旅居三个月发现的有趣店铺～适合收藏内含饭店咖啡馆书店面包房市集体验类店铺等等 来大理旅居的朋友可以去打卡喜欢的店也可以像我这样把想去的地方在地图上标注出来 创立一个xx系列地图 这样看起来很方便,903,0,2023-01-31T02:53:00,"""https://ci.xiaohongshu.com/dc53ead8-718d-18be-5eb7-4502958aba08?imageMogr2/format/jpg/quality/92/auto-orient/strip/crop/450x300/gravity/center"""
63b12c33000000001801378f,如何申请西班牙数字移民（全过程）上,"数字游民签证是一种居留许可，最多可延长 5 年，允许非欧盟公民在西班牙远程生活和工作！ 	 双重申请选项： 旅游签证落地西班牙后，从西班牙申请数字移民，直接拿到3年卡。 也可以从原籍国（西班牙领事馆）获得 1 年签证，进入西班牙后将此卡延长为 3 年 	 拥有这张 3 年期卡（及其随后的续签）年数都计入西班牙国籍和永久居留权。 还允许你的配偶和子女包括在同一申请中，实现一家人一起搬到西班牙。 审批时间只需要20天。 此外，你可以凭此居留卡在整个欧盟自由出入。 	 数字游民签证要求： 你是（两选一） 远程工作的雇员 自由职业者，利用网络工作，收入来源分布在西班牙境外 因此： 申请前至少 3 个月一直在为公司工作或你是自由职业者客户遍布世界各地 与公司签订至少 1 年的合同 	 证明（两选一） 有 3 年的工作相关经验 知名大学、职业培训和知名商学院的毕业生或研究生 	 5年内无犯罪记录公证认证，90 天有效期 申请表 缴纳相应的管理费单790 038 购买西班牙的私人医疗保险 至少有26,000 欧元的银行存款证明（每增加一名家庭成员则为 7,000 欧元）。 如钱存在海外银行，只需要提供简单的翻译。 	 未完待续。。。 	 ⬇️下篇预告： 	 申请数字移民注意事项",451,0,2023-01-01T14:46:00,"""https://ci.xiaohongshu.com/1b0b81bc-93ae-5e59-fdbe-36e3ac229fb5?imageMogr2/format/jpg/quality/92/auto-orient/strip/crop/450x300/gravity/center"""
6378d8fb000000000a03c7a5,宝藏旅居地｜比大理更宜过冬的云南小镇,"旅居半年后，来到云南过冬，挖掘到了一个绝佳的冷门旅居地。 	 这是个非常原生态的古城，气候宜人，晴朗蓝天，有山有水，游客罕见，物价感人，有全国最好吃的豆腐，过桥米线10元以下。最最难得的是古城图书馆和咖啡馆都是古建筑改造的，太奢侈了，简直是理想的数字游民和自由职业的办公和交流空间！ 	 说到旅居，朋友们第一反应是你要去大理了吗hhh 冬天的大理确实很宜居，但是作为旅居地还是人比较多，跟本地人的连接较弱。我也想过去建水或普洱旅居，因为节奏更慢，美食也好吃，但很幸运地发现了遗珠石屏古城（离建水不远），也太适合旅居了吧 	 有山有水 离古城2km处就有广阔的异龙湖，跟洱海一样深蓝，很适合晨跑和日落漫步，而且有建设好的跑步道和骑行道 	 古城米轨 石屏古城保护的很好，老街非常原生态，像十年前的建水古城。而且跟建水和碧色寨一样，石屏也是个碧石铁路的一部分，同样有浪漫的法式车站和米轨小火车 	 奢侈图书馆 你能想象一个县城有一座巨大的古宅院改造的图书馆吗？还配套了古琴室和书法室，太绝了！我第一次去的时候整个人都惊呆了，然后图书馆就成为了我看书和办公的绝佳地hhh 	 豆腐和米线 石屏豆腐比建水豆腐还好吃，还有各种超赞的豆制品。各种米线基本都在10元以内，而且米线卷粉都可以无限续，还有烧烤真的爱了 	 宝藏咖啡馆 文庙后的尊经阁被改造成了大方咖啡，鲜花环绕，老板小姐姐的烘焙手艺比咖啡还绝，这里也成了我在古城最常去的地方 	 人间烟火 古城少有游客，几乎没有商业开发。文庙都是本地人在打牌和遛娃，书院现在是博物馆，都是免费的，特别有生活气息 	 物价感人 石屏每隔五天赶集一次，物价实在太感人了，水果和鲜花自由，还有房价可以算是南方鹤岗了hhh 	 未完待续 石屏每天都有惊喜，特别当我交到了本地的朋友，简直是打开新世界！欢迎来石屏过冬旅居，我最近在想要不要搞个旅居小窝，这样大家过来住宿就方便多了，有兴趣的小伙伴可以私我～",667,0,2022-11-19T21:24:00,"""https://ci.xiaohongshu.com/0e586527-876e-0038-1956-eaa719cc1490?imageMogr2/format/jpg/quality/92/auto-orient/strip/crop/450x300/gravity/center"""
6378d84e000000000d025c0b,不想上班，在哪里找远程工作？,赚美金实现地理套利，自 由安排自 己的工作时间，副业or全职都可 以从这找到。 . 🟠Upwork 全球性的自 由职业平 台，聚 集900万来自全球各地的自 由工作者，让企业和独 立的专 业人士可 以进行远程连接与协作。 像Dropbox、Airbnb和微软都用它来雇用自 由职业者。该网站提供许多类别的工作，如行政支持、工程和建筑、销售和营销以及客户服 务。 . 🟡Freelancer 外包服 务平 台，拥有全球最 大的高质量威客群——超过5000万人才可供选择。 跟 踪进度 用我们的时间追 踪器和移 动应用程序保持最 新进度和活跃。自 由职业者招聘网站，有中文版，会收取一定的服 务费。 . 🟢Dribbble Dribbble是设计社区超有名的网站，发现和链接世界各地的设计师和工作的最 佳资源，应该说是设计师必 备的网站之一了。 . 🔵RemoteOK Remoteok 不仅提供最初的兼 职类工作，还有全职类签和实习类的工作。网站创始人就是一名数字游民，他同样是 Nomadlist 的创始人。 . 🟣Toptal 全球精英自 由职业者平 台，适合比较有经 验和有一定工作经历的远程工作者。主要集中在设计、开发和金融领域，宣称只筛选全球前3%的自 由职业者。,2642,0,2022-11-19T21:21:00,"""https://ci.xiaohongshu.com/6a5dce9f-6774-e4e0-74e8-cecfc4c65419?imageMogr2/format/jpg/quality/92/auto-orient/strip/crop/450x300/gravity/center"""
641bc2e9000000002702a7d6,清迈去曼谷，别只会坐飞机了，火车也很好坐！,"🚂 都有什么车？ 	  和 之间的火车一共有8辆（图2），其中9&amp;10号车是中国制造的，体验最好的车型。 	 9号车曼谷去清迈，下午6:40出发，第二天早上7:15到。10号车清迈去曼谷，下午6点出发，第二天早上6点50到。 	 13&amp;14号车也是过夜车，但不是中国制造的，体验没有那么好。 	 如果不想在火车上过夜，又想趁着白天好好看路上的风景，可以选择7&amp;8号车，时间最适合，速度也最快。但7&amp;8号车比较旧，没有那么干净和安静。 	 🚂 座位怎么选？ 	 - 这里以9&amp;10号车为例，一等座是两个人一个封闭的包厢，二等座没有封闭包厢（图3），其实体验差不多。但一等座很难抢，如果是两/四个朋友一起约着出行，可以考虑一等座，如果不是的话，建议二等座，不然和陌生人在一个密闭包厢里也挺尴尬的 	 - 泰国火车还有专门的女性车厢 	 🚂 体验怎么样？ 	 - 火车上很冷，一定要带好外套！多穿点！ 	 - 车厢很干净，也很安静。不过晚上不会熄灯，所以可以带上耳塞和眼罩 	 - 我睡觉挺轻的，还有点晕车，一开始感觉车有点晃，但想起之前晕车时都是赶快睡着就没事了，所以入睡异常的快，也睡的很沉 	 - 9&amp;10&amp;13&amp;14号车，到达的时间都是早上，可以选择去酒店放下行李就出去逛。或者提前联系酒店问问能不能提前入住 	 - 在国内没做过卧铺的就不要轻易尝试了，如果坐过，那泰国的这个火车体验肯定比国内好，不会有人大声喧哗和抽烟 	 - 每个人都有坐的地方，不用担心别人坐在你床上。同时空间更大，面对面一排最多只有4个人，不像国内硬卧，一排有6个人 	 - 火车上有餐车，同时也有盒饭，每个人还会免费发瓶水 	 - 晚上8点左右，乘务员会来把座位变成床，第二天白天大概5点多会陆续叫你起床，把床铺再变成座位 	 - 如果你像我一样，拿着28寸的箱子，那更适合做火车，价格比飞机买托运行李额更便宜 	 - 可以在车上欣赏落日和日出，但其他的景色不太多，因为很快就黑天了 	 🚂 怎么买票？ 	 - 我在泰国官网上买的，需要在国外才能上去。整体来说有点难用，但看了我的教程（图6-12）应该没啥问题 	 - 不想用官网的，我可以帮忙代买或者自己在某宝找代 	 我是谁 来做数字游民的前社畜，关注我，看我变路上的起起伏伏。",133,0,2023-03-23T11:09:00,"""https://ci.xiaohongshu.com/f48eccf8-8549-b02f-fa25-783eb8e01829?imageMogr2/format/jpg/quality/92/auto-orient/strip/crop/450x300/gravity/center"""
63f844800000000013014430,搞钱清单| 30岁二硕留学党兼职月入🇬🇧2k+,"🇬🇧秋招无果春招无望，感觉自己30年来好像一直就不是那种按部就班答题面试晋升走向人生巅峰的人儿🙈好在自己有手有脚会搞钱，不至于在本该焦虑的年纪太过失序。 	 🫀6年前英硕毕业走🐶运进了央视，后来受不了体质逃去上海搞独立音乐和电音节（EDC CHINA），20年yq和朋友@Aviation蒸汽所 做了新厂牌@传送枪 PORTAL GUN 业余时间还当上了DJ走走巡演。之后又误打误撞进了小红书公司搞潮流@潮流薯 ，待在互联网我是真的开眼界，又转战线下潮流买手店@KNOWIN潮流实验室 从0到1发展品牌自媒体。 	 🌕几句话就把这几年说完了，终于快到30岁了，行，回伦敦吧，一切重来。 	 💷首图是我做学校中文社交媒体大使发的第一份part time工资，3个月一起发的，平均一个月拿到手900。 P2-P3是我在@Upwork 平台接的远程工作，帮一个加拿大公司做中文社媒运营，目前一周400~500美金不等，签的长期合同，算下来一个月差不多1800🔪（£1500左右） 	 接下来的目标是等三/四月份美国和欧洲旅游完，开始接英国的派对演出，把DJ打碟的小爱好捡起来。争取到手月入🐛3k💷。 	 btw 最近经常早上4-5点才睡，uu们有没有什么办法能让我早睡",409,0,2023-02-24T13:00:00,"""https://ci.xiaohongshu.com/254338f5-43f6-0378-cca4-d03975fb0703?imageMogr2/format/jpg/quality/92/auto-orient/strip/crop/450x300/gravity/center"""
63dbc20d0000000008007459,♥️招募SeeDAO 城市联络人❗️,"实验期城市联络人计划招募啦❗️❗️❗️ 	 ♥️第一期SeeDAO城市联络人计划长达5个月 分为实验期和正式运行两个阶段。实验期为2月至3月正式运行为4月至6月。实验期的城市联络人将有机会通过直通车直接入选成为正式城市联络人。 	 ♥️SeeDAO城市联络人职责： • 参加SeeDAO提供的城市联络人培训。 • 在所在城市发起一次线下活动。 • 对所在城市的Web3行业环境进行调研，撰写Web3 ·数字游民城市报告。（非强制） • 接待SeeDAO成员，维护本地社群。 • 代表SeeDAO参与该城市的线下分享。（非强制） 	 ♥️招募人数： • 10位（每座城市只招募1位城市联络人） 	 ♥️成为城市联络人，你将获得： ·联动SeeDAO市政厅、孵化器、公会等组织，以SeeDAO名义在当地举办具有影响力的活动，进而提升个人影响力和社交网络 • 深入了解SeeDAO组织运作，融入SeeDAO社群，以最具影响力的华语DAO为腹地，结交志同道合的Web3 BUIDLers ·seeDAO城市联络人SBT（这是一个链上荣誉身份资产，或将成为帮助你接入其他DAO或web3项目的关键凭证） • SeeDAO积分及现金奖励（实验期城市联络任务完成后，可获得的激勋为2万See DAO积分+90U。2万积分可让你直接成为SeeDAO的L2级别贡献者，有权在SeeDAO发起带积分与现金的Bounty提案。） 	 ♥️这样的人更容易成为城市联络人： ·认同SeeDAO愿景及理念； ·对web3行业有一定的认知，对当地的Web3社区和市场有较好的理解； ·有过社团组织、活动组织的经验，如有Web3 活动组织经验更佳； ·所在地有较好Web3社群氛国 	 ♥️报名请pm 。 报名时间：2023年2月1日-2023年2月15日 面试时间：将在提交表单的当周组织面试，请注意 邮箱信息通知。 城市联络人名单公布时间：2023年2月20日。 	 ♥️来申请成为SeeDAO的城市联络人吧！我们可以共同构建一张跨越全球web3数字游民的网络促进web了数字游民的交流、互助、协作与自由",165,0,2023-02-02T22:00:00,"""https://ci.xiaohongshu.com/fdaebba7-7653-3c56-00c5-b033410de224?imageMogr2/format/jpg/quality/92/auto-orient/strip/crop/450x300/gravity/center"""
641aed8c000000002702b898,🇹🇭 文青和数字游民的最爱——The COMMONS,"The Commons是个老网红了，文青和数字游民的最爱，之前在ThongLor就非常火，疫情期间又默默在Saladaeng开幕了一家。 The COMMONS是主打开放社区的概念，大部分的是室外空间，没有空调，宠物友好。因为两个店分别在在ThongLor和SIlom区，所以价格肯定不是很低，但是还是有一些店还是很值得打卡。 📍ThongLor店（工业风+绿植）： Roast——红好多年了，游客和本地人都喜欢去的Brunch。 Seven Suns——抹茶脑袋可去，有抹茶饮品和抹茶粉卖。 Esan Ping Ping——泰国Esan风味的简餐，适合偏爱酸辣的小伙伴。 📍Saladaeng店（红色亭子）： 文东记——新加坡海南鸡饭，跟泰国的海南鸡饭不太一样。 YumCha饮茶——广式点心，不太吃泰国菜的小伙伴可以来换换口味。 TapRoom——喝精酿啤酒的好地方🍺~ 还有两家店都有的Roots——咖啡店，Guss Damn Good——冰淇淋店，Hunter Poke——波奇碗，CrackHouse——美式快餐店，The Lobster Lab——龙虾热狗等等... Saladaeng店会距离Bts近一些，ThongLor的那一家比较远，但是周围也有很多值得逛的小店，如果刚好在附近不妨去拍照打卡~ 	 @KLOOK @走走薯 @城市情报官",22,0,2023-03-22T19:59:00,"""https://ci.xiaohongshu.com/485de290-617c-65e5-3714-dd625a29431a?imageMogr2/format/jpg/quality/92/auto-orient/strip/crop/450x300/gravity/center"""
63908833000000001e03d05a,自由职业两年｜这些国外网站可以搞钱！,"1️⃣RemoteWomen【RemoteWomen.com】 该网站只招收女性‼️💃想要远程工作成为数字游民的女性可以留意一下它，给了女性更多的可能性！只注重结果导向。按头安利！💓 👉职位有：翻译，营销，平面设计，会计等 	 2️⃣Fiverr【Fiverr.com】 🌞国外自由职业者较常用到的软件，类似任务众包，👉它的不一样的地方是：你把你的技能打包放在上面，让客户进行挑选，🙋🏻‍♀️而不是你看到某公司有需求你去投递，这还蛮特别的‼️ 职位有：设计，剪辑，翻译，推广等 	 3️⃣upwork【upwork.com】 👏是较全面的接单软件，首先在平台搜索自己感兴趣的工作，（ps注意防骗哦‼️）第二步提交你的proposal！接下来就是等候客户回复啦！ 职位有：设计师，建筑师，it、数据输入等❗️ 👏感兴趣的朋友可以自行搜索使用哦！ 👉希望大家工作开心！ 💓早日实现working for anywhere‼️          @薯队长 @薯管家 @薯条小助手 @知识薯",1228,0,2022-12-07T20:33:00,"""https://ci.xiaohongshu.com/c27f00ac-26f2-2387-e77f-08407fdab291?imageMogr2/format/jpg/quality/92/auto-orient/strip/crop/450x300/gravity/center"""
63c8ea5b000000001f020958,进来抄作业‼️5种让你边旅游边赚💰的方法,"边旅行边赚钱是否也是你的梦想？ 	 续上一篇贴文分享我如何在网络接案子边工作边旅游，今天再来给大家介绍一些其他可以让你赚取旅费的收入管道，让你也可以边旅游边赚钱💰 	 1️⃣数字游民/自由职业者 🌟这个概念在近年越来越受欢迎，说的就是无需朝九晚五的打卡上班，而是通过网络来实现变现，不管你人在哪里，基本上只要电脑+网路就可以工作 🌟这类型的工作者通常以旅居的状态辗转在各个国家之间，比如你可以在马来西亚海边帮英国公司写企划书，也可以在马德里的图书馆帮澳洲公司上班 🌟数字营销，旅行摄影師，翻译，写手，IT，网页设计师，都是有可能实现这种边旅行边赚钱的生活的，现在也有许多国家开始发放数字游民签证来吸引更多人到他们国家发展 	 2️⃣自媒体 🌟在这自媒体时代，每人都能拍视频、写文章发上网络产生流量获得收益而赚取旅费，但这个步道达到变现需要付出许多时间和精力，可能会花上好几个年 🌟你的自媒体内容不一定要是关于旅游的，选好你专精的项目，或是你能提供的服务及教学，可以是时尚穿搭、户外健身、影片剪辑教学、第二语言教学等 	 3️⃣打工度假 🌟这种旅游方式我已经分享过好几次啦，有兴趣可以去爬文，马来西亚公民目前能到新西兰，澳洲，美国进行打工度假签，在当地以合法方式找到一份工作攒下钱来以后就可以继续旅行啦 	 4️⃣代购商品 🌟卖东西可以说是这几种提到的赚钱方式中利润高但风险也较高的，因为你必须面临订单问题、收付款、运费、承担海关税还有处理售后服务等繁杂问题 🌟去前先了解邮寄海关政策及与国内的差价，除了国际知名品牌以外也可以找些当地的手工艺品和原产地资源；比如死海天然的火山泥、埃及的棉料衣物等 	 5️⃣AirBnB出租你的房子 🌟如果你刚好是一个人住，长期在国外旅行的话可尝试把你的房子整理好变成温馨小套房出租，当然前提是你的房子卖相好没问题、地段方便人流多 🌟当日租房东也不是件容易的事，必须要考虑清洁打扫以及房客住宿期间会产生的种种问题 	 趁年轻就多出去走走吧，反正钱是怎么挣也挣不完的",198,0,2023-01-20T18:00:00,"""https://ci.xiaohongshu.com/733add93-cf5b-cf21-7ad7-97fe70c1a82d?imageMogr2/format/jpg/quality/92/auto-orient/strip/crop/450x300/gravity/center"""
63a43fb8000000001f022987,最适合数字游民旅居的10个目的地！冲！☄️,"上一篇我们为大家介绍了数字游民怎样挑选合适的旅居目的地几乎列出了所有的条件和指标（需要查看详情的请翻看之前的笔记） 	 而根据全球数字游民提供的综合数据，在世界范围内受到数字游民喜爱的城市排名前十位的分别是： 	 ❶ Lisbon 里斯本 🇵🇹 ❷ Bangkok 曼谷 🇹🇭 ❸ Canggu 长谷-巴厘岛 🇮🇩 ❹ ChiangMai 清迈 🇹🇭 ❺ Buenos Aires 布宜诺斯艾利斯 🇦🇷 ❻ Madeira 马德拉群岛 🇵🇹 ❼ Mexico City 墨西哥 🇲🇽 ❽ Berlin 柏林 🇩🇪 ❾ Timisoara 蒂米什瓦拉 🇷🇴 ❿ Bengaluru 班加罗尔 🇮🇳 	 其实仔细看会发现这些地方都是我们之前列出的五大条件中符合度比较高的。 而在这些城市中更容易找到数字游民群体～ 	 接下来我们会跟大家分享关于「数字游民」签证的干货！欢迎关注 	 感觉在不久的将来～大家就可以用到啦 【本期互动主题】： 如果有国内的数字游民友好城市排行榜 哪个城市是你心中的🔝TOP1？ 	 · 	 欢迎在留言区互动 	 . 	 @数字游民没疯 这里是最全的数字游民科普 想要知道什么是数字游民❓ 怎样成为数字游民❓ 欢迎关注我们&amp;加入数字游民社群‼️ 链接更多“没疯青年” 	 手把手教你成为数字游民 	           @知识薯 @小红书成长助手 @薯队长",201,0,2022-12-22T19:30:00,"""https://ci.xiaohongshu.com/a21965d7-972a-ab2c-0a6a-12f51a3d9013?imageMogr2/format/jpg/quality/92/auto-orient/strip/crop/450x300/gravity/center"""
63e1de8e000000001d022b6b,37岁放弃阿里百万年薪，我琢磨只工作不上班,"在我上一篇《副业月入过万，同事偷偷在做的5个搞钱方向！》，得到了出乎意料的空前回应。 	 看来，“全民副业”的时代指日可待，大家也终于想明白，大部分打工人的归宿，未来就是个体户。 	 只有自己掌握了生产要素，才是随时可以抵御外部风险的铁饭碗。 	 今天继续分享我从阿里裸辞后，对“搞钱”这件事情的一些认知看法。 	 最近继续和不同领域不同职业的同学朋友聊，得到了5个冉冉上升的“新职业” 	 不管你是想先试试当做副业经营，还是想换转行进到新赛道，还是想轻创业实现“只工作不上班”的理想，都可以往左翻翻，总有一款适合你。 	                    #这5个职业，你最想做",924,0,2023-02-07T13:15:00,"""https://ci.xiaohongshu.com/aa4da4a4-69c5-6d1d-1ad3-f95a69f43cee?imageMogr2/format/jpg/quality/92/auto-orient/strip/crop/450x300/gravity/center"""
641eba85000000001203f6cc,清迈🛼这口薄荷巧克力慕斯真的太可了！！,"这几天在清迈古城探店的种草&amp;踩雷： 🍦/mintnimal 不用怀疑直接冲薄荷巧克力，第一口就惊艳了！还有把薄荷冰淇淋打成慕斯喝的，这是我在古城里的最爱没有之一 	 🍹/周六夜市的水果yogurt 我喝的芒果味，厚厚绵密的酸奶入口真的好清凉嗷！ 	 ☕️/carrot 据说已经是古城里数一数二好喝的咖啡了，环境就是简单的工业风和一个小院子，好像清迈的数字游民都蛮喜欢这里的。位置有点难找，在分叉路口走进有蓝牌子那一条。 	 🥗/Sun Rays 我谢谢你拍照很好看但是吃的…就都是冷链牛角包薯条速食包沙拉凑在了一起，吃了个寂寞 	 🥞/可丽饼 夜市或者塔佩门晚上就有，味道选择很多老奶奶都是现场加水果！刚出来真的松松脆脆炒鸡好吃！ 	 ☕️/Weekday 韩国人开的咖啡店真的里面都是韩国人，咖啡味道一般但价格合适，松饼很可口！",216,0,2023-03-25T17:10:00,"""https://ci.xiaohongshu.com/91b5f940-849f-d5a9-1c8d-90febbe2978c?imageMogr2/format/jpg/quality/92/auto-orient/strip/crop/450x300/gravity/center"""
