id,title,content,likes,collects,date,image
646c91130000000013033a8f,大理窗景最好看的咖啡店！/ 数字游民☕️收藏,"来大理98天，终于来了大名鼎鼎的大碗岛 名不虚传，数字游民的多巴胺咖啡店➕1⃣️！ 🫧 「到里昂的航线」、美式都很棒 店主看着我拿出电脑，直接offer帮我把电源插地上 办公友好！ 	 苍山、白族屋顶，变幻的阳光和云 窗景真是我目前觉得大理咖啡店里最好看的了 	 2pm左右到完全没人 3pm后人较多，不能handle白噪和拍照的朋友慎来😁 	 ☕️📂大碗岛咖啡馆 大理市人民路万德福对面单元楼一单元四楼 -",26,0,2023-05-23T18:10:00,"""https://ci.xiaohongshu.com/7f5c0d93-9842-2794-e466-0f440a6a842a?imageMogr2/format/jpg/quality/92/auto-orient/strip/crop/450x300/gravity/center"""
64647d8c000000000800da99,自留💻北京咖啡厅办公友好度测评⓮ DECK,"📍DECK   🟧🟧🟧🟧⬜️ 朗园station ，在树林里办公 	 🪑桌椅高度：🟧🟧🟧🟧🟧 室内室外以及台阶三处空间划分，几乎全部桌椅都符合办公高度。 	 🔌电源：🟧🟧🟧🟧🟧 只要在室内基本都可以插上电。甚至还有苹果手机无线充电位。 	 🌐网络：🟧🟧🟧🟧🟧 稳定，开会无问题。 	 ☕️咖啡：🟧🟧🟧🟧🟧 特调和基础款都有，品质不错，也有精酿啤酒。 	 🍽️餐食：🟧🟧🟧🟧⬜️ 可颂、甜点、下酒小菜一类的，可充饥。 	 🚽卫生间：🟧🟧🟧🟧🟧 独立卫生间，还算干净。 	 🔉环境声音：🟧🟧🟧🟧⬜️ 音乐OK，桌间距较近，会稍微有点吵。可以考虑楼梯位置比较安静。 	 🚉交通：🟧🟧⬜️⬜️⬜️ 自驾打车友好，地铁不可能。（或许可以骑车） 	 👥座位数：🟧🟧🟧🟧🟧 室内舒适座位大概6.7桌的样子，如果不用插电可以坐半户外，有顶不会太晒，还可以面对小河。",147,0,2023-05-17T15:09:00,"""https://ci.xiaohongshu.com/bdefd742-4acf-1f30-8582-d2d790e6bfd7?imageMogr2/format/jpg/quality/92/auto-orient/strip/crop/450x300/gravity/center"""
64621f330000000012031a6b,🇮🇩玩会了就来Gili群岛的海边,今天离开了nusa penida 跳岛来到了GILI岛 靠近龙目岛 坐船2个小时 GILI分三个岛 A T 还有M 我去的是M岛 很清静 适合蜜月 但是我是一个人哈哈哈 这里都是成双成对的 连happy hr 都是两份 岛上不能骑摩托 唯一的交通工具就是马车或者船 要不就是自行车 我选择走路 一圈下来一小时就能走完这个岛 印尼人真的好友善 服务意识也很强 每个人都很淳朴 也很健谈 看到也会say hello问你今天过得怎么样 渐渐地我好像慢慢爱上了印度尼西亚这个群岛 它不仅仅只有巴厘岛 还有更多的秘密等着去探索,1107,0,2023-05-15T20:01:00,"""https://ci.xiaohongshu.com/5c1f211b-e8ce-3c5d-2d9c-543e9b3aadfd?imageMogr2/format/jpg/quality/92/auto-orient/strip/crop/450x300/gravity/center"""
648684400000000013033c22,大脸马蹄莲,谁能想到，有朝一日我也能亲手种出这么大的马蹄莲，张开五指都盖不住的那种大😱,2,0,2023-06-12T10:34:00,"""https://ci.xiaohongshu.com/4354fffe-52c4-d3e6-2e57-c34a58a8b696?imageMogr2/format/jpg/quality/92/auto-orient/strip/crop/450x300/gravity/center"""
648898fc00000000270286ce,三岁小孩和数字游民们的日常,"办公的日常 / 不同公司不同行业不同年龄的人在一起办公学习 / 	 这样是不是可以放肆的说一些:“我有一个朋友的故事......!”",1,0,2023-06-14T09:30:00,"""https://ci.xiaohongshu.com/82c1f9f4-6127-5028-b875-d51cff7b0db8?imageMogr2/format/jpg/quality/92/auto-orient/strip/crop/450x300/gravity/center"""
64566acd0000000013030704,自留💻北京咖啡厅办公友好度测评⓫苦尽,"📍苦尽FARAMITA 🟧🟧🟧🟧🟧 	 胡同内隐秘角落的安静三层潮玩小楼。 	 🪑桌椅高度：🟧🟧🟧🟧🟧 二层不锈钢桌子和三层室内的桌子都适合办公。 	 🔌电源：🟧🟧🟧🟧⬜️ 目前只发现三楼有电源，木头桌子旁边有三个，可以说这张桌子应该是最适合的（唯一不合适用鼠标）。 	 🌐网络：🟧🟧🟧🟧🟧 稳定，正常办公速度可以。 	 ☕️咖啡：🟧🟧🟧🟧🟧 几款艺术家特调很用心，值得尝试。 	 🍽️餐食：🟧🟧🟧🟧🟧 有吐司华夫饼沙拉，看着都不错。 	 🚽卫生间：🟧🟧🟧🟧🟧 🈶️独立卫生间，在二楼，干净。 	 🔉环境声音：🟧🟧🟧🟧🟧 如果坐在三楼室内，可以说是极致办公体验，包揽整层。还可以去露台透气。 	 🚉交通：🟧🟧🟧🟧🟧 地铁步行10min，打车直达胡同口，没地停车。 	 👥座位数：🟧🟧🟧🟧⬜️ 如果硬性要求电源的话，只能坐三楼的木桌子。但不要电源的话桌很多，工作日几乎坐不满。",98,0,2023-05-06T22:57:00,"""https://ci.xiaohongshu.com/6bdc1678-c2e7-a93f-e596-0cd918605714?imageMogr2/format/jpg/quality/92/auto-orient/strip/crop/450x300/gravity/center"""
647f37510000000027003983,25岁带着3W退休，少走30多年弯路,"我是小羊，在上海广告圈卷了两年后，我带着仅有的3W存款就退休了 . 结果... 第三个月我就稳定了下来 跑到朋友在山里的民宿做“全职保姆” 每天生活简单规律，8点起床，12点前睡觉 白天做饭打扫招待客人，和朋友一起上课写内容 晚上陪朋友去海边遛弯儿，听歌踩水 和所有退休的生活一样安逸轻松 . 这里不像其他数字游民基地，没有很酷的年轻人 但和黑黑的有点害羞的彝族男生一起在水边抓虾 就算鞋子进水衣服湿透，抓🦐也很酷很快乐！ . 我还认识了很多50+新朋友 他们有的已经退休不管孩子，一直在外面旅居 而我已经提前过上了这样的生活 真的少走了三十多年弯路 . 我的第一个朋友龙姨，和我说： 希望她儿子可以像我一样果断，去做喜欢的事 原来 是有家长可以支持我这样的生活方式的 这可能就是旅行的意义 在陌生的城市打开自己，互相温暖治愈❤️‍🩹 . 一直都很喜欢三毛说的一句话： “生命的过程，无论是阳春白雪，青菜豆腐，我都得尝尝是什么滋味，才不枉来走这么一遭” 	 之前出入上海高级的办公楼 每天都想我要为这些破ppt，错过夏花和秋叶吗？ 还好，我对这个世界的爱超过了赚钱 现在也是我目前25年zui快乐，zui专注自己感受的时刻 - 这里是25岁带着3W出发去旅居的普通女孩小羊，现在在海拔1500米的地方看星星💫",1070,0,2023-06-06T21:40:00,"""https://ci.xiaohongshu.com/49b0d428-8e9f-b9df-0f2f-06a2a7d4c760?imageMogr2/format/jpg/quality/92/auto-orient/strip/crop/450x300/gravity/center"""
6461b5a4000000001300f7a9,工作！在孤独、光荣和怀疑中不停工作！,"重读淡豹的《劳动与爱情成瘾症》：当某一天我们死去，是我们曾经的劳作定义我们的性命，给命一个性质。不是爱，不是牺牲，不是家庭，不是曾经有过的完美关系，不是奉献隐忍灵魂的激动等等任何或许有内在价值之物。是我们那些可以称之为实践（practice）的东西把我们生命的印迹刻在地表，让我们能多少幸福地死。在无神论下，不能导向更好地做的想与感只能满足自我。 	 所以，相爱，继续工作。不相爱了，继续工作。亲人离开，继续工作。生育，继续工作。在孤独、光荣和怀疑中工作。 	 是劳动、是创造、是与更广泛他人的更具体的相互关联的关系让生活自身丰盈起来，解决爱的苦痛。",119,0,2023-05-15T12:31:00,"""https://ci.xiaohongshu.com/a9dc8fe4-2235-d3aa-b843-648b2b9a52d8?imageMogr2/format/jpg/quality/92/auto-orient/strip/crop/450x300/gravity/center"""
646d88f80000000013013518,иЗ™зХЩрЯТїеМЧдЇђеТЦеХ°еОЕеКЮеЕђеПЛе•љеЇ¶жµЛиѓДвУѓ SOAP,"рЯУНSOAP   рЯЯІрЯЯІрЯЯІрЯЯІвђЬпЄП йЕТдїЩж°• 	 рЯ™Сж°Мж§ЕйЂШеЇ¶пЉЪрЯЯІрЯЯІрЯЯІрЯЯІрЯЯІ еЕ®дЄЇеЃ§еЖЕеЇІдљНпЉМйЭ†з™ЧдЄАеЬИж°Мж§ЕйЂШеЇ¶йГљеЊИеРИйАВгАВдЄ≠йЧіжШѓйЂШиДЪеЗ≥еРІеП∞гАВ 	 рЯФМзФµжЇРпЉЪрЯЯІрЯЯІрЯЯІрЯЯІрЯЯІ еЗ†дєОжѓПж°МиДЪдЄЛйГљжЬЙзФµжЇРгАВ 	 рЯМРзљСзїЬпЉЪрЯЯІрЯЯІрЯЯІрЯЯІрЯЯІ з®≥еЃЪгАВ 	 вШХпЄПеТЦеХ°пЉЪрЯЯІрЯЯІрЯЯІрЯЯІрЯЯІ зЙєи∞ГеЊИе§ЪзІНпЉМжМЇе•љзЬЛзЪДгАВ 	 рЯНљпЄПй§Рй£ЯпЉЪрЯЯІрЯЯІрЯЯІрЯЯІрЯЯІ зЙЫж≤єжЮЬжК±иЫЛеРРеПЄдЄАз±їпЉМдї•еПКзФЬеУБдЄНйФЩгАВ 	 рЯЪљеНЂзФЯйЧіпЉЪрЯЯІрЯЯІрЯЯІрЯЯІрЯЯІ зЛђзЂЛеНЂзФЯйЧіпЉМеє≤еЗАгАВ 	 рЯФЙзОѓеҐГе£∞йЯ≥пЉЪрЯЯІрЯЯІрЯЯІрЯЯІвђЬпЄП еЈ•дљЬжЧ•дЄЛеНИдЇЇдєЯдЉЪжЬЙзВєе§ЪпЉМж°МйЧіиЈЭиЊГињСпЉМиГљеРђеИ∞йВїж°МиѓіиѓЭгАВ 	 рЯЪЙдЇ§йАЪпЉЪрЯЯІрЯЯІвђЬпЄПвђЬпЄПвђЬпЄП иЗ™й©ЊжЙУиљ¶еПЛе•љпЉМеЬ∞йУБдЄНеПѓиГљгАВпЉИжИЦиЃЄеПѓдї•й™Сиљ¶пЉЙ 	 рЯС•еЇІдљНжХ∞пЉЪрЯЯІрЯЯІрЯЯІрЯЯІвђЬпЄП иИТйАВеКЮеЕђдљНе§Іж¶В7.8ж°МгАВеЖНе∞±жШѓйЂШиДЪеЗ≥еРІеП∞дЇЖгАВ",188,0,2023-05-24T11:48:00,"""https://ci.xiaohongshu.com/cc4f31e9-44ac-4e69-b1ea-01e844388ed8?imageMogr2/format/jpg/quality/92/auto-orient/strip/crop/450x300/gravity/center"""
648853c2000000001101137f,巴厘岛乌布 一个勇敢者的聚集地,"最近一直被一句话激励，人生不是轨道，而是旷野。 我是已经老去的90后，2014年国外留学回国，从未找过工作，可以说没有任何工作经验的情况下，选择自己创业。到目前为止不谦虚的讲，已有小小小小的成就。虽然如此，如果上天在给我一次机会让我选择创业还是工作，我可能会选择工作，因为想想当初创业时期吃得苦，都不知道自己是怎么挺过来的。 	 因为坚持把事情做到极致和真诚的做事法则，我们手里的生意居然没有受到疫情极大的影响，顺利了熬过了这场人间炼狱，我和合伙人也在这几年创业生涯中，也实现了小小小小的财富自由。 	 但是很快，瓶颈期来了，我们很快发现自己被束缚在自己亲手搭建的茧房中无法自拔，人生的下一个十年应该怎么走，公司的下一个十年应该怎么干，经常问“为什么”的我，憋得自己喘不过气来，可能不甘平庸，可能因为明知道外面的世界精彩万分，但是还是被周围的人告知说，人要知足，该静下心来了。不知何时开始，探索自由的勇气和人生的意义，什么时候变成了心浮气躁，不务正业，叛逆不孝。 	 所以三十岁，当所有的事情都安排妥当，包括提前一年我就开始做公司业务流、工作流等规范流程，包括业务重要等级与汇报频次方式等，就是因为有一天我可以离开自己一手创建的公司，而我的小伙伴们可以依旧活的好好的，我也可以有机会出去寻找更多机遇。所以三十岁，我决定离开中国，前往这个世界上最大的数字游民社区，惊喜的发现，原来人还可以这么活法，虽然我之前很长一段时间都呆在国外，但是留学的那段时间，是可预知的，是可被计划的，而在巴厘岛，你看到的每一个外来的数字游民，他们的生活，是不可预计，不可计划的，这种不确定性带来的破茧效应，大量的信息流从这个破口中涌入，每一天颅内都充满了对生活的期待和激情，每一天都被周围的人事物跟新对一件事情的认知和态度。而这个探索的过程，是多么的栩栩如生，美妙动人。 	 人生不是轨道，是旷野。30岁学钢琴还来得及，而不是只能学习喂奶，40岁还可以学攀岩，而不是攀附领导。 	 机会是留给有勇气的人 天无绝人之路，旷野超级精彩！ 	         @生活薯",10,0,2023-06-13T19:32:00,"""https://ci.xiaohongshu.com/d4bf6f9e-00a7-3ab9-55d2-217ed87bf736?imageMogr2/format/jpg/quality/92/auto-orient/strip/crop/450x300/gravity/center"""
648041fb000000001300e574,小地方做独立摄影师，拍照写稿，怎样年入30万,"在南昌的独立纪实摄影师更确切 我的经历希望能给毕业生或想从事自由职业的人有所帮助 	 在南昌，纪实摄影师靠拍纪实题材只能喝西北风 毕业的时候目标很明确 要么摄影记者，要么是自由摄影师 毕业却没去北上广深，来了南昌 	 南昌虽然是二线，但这里缺少创作的动力 本土的媒体本来就不多，对外很少有内容需求 在南昌经历的两年的挣扎，和网上摸索 发现在江西本地创作的摄影师少，这里的内容却不少 这让我有了留下来的决心 也开始选择自己的创作方向 	 利用互联网，公益众筹去覆盖创作成本 有很多网站或者基金会支持有梦想、有情怀的人 我的第一个选题是返乡新农人，先拍10个 腾讯公益的“1001创想”计划，给我提供了创作资金 得到很多陌生朋友支持 	 利用笨办法，邮箱投稿 我当时收集了国内很多媒体需要图片故事的邮箱 用笨办法投稿，幸运的是第一篇稿子就发表了 但是等了三个月，后来编辑和我联系 等到了第一笔稿费，1500元 	 主动求助，主动推销自己 第一篇稿子的发表，让我有了创作的动力 写了一篇关于自己梦想的稿子 开始合作的编辑给我介绍合作 关注媒体人的公众号，入群认识前辈 就有了第二篇图片故事的发表 	 去一线城市参加线下摄影交流和行业培训 每个媒体都有年会，阿呆虽然在南昌，经常自费参加 只要有时间，纪实摄影培训一次没落 腾讯、今日头条、摄影家协会 渐渐的，阿呆的拍摄的图片故事被很多同行认可 成为他们在江西主要合作的纪实摄影师 	 从图片故事到视频短片 从专栏合作到签约独家 2017—2020年，陆续合作腾讯、新浪、网易、头条 合作过的公司，阿里、滴滴、京东、美团 合作过的基金会中国红十字会、中国福利、儿艺会、中国志愿者等 也是几家图库签约摄影师 图片和文字内容的产出，也收获了回报 也给自己以后的发展提供了便利 这是我自由职业的发展路径 在没有土壤的地方，逆风而行，完成了职业梦想               @生活薯 @摄影薯 @艺术薯  @知识薯",223,0,2023-06-07T16:38:00,"""https://ci.xiaohongshu.com/77d660eb-3dcb-63ad-68bb-d216080b86db?imageMogr2/format/jpg/quality/92/auto-orient/strip/crop/450x300/gravity/center"""
6479ee620000000011010e3a,「旅居日記」清迈数字游民怎么Networking,"1⃣️怎么找到组织和活动：Facebook&amp;Whatsapp 从曼谷飞来清迈的Day1 有点小小失望，因为体感上曼谷的酒店要好很多 不过第二天就体验到了浓厚的digital nomad vibe 这是让这座泰北小城不一样的地方 在Facebook群组【Chiang Mai Digital Nomad 】 看到了一个entrepreneurial meetup 于是顶着烈日前往了宁曼路的这家咖啡店 	 2⃣️聊了什么：生意&amp;生活 朋友们大多来自欧美国家 有一两份自己的小公司/小生意 在shopify开店把中国体育用品卖到欧美的纽约大叔 给小企业做咨询的佛州姐姐 做KOL agency的00后伦敦姑娘 ....... 大家聊了自己的生意和困境、旅居生活、文化差异 一起brainstorming/networking 也拉了小群相约下周在聊可以如何互相帮助 我想无论Business还是Community 本质还是人的联结，不管情感上还是技能/资源上 甚至也谈到种族/感情等相对敏感的话题 比如美国黑人姐姐谈到不同于亚裔在美国是「少数群体模范生」 黑人仍然面临着刻板印象的歧视、文化的不受尊重等问题 英国小帅哥分享了和伴侣open relationship的体验 表示他很享受 当然不一定对他们的观点多么有共鸣 但看到不同的文化和意识形态 会让人有和世界的连接感 BTW可真是练听力口语的好机会hh 	 3⃣️Takeaway：联结人&amp;拓展新可能 ⭐️对海外小微企业主/自由职业者来说最关心的问题是营销获客及税务，尤其Tiktok是他们非常想做但尚不太了解的渠道，因此为这个群体提供相关服务还是会有一定体量的市场 ⭐️数字游民社区在清迈运营得很好，无论物理空间的社区（e.g. Co-working空间）和心理空间的社区(e.g.活动组织)，相信这个市场也会在数字游民聚居城市有上涨趋势 ⭐️英语是打开广阔世界的大门，会带来更多好机会和美妙的联结 ⭐️Facebook群组是个好东西 ⭐️Always be open-minded~",18,0,2023-06-02T21:28:00,"""https://ci.xiaohongshu.com/1e332684-de94-f93d-9048-228192659645?imageMogr2/format/jpg/quality/92/auto-orient/strip/crop/450x300/gravity/center"""
64854ed00000000013010a37,播客推荐 | 聊聊数字游民 远程工作 个体户,"这是我的播客「市井雄心」的第二期节目： 	 本期是单口，讲讲我对于数字游民、远程工作、自由职业、个体户、副业… 等等一系列概念的的一些观察和理解。也是我近段时间来在职业和工作这条人生主线上的一些思考： 	 00:42 在互联网上赚钱的四种方法 01:39 远程办公的福利与副作用 06:45 不改变生产关系就要面临脆弱性 14:46 自由职业/个体户可能是一种主流出路 20:38 个体户拥有对抗周期的反脆弱性 30:04 创作者手中有着无边际成本的杠杆 35:02 作为个体的独特优势 41:46 AI是新时代的个体杠杆 51:31 做这档播客我的个人收获 56:42 我就是那个朝气蓬勃的行业 	 欢迎在小宇宙app，苹果播客，Spotify或其他泛用性播客客户端收听。期待反馈和交流呀。",8,0,2023-06-11T12:34:00,"""https://ci.xiaohongshu.com/9587c2eb-cd85-a1fc-a402-fe73374f95c4?imageMogr2/format/jpg/quality/92/auto-orient/strip/crop/450x300/gravity/center"""
6487cb1d000000001203ed4b,胡说留学｜非必要不补习➕补习副作用,"以为小初高补习尽头是世界名校上岸 孩子从大学起便能独立思考学习 一路名校➕好专业➕好工作➕人生赢家 对不起，作为6年深耕留学教培的搬🧱工 这几年业务涵盖堪称1⃣️条龙服务 小初高留学补习➡️本硕博留学辅导 只能一块🧱敲碎机构给编织的美梦 小初高培训的尽头是更贵的本硕博留学辅导 	 这里不责怪机构 是家长的焦虑制造了需求 当初送孩子去国际学校 好多家长说是为了素质教育 国际学校学生本该朝九晚三 剩下时间去找自己感兴趣且对社会有价值的事 而往往事与愿违，剩多少时间全拿来补习 国际教育家长无论不差钱还是尽力托举 1⃣️对1⃣️的补习，个性化定制从小抓起 就算补习没有效果 至少提供了短暂对抗焦虑的心理慰籍 	 但很少🈶️家长仔细想过 补习是否有副作用❓ 一个个本应该由学生自己面对的学术挑战 有了补习机构的辅佐，就像🎮开了外挂 神级打怪的过程中走🉐️很顺利 但却少了一点什么❓ 少了自我struggle后的成就感 一道数学难题摆在面前 独立完成之后的成就感 和老师讲一遍之后的清晰感 哪一个更能激励学生去面对新的挑战❓ 	 渐渐的学生习惯了不去struggle 一碰见学术难题就想要找1⃣️对1⃣️辅导 于是养活了以我为代表的留学生学术导师 本硕博的辅导都可以胜任 而看着我一个个乖巧的学生 我很想说的是 我在这的目的不是让你下次找我续课 我希望能够引导你慢慢脱离补习怪圈 让你有勇气下学期能独自面对学术挑战 跟我说，老师您歇着吧 这门课我自己能搞定❗️",2,0,2023-06-13T09:49:00,"""https://ci.xiaohongshu.com/f76cfdfa-8415-e8d1-06f1-9198babbb7f6?imageMogr2/format/jpg/quality/92/auto-orient/strip/crop/450x300/gravity/center"""
63be73720000000018011af9,国内2个数字游民共居社区,"年后准备去DNA试住一周，希望能结交数字游民新伙伴。本想整理出国内的数字游民共居社区，没想到比较完善的只找到两个！！欢迎大家补充哦，有机会一起去🤓 	 - 1️⃣ DNA安吉数字游民公社 要求至少驻留一周（8天7夜）。6人间180元/周，440元/月；4人间240元/周，640元/月；2人间780元/周，1960元/月。@DNA安吉数字游民公社 	 - 2️⃣ Nomad House海南文昌数字游民共居 快闪至2023年4月结束，一周（7个自然日）起租，1月租金上调15%。4人间200元/周，550元/月；大单间580元/周，1900元/月；小单间450元/周，1400元/月。工位29元/天，159元/周，399元/月。@野行yeye",913,0,2023-01-11T16:29:00,"""https://ci.xiaohongshu.com/4087053c-e6cc-750d-df20-7390da71cbfa?imageMogr2/format/jpg/quality/92/auto-orient/strip/crop/450x300/gravity/center"""
6480566d0000000027002d53,在咖啡店六小时能做多少事,"- 工作日其实很享受在客厅/自己的房间办公 一旦遇到附近装修，音乐放再大声效率还是会被影响的时候 就会毅然决然“出逃” 	 🔹11:30 am 到达咖啡店 点一杯soe热美 	 ▪️final edit 交稿一篇关于数字游民的采访 ▪️读100多页 《巴黎评论：女性作家访谈》 了解女性作家们的思考方式 她们的真实、对自我成长的耐心、工作态度 收集她们的灵感、对其他作品的点评 	 波伏瓦： “我最感兴趣的还是那些既真实又独立、工作着又创作着的女性。” “我在小说里写的是女性在现实中的样子—— 矛盾重重的人，而不是她们应该成为的样子” 立马把波伏瓦📖加入了书架 	 ▪️1:00 pm 去转角的面馆吃一碗牛肉面 ▪️回到咖啡店，点第二杯，无咖啡因冰饮 消化时间=划水时间🥤 补了20多天的日记 / 清理手机相册 ▪️读人物的一篇写MBTI的文章《为i做e，成年人的最高礼遇》 ▪️报名《羌塘空响 Ethereal Echoes》大理线下放映 + 导演问答 ▪️跟进视频项目 ▪️调研 / 写作 ▪️小红书发布 	 🔹今日3个感悟 1 / 不同环境给人不同灵感 2小时的高效好过于8小时的低效 多次试验后发现咖啡店就是一个可以至少高效2小时、迸发意想不到创意灵感的地方 那就允许自己去 我还会留预算充给喜欢的咖啡店😄 	 2 / 坦白讲我是近几年才开始慢慢享受阅读 找到适合自己的阅读方式很重要 比如现在我可能有好几本书在读（以前会觉得是不专注的表现，但其实就像每天不同时间段，想喝不同饮品一样，不同时间段想看不同书很正常） 阅读不应该被神化 它只是精神层面的生活（输入、启示、娱乐） 	 3 / MBTI测试给我最大的收获 是看到自身的局限性 无伤大雅的情况下，会有意识地接受可能启发我的邀约、去参加可能给我带来灵感的活动 而不会下意识的拒绝、因i而i（毕竟也会为钱做e😅 	 🔹6:00 pm 下班回家 分享数字游民在咖啡店工作的一天💻 -         @生活薯",20,0,2023-06-07T18:05:00,"""https://ci.xiaohongshu.com/272f741d-25ad-7711-fd2a-e5f1e3c7cbe2?imageMogr2/format/jpg/quality/92/auto-orient/strip/crop/450x300/gravity/center"""
645a49a400000000130030f3,旅居伊犁｜好喜欢今天的工位！绿色治愈一切,"旅居伊犁快1个多月啦，第一次把工位搬到户外，舍不得离开这么治愈的位置！ - 刚刚一阵风吹过，树影就在我的电脑上跳舞，4个月前还在上海工作的我绝对想不到，4个月后我居然会在新疆的一个小城市旅居，靠自己的技能，把工位搬到自然。用相机帮游客记录美好，用电脑完成一些远程工作。 - 下午没什么人，带着自己的咖啡杯点了一杯美式，是非常好闻的咖啡香味，层次感分明，回味有甘甜。 	 一边听歌一边修图，独自拥有一整个绿色庭院，鸟在树上交头接耳，阳光把背后晒的暖洋洋，坐在门口看到了六星街新开的花。 	 好治愈，是我想要的在伊犁工作的感觉～ 	 📍六星街KOZ COFFEE      @生活薯",290,0,2023-05-09T21:24:00,"""https://ci.xiaohongshu.com/3902218b-3149-8724-60bb-56c515b5cced?imageMogr2/format/jpg/quality/92/auto-orient/strip/crop/450x300/gravity/center"""
