id,title,content,likes,collects,date,image
6489a2d60000000027001f33,无所事事的那个夏天，是我摆脱焦虑的开始,"我大学毕业后曾gap了一年。从上海出发，去厦门青旅当前台，然后一路往南、往西，走到了拉萨，当过咖啡馆服务员，摆过地摊，在报社当过一个月记者。然后就空窗了。 	 那是我有意无意间的选择，想让自己“空”下来。 	 你明白那种感觉吗？哪怕你离开上海是从第一份工作裸辞，一路打工旅行，看上去是在玩，但其实你依然在把自己填满。要么打工，要么在路上，你没有一刻是停住的、空白的。 	 然后你走到了拉萨，不再打工，也没有准备前往下一个地方，你彻底“空”下来了，每天一睁眼就是大把的空闲时光。 	 最初，你惶恐不安，一种焦虑感不自觉地漫延。我们从小就是这样被训练的：要努力，勤奋，不要游手好闲。 	 哪怕是gap year，一步步地也很紧凑。你从来没有真正放松过。 	 你前所未有地看清了深埋在中国人心底的观念：无所事事是一种罪恶。 	 但你就是想要无所事事。这不就是你gap year的意义吗？从一种紧绷的状态下脱离出来，停一停，想清楚自己到底想要什么。 	 从小到大，我们像是指挥棒下的陀螺，无意识地转啊转，中考、高考、大学、找工作，完了买房、结婚、生子……哪怕你不知道为啥要这么做，但好像大家都这样，你也得这样。但这真的是你想要的吗？ 	 我不知道，所以我要寻找。 	 此后在拉萨的日子，我什么也不做，就是让自己心安理得地无所事事。有时出门走走，有时租辆自行车在老城区转转，有时瘫在出租屋里什么也不干。 	 贫穷。身上只剩三四千块钱，打工挣的。也不好意思向父母要钱，毕竟成年了。 	 但也不是太担忧。大概因为年轻，知道这是探索的实验阶段。 	 那段日子持续了近一个月。当时你并不知道它带给你什么，多年后回看，才明白那是你与自己和解的开始。你学会享受这无所事事的生活。沉稳的内心底色开始出现，坚实的自我从“空白”中生长。 	 有点像老子的“无”：陶罐的用处，正是因其内里“无”的部分。有了“无”，才有了装东西的可能。 	 然后你开始接受偶然与随机（而非原来固执的计划与步骤），一个月后搭上一辆车，重新开始旅程。 	 又一个月后，甘南徒步路上，我突然像被什么砸中似的，明确了自己的意愿：啊，还是想做媒体。不想再做财经报道，而是关注社会关注人，写关于人的故事。 	 回到旅馆，我就开始在网上找工作。三个月后，我来到北京，入职媒体，做社会与法zhi 报道。",16,0,2023-06-14T19:21:00,"""https://ci.xiaohongshu.com/e20ccda7-1384-4b74-0228-22c0d06900e1?imageMogr2/format/jpg/quality/92/auto-orient/strip/crop/450x300/gravity/center"""
648a7c3c0000000014024bbc,什么是可持续，幸福职场，设计上海现场剧透,面向多元及个性化的Z时代人群，2023设计上海围绕“可持续设计下⼀程：‘再创造’ ——幸福的形塑”为主题打造创新的呈展内容及论坛，为何会有这样的思考？又有哪些与之围绕的亮点？ 打卡一组展览图，分设3个主题展厅，打造人、自然、空间、设计的“生态”造景，新增办公设计论坛，主打健康感人居空间；首次亮相卢志荣老师的新作《插曲》，给人喧嚣都市外的身心停歇；边办公边露营的体验谁不想要？联动海洋的视觉感和嗅觉的独家设计，CULTI打造一个巨大的展陈品，结合即将亮相的限定新品，空运而来，为大家呈现了“多感官”下的舒心体验；开放多元的TALENTS，给人“完全”“敞开”式的空间设计，展示独特的人文关怀。 什么是“可持续”？定义很广，也很难给出定义，但做即在行动，在践行，在努力，足矣，简单做减法，开放无边界，健康幸福快乐，循环在点滴细节中无处不在！   #@CULTI库俐缇,2,0,2023-06-15T10:49:00,"""https://ci.xiaohongshu.com/aeb2a36c-fba7-b01d-1d01-2dd34a2002a7?imageMogr2/format/jpg/quality/92/auto-orient/strip/crop/450x300/gravity/center"""
648a8e810000000013030bf5,深圳咖啡馆的网速天花板！就藏在园岭咖啡村,第5期：张美美ZHANG M.M COFFEE 偶然发现的园岭「咖啡村」新店🏕️，来到实地才发现其实就在我挺喜欢的另一家店All You Want的背后。两家店整体的格局也比较类似，室内空间不算大，反倒是户外能容纳更多的人。🪑 整体浸润在园岭新村的社区氛围当中，小店、小路、绿树、闲适的居民，身处其中你会情不自禁的跟随着周遭环境放松下来。这就是深圳园岭「咖啡村」的感觉。 🈺：10:00-19:00 🏠：园岭新村38栋101室         @本地薯 @故事薯 @生活薯 @土拨薯,0,0,2023-06-15T12:07:00,"""https://ci.xiaohongshu.com/986be3e4-13e2-ae69-fb25-dc8d9403cbd9?imageMogr2/format/jpg/quality/92/auto-orient/strip/crop/450x300/gravity/center"""
648860dc000000001203fb40,🎙️线上圆桌预告｜播客是新红利吗?🎙,👂播客恰饭，😴播客哄睡，🚗播客飙车 说的是你吗？ 在UniX社区内，不少UniXer已经开始运营自己的播客了，这次圆桌，我们邀请播客不同阶段探索者一起聊聊运营播客的台前与幕后。 一起探索🌍播客带给了我们一个怎样的世界?🌠我们想通过播客构建一个怎样的世界? 👍话题： 1⃣️播客怎么赚钱💰有哪些变现途径? 2⃣️如何做一档高质量的播客? 3⃣️如何将节奏感、背景音处理得干净、精致? 4⃣️播客探索者私藏播客分享 🎙️嘉宾： 《生活湿地》主播：铁铮 《开卷友驿》内容和运营：yy@青沐伴读 &amp;Torres@馳野齋 🎤主持人：阿雯 🙋‍♂️活动形式： ⏰时间：6月14日 星期三晚 20:00-21:30 ✔️票价： UniX社区成员免费 非社区成员9.9元/人 ✴️报名：加入小红书·UniX数字游民活动群，或留言回复【播客】即可获取报名方式 🌏 对数字游民、UniX数字游民社区和社区活动感兴趣的大家，来📮我吧！我们都很期待认识你。 Stay tuned  ✨,12,0,2023-06-13T20:28:00,"""https://ci.xiaohongshu.com/be37563f-c433-3ee4-eade-e0ae7e838dd0?imageMogr2/format/jpg/quality/92/auto-orient/strip/crop/450x300/gravity/center"""
64899209000000001203d0b7,Midjourney关键词分享-黄色系暖男,"prompt及详细关键词拆解在置顶欢迎查看. 	 黄色有哪些形容方法？ 	 • Yellow - 黄色,一种明亮的基本黄色 • Pale yellow - 淡黄色,一种较浅淡的黄色 • Lemon yellow - 柠檬黄,一种亮丽的淡黄色,如柠檬色 • Cream yellow - 奶黄色,一种柔和的浅黄色,如clair的颜色 • Mustard yellow - 芥末黄,一种深沉的暖黄色,如芥末酱的颜色 • Amber yellow - 琥珀黄,一种橙黄色,如琥珀石的颜色 • Gold yellow - 金黄色,一种豪华热烈的黄色,如金块的颜色",320,0,2023-06-14T18:10:00,"""https://ci.xiaohongshu.com/1bb9c865-7325-00fc-10cd-2a2e39080144?imageMogr2/format/jpg/quality/92/auto-orient/strip/crop/450x300/gravity/center"""
647abdf0000000001203f1b2,寻游记｜寻资深自由设计师,👉森岛公社·寻游记 乡村文旅｜平面设计｜手绘插画｜空间展陈 活动策划｜园林城建｜文案PPT｜文化建设 👉时间充裕具备灵活性 具有较强专业能力和理解能力 积极解决问题态度不轻易撂挑子 长期多合作模式结合（按项目收费、提成、兼职）,30,0,2023-06-03T12:13:00,"""https://ci.xiaohongshu.com/606e333a-1abb-8ce3-3bec-548985c93ed9?imageMogr2/format/jpg/quality/92/auto-orient/strip/crop/450x300/gravity/center"""
6489c0a80000000012030556,完结🎉LVMH 证书｜超全题目分享📃Final Test,祝大家一切顺利！！！     感谢催我更新的粉丝们 ，让我提前拿证,41,0,2023-06-14T21:29:00,"""https://ci.xiaohongshu.com/bad21d59-33ad-f1ba-08fe-6a65df4561ff?imageMogr2/format/jpg/quality/92/auto-orient/strip/crop/450x300/gravity/center"""
64882dcf0000000012033595,🇹🇭泰国租房渠道大全（吐血整理）,最近很多姐妹在问我，如何在泰国租房， 目前我用的最多的就是3个渠道，平台、论坛和中介。 1⃣️ 平台 租房平台能够比较清晰的看到房源的视频、照片，如果像快速了解一个区的房子价格区间，可以先去平台看相关信息。 👉DDproperty（网站）：我刚到曼谷的第一套房子就是在这上面找的，这是泰国最大房地产门户网站之一，房源很全，但因为是泰国网站，语言不通，回复效率很慢很慢，我记得当时是留了非常多言，基本上都没有回复...so，建议大家可以上去浏览房源，确定想租的小区就行，直接租真的需要运气... 👉livingstock（APP）：使用体感会更好点，可以直接输入小区名字查找房源，但是会有语言不通和沟通效率低的问题...很多时候都是3天回一句，心里很没有安全感 👉Homeee泰房通（小c程）：是中国公司开发的一款租房买房小c程，里面的房源都是他们实地踩过的，我对比过价格，和其他app上的价格基本无差价，不会像其他中国app专坑华人，回复效率也很快，关键是房子介绍、客服都是中文，可以很快get到我的需求 2⃣️ 论坛 facebook里面有一个marketplace，有很多人在上面发布租房信息。facebook自带的massenger功能很好用，帖子发布者的回复速度都还蛮快的，但因为审核没有那么严，所以很多不靠谱的本地中介也会混在里面，需要分辨（据说有的中介同时租给3个人，然后跑路...） 3⃣️ 中介 如果你认识已经租过房的朋友，可以让她推荐靠谱中介。我就是学姐介绍的会中文的本地人，对当地的情况和房屋市场了解非常透彻，而且口音也不会太重，沟通起来比较愉快～ 以上就是在泰租房的相关渠道，大家可以多看多对比，如果时间不紧，千万不要着急～祝大家都能租到满意的房子❤️ *如果需要我推荐大家可以随时滴滴我哦～,12,0,2023-06-13T16:50:00,"""https://ci.xiaohongshu.com/cf423bf3-c4fc-7f61-5ae8-e5d3b6c78b30?imageMogr2/format/jpg/quality/92/auto-orient/strip/crop/450x300/gravity/center"""
64893001000000001203fe95,自由职业如何获客？源源不绝的自己来找你？,"上篇笔记有人在评论区里问到， 自由职业到哪里找客人？ 是靠marketing 还是靠熟人介绍？ 	 我的答案是当然是两个都要呀！ 	 首先最基本的就是建立自己的作品集 以前写过的文章，设计过的作品， 如果没有帮客人设计过的就自己搞个几套出来 	 这里教大家一个我自己常用的方法， 	 主动出击！！！ 就是不管客人需不需要，我先做给他看再说！ 举个例子： 假设我是个网页设计师， 专长是优化网页速度及转化率 相比起发广告乱枪打鸟， 我上网搜寻那些网页做得不怎样， 我接手后可以马上升级50%的网站 在领英或是公司网站上找到联系人邮箱 （要注意，联系人最好是老板或是marketing 经理） 发给他们一个简易提案，包含： - 列举三个他们网站可以优化的地方 - 可以怎么帮他们优化， - 优化完之后对公司的好处是什么 	 如果没回覆的话， 两天后用邮件/信息/电话去确认联系人是否收到, 同时询问如果是这个业务最好的联系人是谁 以上这个步骤每天固定一个小时去做， 可以用Hubspot追蹤 同样方法不管你是graphic designer, 文案写手，翻译，都可以用类似的方法去找客人 进阶版： 把这个提案公布在你的social media上，并tag那间公司，想不回覆你都难！ 	 这只是我用来获客的其中一种方式， 想知道更多的话就关注我啦！ 或者留言！",19,0,2023-06-14T11:12:00,"""https://ci.xiaohongshu.com/7c732753-ae48-f92d-7a3a-c01495214664?imageMogr2/format/jpg/quality/92/auto-orient/strip/crop/450x300/gravity/center"""
64898bc2000000000800fc11,数字游民6年，高效居家工作的3个小技巧,工作第6年，我一直兼着两份工：广告传媒公司运营、博主。除了定期去公司开会，平时工作最久的地方还是家里的小小书桌。 居家办公真的太适合内向型人了，减少了社交的内耗，通勤的疲累，可以享受独处空间，一切都按自己的方式去做，工作效率也upup🙌 今天分享几个亲测有效的高效技巧： . 1⃣️有纸化办公 工作上经常需要阅读、修改文件，电子版只用到视觉的处理，而电脑屏幕经常弹出信息，太容易被分心。 我习惯打印出来阅读，用记号笔做标注，这样视觉、触觉都会得到运用，更利于集中注意力。每处理完一份文件，都是看得见摸得着的，成就感远高于屏幕上滑走一面。 . 2⃣️缩小办公半径 搬了很多次家，无论大小，都给自己留出一张书桌的空间，这是居家和办公之间的边界。这张书桌也有自己的原则：办公用品都在伸手可得的地方，任何工作不会被“等一下再做”打断。 打印机一直是书桌常备，朋友来家做客总问，家里放打印机有用吗？可太有用了：合同、脚本、旅行规划打印、证件的复印、资料的扫描存档，都离不开多功能打印机。 . 桌上的惠普跃系列M232dw双面激光一体机，支持高速自动双面打印，自动双面18页/分钟；引导式控制面板，简洁直观；智能引导式呼吸灯，清晰反应机器状态；用手机app或小程序就能操作打印、复印和扫描，省去设备间传输文件的麻烦。 办公打印上的那些事，经过这台打印机的化繁为简，也能节省不少时间。出去玩的时候，把旅行规划打印出来带上，各种信息纸质落实，心里更踏实。 . 3⃣️增加时间颗粒度 时间颗粒度是一个人管理时间的基本单位。创造性工作以1小时为单位，事务性工作以20分钟为单位，不拖拉，也不追求完美，因为完美是没有标准的，但时间是有限的。 长线任务很难计算颗粒度？那就倒推，比如把2023想读的书单打印出来，30本书，每两周读完一本，结合自己的速度，每天的阅读颗粒度就出来了。 打印本周to do list，把1个颗粒度以上的工作写下来，再分配时间。所有工作日结，今日工作缓存今日清理，才能高效的完成工作👌 . 以上 感谢阅读❤️,47,0,2023-06-14T18:28:00,"""https://ci.xiaohongshu.com/f68c4b34-917d-2334-519e-2d1267090f85?imageMogr2/format/jpg/quality/92/auto-orient/strip/crop/450x300/gravity/center"""
6483fdce0000000013007d57,在长春，单身不上班，月入过万的生活是咋样的,在长春，月入过万，不买房、不谈恋爱、不结婚、不社交，那么钱都花哪去了？ 答案是：提升自己（虽然听起来有点鸡汤）。健身、买跑步健身装备、报课学习新知识新技能。 关注我，分享数字游民生活及个人提升方法。,29,0,2023-06-10T12:36:00,"""https://ci.xiaohongshu.com/a6885978-d8c6-fb2f-b364-7f57eefd1d06?imageMogr2/format/jpg/quality/92/auto-orient/strip/crop/450x300/gravity/center"""
64898232000000001203d77a,寻找les姐妹在南京合住别墅🏠,帮不玩🍠的les朋友问： 有lesbian （bi的话要确保合住期间不谈男）（但可以和女友一起）想一起合住别墅吗坐标南京 （如果是数字游民自由职业经常出差，很方便） 1.希望你心理性别和生理性别都是女性，且不带心理性别是男或者生理性别是男的人回家 2.不养宠物 3.至少半年起租，太频繁换人的话，大家的适应成本都很高 4.生活、卫生习惯良好，待人有礼貌，素质高，边界感强，能与室友相互尊重、友善沟通，不冒犯她人，也能合理保护自己。 与合租不同的是，朋友希望与姊妹共居抵御女性独居安全风险；拥有姐妹陪伴，相信友好信任关系的力量，三人行必有我师，可以互相学习各自的长处，共同成长，面对生活和工作中的困难时不再孤单                  #,2,0,2023-06-14T17:02:00,"""https://ci.xiaohongshu.com/bad09db3-afa9-f86d-761d-65e96cfc2726?imageMogr2/format/jpg/quality/92/auto-orient/strip/crop/450x300/gravity/center"""
6402d912000000002700365a,六年的大厂“活化石”，我终于可以毕业快乐了,"2017年3月成为这家大厂388号员工（大概是前十个文科生），见证了它从一匹不为人知的黑马成为人人讨论的独角兽，再行至短视频第一股。 	 六年里换过六个老板，重新出发过三次，带过两个团队。收获了一帮一定会相伴彼此一辈子的挚友。身边的同事走了一茬又一茬，直到剩下孤零零的自己成为了“活化石”。 	 被推到过台前，曾跌落过谷底。相信过别人，也曾被信任的人背叛。 	 喝过大酒，断过篇儿，嘲笑着幼稚的自己，也看着她成长。 	 六年以后，终于可以对自己说，“我见到过复杂世界的样子，但我主动选择了简单。” 	 连续工作了十年，32岁裸辞，艰难告别我一手召集的相亲相爱的小团队，也告别大厂的丰厚待遇，大大方方做自己，正式开始我的“四海为家”的自由职业生涯，开始享受自己的下一个十年人生。 	 希望它将是一场精彩的、关于自我成长的女性主题真人秀。 	 太多话要说，让我慢慢道来。今天开始，想在这儿跟对大厂职场沉浮感兴趣、对自我探索感兴趣、对裸辞后的职业生涯的朋友唠嗑儿。邀请你观看我的真人秀，也想听听你的故事。",1408,0,2023-03-04T13:37:00,"""https://ci.xiaohongshu.com/7e749343-f71e-3942-1f68-fad9648f1ede?imageMogr2/format/jpg/quality/92/auto-orient/strip/crop/450x300/gravity/center"""
6489a2170000000011010f2f,自由职业｜今天的工位,目前觉得自由职业最好的就是每天可以换一个工位吧,1,0,2023-06-14T19:18:00,"""https://ci.xiaohongshu.com/efc1af6f-35a1-3b20-25e8-68a06db17531?imageMogr2/format/jpg/quality/92/auto-orient/strip/crop/450x300/gravity/center"""
6464cd87000000001300c722,成为数字游民，不如成为服务数字游民的人！,最近，我认识了一个超会创业的95后。 · 他之前是产品经理，薪资也不错。虽然他说裸辞，是为了爱和理想离开，但我想多多少少也有行业不景气等原因。 · 但，普通人裸辞会做什么？ 想成为自由职业 想当数字游民 想做自媒体博主 想回老家 想当全职女儿、儿子 ... · 可是他很不一样诶，他没有想着去成为一个什么样身份的人，而是敏锐地洞察到这一点。去给这群想成为数字游民的人搭建平台！也就是RW实验室，RW是remove work，流动工作的意思。 · 我觉得这个思考方式就很厉害了！ 然后他不止这么想了，他也这么做了 但普通人创业，哪来钱啊，哪来的人啊 · 然后，你想不到 他运用了DAO的方式，也就是一个去中心化组织 召集到了和他有同一个理想，且看好他这个项目的人 一起加入了进来！ · 然后，就是这样一群暂时还没有经济回报的人 一起就这样把事做成了！ · 不仅被全网300000人围观 最近他还在找VC，拉投资 · 所以我就把他拉来，做分享！ 职场前后，创业历程，全都聊一遍！ 努力让我们这些裸辞人，能学到点创业小思路！ 不想创业，也可以学点怎么招人、远程团队如何协作！ · 下面是具体分析内容 1.职业产品经理的日常工作 2.离开职场的思考 3.创立RW实验室的初衷 4.作为发起人的日常职责 5.成功招募60名成员的经验 6.与风险投资者的合作经验 7.成为数字游民的秘诀 活动详情： 日期：5月21日（周六） 时间：晚上8点,165,0,2023-05-17T20:50:00,"""https://ci.xiaohongshu.com/4a3ac8d2-6c74-d228-17a9-6571762ad7a3?imageMogr2/format/jpg/quality/92/auto-orient/strip/crop/450x300/gravity/center"""
64888b3c00000000110124e6,藏在深圳蛇口别墅区的咖啡馆，超浪漫，但是,第4期：MOODBOARD餖摊 本来是去找绿木咖啡的，走进小巷意外发现了躺在收藏夹里很久的餖摊。瞄了一眼绿木感觉不太适合办公，坐进餖摊才发现同样不太打工人友好。在店里换了好几次位置依旧坐的很难受，好在店里和周边的氛围实在太加分，多走动还是待到了店员打烊。 果然是别墅区🌴，沿街有很多有格调的小店，但设施显然都不是为了办公准备的。 🈺：8:00-18:00 🏠：太子路迎晖大厦底层商铺DEF        @故事薯 @生活薯 @土拨薯,0,0,2023-06-13T23:29:00,"""https://ci.xiaohongshu.com/658f5657-ef19-23cb-9678-d9889af96c17?imageMogr2/format/jpg/quality/92/auto-orient/strip/crop/450x300/gravity/center"""
64100ddc000000001300a496,【超全】数字游民2023年必备app分享1️⃣,"对于数字游民来说，我们获得了一种自由的生活/工作方式的同时，也面临着很多的挑战，所以我们需要一些好用的工具来帮助我们更好的平衡工作与生活，也让我们的数字游民之旅更加丰富多彩！ 	 📱这是我们精心总结的2023年最适合数字游民/远程工作者的应用程序！ 超级实用一定要收藏哦 	 主要分为三个部分： 1️⃣工作地点 2️⃣工作协作 3️⃣生活领域 	 • 	 【第一部分-寻找工作场所】 	 👩‍💻数字游民在“游”的过程中，找到一个合适办公的地点是十分重要的！ 在这里推荐给大家全世界的数字游民都在用的app，用它就可以让你更好更快地找到最合适你的“办公室”！（有些联合办公空间自带社区还可以生活在这里哦） 	 🟡Coworker🟡 是一款免费应用程序，可让您访问其数据库，该数据库包含 172 个国家/地区的 25,000 多个联合办公空间。他们还拥一个 Coworker&#39;s Global Pass，每月 100 美元起，可以通过这个全球会员资格畅行 5,000 多个联合办公空间，还是很划算的！ 	 🟡Workfrom🟡 提供有关您可以工作的许多公共场所的信息，包括联合办公空间、咖啡馆、餐厅、酒店大堂和公园。您可以查看 Wi-Fi 速度、噪音水平、座位和食物选择等详细信息。而且它可以免费使用，但也有每月 5 美元起的付费计划。 	 🟡LiquidSpace🟡 拥有超过 18,000 个可用空间和超过 10,000 个场地合作伙伴。它具有按需和专用的办公空间，并具有灵活的预订条款。该应用程序可免费使用，但也提供付费计划。 	 🟡类似的还有：Letswork Deskpass 和 Anywhere.Work,Study&amp;Create 都可以让你更好的寻找到合适的办公地点！ 	 第二篇会给大家推荐📱数字游民必备的工作协同工具！让我们提高效率！事半功倍～ 	 欢迎关注我们@数字游民没疯 get 最新最全的数字游民讯息和超多干货分享！ 	 欢迎加入【没疯俱乐部】跟各种没疯青年产生联结",56,0,2023-03-14T14:02:00,"""https://ci.xiaohongshu.com/d55821c0-4dc7-1c83-0dc6-823ddc7e0d9d?imageMogr2/format/jpg/quality/92/auto-orient/strip/crop/450x300/gravity/center"""
63f97b440000000014024941,后续｜做翻译之后的几个月📝,"最多人问的是能否接翻译，笔译，线下翻译各种。 还有朋友想找我改简历，有人问我能否教英语，能否帮忙对接俱乐部的歪果仁 也在这个过程中认识了很多新朋友，发掘了很多看世界的不同视角。 	 - 	 所以只要花时间认真去做一件事情，有足够的学习能力和信息检索能力，一定会有成效的。 	 - 	 关于我的后续，还是在海南每天不停翻译的时候，一家小型美企HR找到我，合拍的领导和同事➕合理的涨薪幅度➕足够的时间空间自由，于是，我回归了本行工作。 	 出于对翻译的热爱，还是偶尔接笔译，帮改简历，也在帮做民宿的朋友做一些英文对接。 	 - 	 现在呢 重启了旅居生活，一路上与不同的人碰撞思路，又有了很多天马行空的想法。之后会怎样呢？还不晓得。欢迎关注哦 	 -",92,0,2023-02-25T11:06:00,"""https://ci.xiaohongshu.com/357e3702-98d1-bc31-f616-800e6ea05980?imageMogr2/format/jpg/quality/92/auto-orient/strip/crop/450x300/gravity/center"""
