id,title,content,likes,collects,date,image
6485f6a10000000027028fbe,不做PPT的日子里 我都在,"🔸上岛做岛民 🔹湖边看水波 🔸街头当野人 	 开窗见海的日子无比浪漫，在喧鸣波浪里入睡，再在春天里醒来。看野火燃起，听喧嚣蝉鸣。随风而起，理应尽兴",0,0,2023-06-12T00:30:00,"""https://ci.xiaohongshu.com/dc5546cc-d02b-9fe9-69f6-4d50b1981181?imageMogr2/format/jpg/quality/92/auto-orient/strip/crop/450x300/gravity/center"""
64861ef4000000001300d40e,数字游民 vs 买房生娃，聊聊我的思考和选择。,感谢大家对上两篇的喜欢，今天想聊聊我这两年的心路历程，以及对于旅居vs买房的权衡考虑。 . 因为YQ，被重塑的生活多了很多选择，也让我重新思索生命的意义，2021年7月，租房到期的那一刻我猛然惊醒，还等什么，就是现在👏 于是我们任性的买了张飞往夏威夷🏝️的单程机票，开始了这段奇妙旅程。 . 和自然朝夕相处的大半年坚定了我做数字游民的决心。我们租着一个月仅2000🔪的海景房，出门就是Waikiki海滩，每天下班游泳冲浪，周末去周边徒步潜水探险，我收获了许多感悟，放下了执念，生活变得越来越从容快乐。我问自己，既然生活有这么多种可能，为什么一定要在湾区卷呢😂 . 当时在BCG和美东工作，因为时差，我早上5点起床工作，下午1点下班，其余的时间都留给自己。工作和生活两不误，这就是因为：不同的生活方式造就了不同的时间分配。 . Tim Ferriss在著作《每周工作4小时》写到: 如果你能解放时间和地理位置，你的物质财富将自动增值3到10倍💰我有个role model也给我很多启发，她是FLAG的director，曾经在新加坡/伦敦/美国工作，还生了3个娃，事业家庭两不误。她自信自洽的态度让我惊叹，原来人生还可以这样过！ . 这次跳槽，我只考虑fully remote的工作，既然已经想好做一名世界公民，那就勇敢一点吧。恰恰幸运的是，在和Spotify面试的时候，我的生活方式和对多元文化的认同和他们一拍即合，整个面试变成聊天，我看到他们眼里的赞赏和认同☺️面试结束就拿到了口头offer。那一刻，我为能跟随自己内心感到骄傲，我发现不是因为我拿到offer才拥有自由选择的权利，而是，我本身就是这样的人，才会和他们同频共振。 想起那句话：当你决定做一件事，全世界都会帮你。 . 我们去夏威夷之前，车也卖了，真正成为“三无”人士，很多朋友笑称我是湾区的异类，但又羡慕我可以自由选择。我不否认房子能带来安全感，可是在事业上升并且探索新机会的人生阶段，我不希望因为不动产来阻碍自己的自由度。 . 因为比起安全感，你还可以拥有更广阔的世界✨ .,206,0,2023-06-12T03:22:00,"""https://ci.xiaohongshu.com/82275bdd-2925-0491-22a4-309abbe734a2?imageMogr2/format/jpg/quality/92/auto-orient/strip/crop/450x300/gravity/center"""
648621b60000000013034c53,求推荐国内适合旅居的地方,求推荐国内适合旅居的地方,0,0,2023-06-12T03:34:00,"""https://ci.xiaohongshu.com/c5817cb8-b9e9-f572-376d-eac0a232fb70?imageMogr2/format/jpg/quality/92/auto-orient/strip/crop/450x300/gravity/center"""
64865d3b000000000800f21f,иҮӘз”ұиҒҢдёҡиҖ…зҡ„е·ҘдҪңеҲ°еә•жңүе“ӘдәӣпјҹејҖеҗҜж—…еұ…з”ҹжҙ»,"з”ҹжҙ»дёӯзҡ„дёҚзЎ®е®ҡжҖ§еӨӘеӨҡдәҶ е”ҜдёҖзЎ®е®ҡзҡ„е°ұжҳҜжҲ‘жғіиҰҒеҒҘеә·иҮӘз”ұе’Ңеҝ«д№җпјҒ жңүжІЎжңүеҗҢж¬ҫеҒҡжўҰйғҪзҫЎж…•еҸҜд»Ҙremoteе·ҘдҪңзҡ„е°ҸдјҷдјҙрҹҷӢрҹҸ» ж—ҘеёёзңӢVlogжҳҜзңҹзҡ„зҫЎж…•иғҪдёҠдёҖз§’е·ҘдҪң дёӢдёҖз§’е°ұи·‘еҲ°жө·иҫ№еҶІжөӘрҹҸ„вҖҚвҷҖпёҸзҡ„жңӢеҸӢпјҒ 	 е…¶е®һж•°еӯ—жёёж°‘зҡ„иҒҢдёҡзұ»еһӢзңҹзҡ„жҳҜеӨҡз§ҚеӨҡж · д»ҺиҝңзЁӢеҶҷдҪңеҲ°ж–ҮжЎҲзј–иҫ‘ д»ҺиҝңзЁӢејҖеҸ‘еҲ°еҲӣж„Ҹи®ҫи®Ў зҝ»иҜ‘гҖҒиҮӘеӘ’дҪ“зӯүзӯү жӯЈеңЁдҪ“йӘҢж•°еӯ—жёёж°‘з”ҹжҙ»зҡ„еҸӢд»¬иҝҳжңүд»Җд№Ҳе®қи—Ҹз§Ғи—ҸпҪһ             #иҮӘз”ұиҒҢдёҡиҖ…зҡ„з”ҹжҙ»зңҹзҡ„иҮӘз”ұеҗ—",2,0,2023-06-12T07:48:00,"""https://ci.xiaohongshu.com/94745f3c-bef5-6fb9-dacb-2607e4ec84be?imageMogr2/format/jpg/quality/92/auto-orient/strip/crop/450x300/gravity/center"""
64866706000000001303e8c9,相当数字游民🙋🏻职业类型有哪些 干货篇！,"有没有同款做梦都羡慕可以remote工作的小伙伴🙋🏻 	 日常看Vlog是真的羡慕能上一秒工作 下一秒就跑到海边冲浪🏄‍♀️的朋友！ 	 其实数字游民的职业类型真的是多种多样",3,0,2023-06-12T08:29:00,"""https://ci.xiaohongshu.com/bbf2b7bb-50f7-15e6-f6e3-010bc3e3f7f6?imageMogr2/format/jpg/quality/92/auto-orient/strip/crop/450x300/gravity/center"""
648684400000000013033c22,大脸马蹄莲,谁能想到，有朝一日我也能亲手种出这么大的马蹄莲，张开五指都盖不住的那种大😱,2,0,2023-06-12T10:34:00,"""https://ci.xiaohongshu.com/4354fffe-52c4-d3e6-2e57-c34a58a8b696?imageMogr2/format/jpg/quality/92/auto-orient/strip/crop/450x300/gravity/center"""
6486ae720000000013032f32,为什么远程工作不被绝大多数公司接受？,"前不久，Meta（脸书）正式发出通知，取消远程办公，从今年9月起，所有员工每周至少都要回到办公室工作3天。 	 Meta并非硅谷大厂里唯一一个做出这个决定的，谷歌和亚马逊也在之前做出了类似的政策变动。 	 在我看来，表面上这些硅谷的大公司是在收回疫情期间发出的全员永居远程的承诺。实际上则是在用这样的方式变相裁员。 	 毕竟马斯克入主推特后，裁了80%的人依然能够维持公司正常运转。而且大模型的遍地开花，又极大地提升了员工的工作效率。 	 对于很多追求生活质量，已经适应了远程办公的员工们来说，“此处不留爷，自有留爷处”，极有可能会在这样的政策变动下主动离职。 	 我的一条暴论是：在当前技术条件下，没有不适合现代公司的远程工作机制，只有不愿意实行远程工作改革的公司。 	 也就是说，所谓的“回到线下办公室效率会更高”，其实都是扯淡。 	 那么，也许有人要问：为什么绝大多数公司都不接受远程工作呢？ 	 一句话：媒介即信息。 	 上世纪60年代，加拿大传媒学家麦克卢汉就提出了“媒介即信息”理论。简单来说就是：媒介不仅仅是传递信息的工具，而且媒介本身也会对所传播的信息产生影响。 	 举例来说，同样一条新闻，用文字形式刊登在报纸上，和用视频方式在电视上播出，传递的信息是不一样的。 	 我认为媒介即信息也适用于从传统的办公室工作向远程工作的转变，因为这个过程中，很多信息传播媒介将会不可避免地发生改变。 	 拿开会这件事来举例，在办公室里面对面的交谈，在微信群里用文字交谈，或者用Zoom/腾讯会议里用视频交谈，即便表面上传达的信息是一模一样的，因为媒介不一样，产生的最终效果也会大相径庭。 	 很多企业在疫情期间逼不得已，用极为生硬的方式进行了远程办公转型，即在完全不考虑信息传播媒介变化的前提下，完全照搬原来线下办公的工作模式到线上，这样的改变，在绝大多数情况下，是不太行得通的。 	 工作制度的远程化绝不是个一朝一夕的事情。需要在对“媒介即信息”这句话有深刻理解的前提下，自上而下地对企业的沟通机制，会议流程，甚至组织架构进行大刀阔斧的改革，方才有可能成功。 	 然而现实情况下，这对绝大多数公司都是不太可能实现的，公司越大，越难改革。 	 反观那些远程活得很好的公司，例如Automattic，Zapier，大都是从一开始就是全员远程。 	 我依然认为远程是不可逆转的趋势，然而远程办公的普及化，指望现有大公司进行自我改革，希望不大。",8,0,2023-06-12T13:34:00,"""https://ci.xiaohongshu.com/6b66e72a-83a4-e1cd-00ec-949439a87d39?imageMogr2/format/jpg/quality/92/auto-orient/strip/crop/450x300/gravity/center"""
6486b0390000000013033950,先看完这篇！再去面试！！！！,"拿到理想的工作面试通知是朝着梦想迈出的第一步。这并不是终点，你需要在面试中努力的表现出这份工作为何属于自己。 	 许多人都不知道准备面试是有技巧跟关键所在的，这篇文章中，我们将讨论面试技巧、常见问题、该问什么问题或是需要什么身体语言来加强表现自己，帮你在面试中成功地拿下这份工作。",1,0,2023-06-12T13:42:00,"""https://ci.xiaohongshu.com/7d45664a-bb1e-a67b-2082-e43f6690bdc3?imageMogr2/format/jpg/quality/92/auto-orient/strip/crop/450x300/gravity/center"""
6486b572000000000800e4bb,「旅居日记」清迈赶集人,赶集：简单而远古的快乐🤓 有市井生活人间烟火，也有不期而遇的惊喜，比如听到邓丽君的歌、喝到清迈酒、买到新耳环、吃了很多很多斑斓面包和番石榴... 集市可不就是城市的起源呢！ （我的城市规划本科老师们：好的 没白教🌝） 虽然但是，人已经到马来西亚了，也会持续关注旅途中其他国家城市的集市和消费文化～之后也打算系统梳理下旅途中关于海外市场/文化有意思的见闻和洞察，再和大家一起分享讨论,2,0,2023-06-12T14:04:00,"""https://ci.xiaohongshu.com/15fa9e06-3d30-2be8-4f41-550e2eb17972?imageMogr2/format/jpg/quality/92/auto-orient/strip/crop/450x300/gravity/center"""
6486b7650000000027010e93,29岁，没上过一天班，月入2w+,- 大学毕业后就选择成为了一名自由职业者，没有上过一天需要打卡的班。所以上班那些需要处理的人际关系，烦人的领导开会，写不完的报表赶不完的ddl我都没有过。在这一点上，我是幸运的，但是我并不想鼓吹大家都不要上班了，赶紧裸辞 - 全职自由职业到今天，已经是第7年了。这些年我还算会赚(当然这里面少不了队友的出谋划策)，细数做过的工作，数不胜数。留学申请服务，文字翻译，漫画翻译，无货源电商，虚拟产品电商，留学生作业辅导，1V1语言培训。我所有做的工作都赚到了钱，只是赚多赚少而已。真的让我月入五位数的是留学申请服务，也是我这7年一直坚持在做的事情。这里我说明一下，留学这个行业有淡旺季，每年会有5个月的淡季，淡季收入大概7-8k，旺季收入大概3-4w，平均下来还是每个月有5位数入账的 - 有很多人都会把自由职业形容的仿佛有路径可依，只要知道一些软件，会一些手艺，就可以变成自由职业。但是我觉得，事实完全不是这样，也许可以自由职业一会儿，如果想长久，必须要懂得及时变化和“随波逐流”，有一个可以握在手心的核心力量，不被周围的言语所影响。这就是为什么我不断尝试新的行业新的领域的原因，不断尝试的好处是你可以筛选出适合自己并且有发展前景的工作。虽然目前我的收入还算不错，但是我仍然没有放弃尝试，最近我就在筹备自己的留学公司，不管成功与否，我都要去试试 - 我非常不拒绝被环境推动，也不烦躁于每隔一段时间，就要开始学习一项新的技能和投入新的事情。将近三十这个年纪很好，慢慢开始懂得自己到底是什么样的人，到底适合做什么样的工作，以及开始比较客观地看待和接受自己的能力及边界 - 今天就先聊到这里了哦，因为等会有一个比较着急的工作需要处理一下，关于自由职业任何大家想听的想聊的，可以在评论区留言，这个话题我也会持续更新,27,0,2023-06-12T14:12:00,"""https://ci.xiaohongshu.com/c65ca918-939b-6ed7-d737-c4e61bcecbb8?imageMogr2/format/jpg/quality/92/auto-orient/strip/crop/450x300/gravity/center"""
6486ba400000000027011ec6,清迈数字游民聚会 认识很多新朋友｜NCC社区,"太喜欢清迈了，临时起意邀请很多数字游民来聚会，没想到进社群一下有快两百人，当天来现场有三四十人，线上也有三四十人。 	 明明来了很多有意思的人，有以太坊基金会的朋友，有一些社区的负责人，有本地人，清迈大学的学生，还有一些职业背景和游民经历很丰富的朋友，但活动准备有些仓促，人太多也没法照顾所有人，不过确实因此认识了很多很棒的人，收集到数字游民的一些经验和体验，包括保险呀，签证啊，法律问题，还有选址的取向和信息渠道呀。 	 有朋友表示很感激有这样的线下聚会，数字游民并不像表面看上去那么潇洒自如，也有很多需要面对的困难与障碍，认识的朋友就像crash一样很难深交，这样的线下交流可以很好地更了解彼此一些。也算值得了～ 	 为自己下次来清迈又找到很好的理由@NCC共创共居社区 @薯队长 @生活薯",20,0,2023-06-12T14:25:00,"""https://ci.xiaohongshu.com/13b42d38-9b10-3e52-1451-d595f9e2272e?imageMogr2/format/jpg/quality/92/auto-orient/strip/crop/450x300/gravity/center"""
6486cc3a0000000027010788,数字游民-高峰期过后的松弛🥱,5⃣️月赶了英本一波final 6⃣️月才结束了美西的一波final 💻自己的biostats昨天还来个ddl 🤯高峰期忙起来就像个007的🧱工 🙄忘了自己是🌊浪迹天涯的数字游民 🌊起来🛹起来🏂起来🏕️起来🧗‍♀️起来,8,0,2023-06-12T15:41:00,"""https://ci.xiaohongshu.com/818990e5-5a72-2222-166b-dc23c4b3fe99?imageMogr2/format/jpg/quality/92/auto-orient/strip/crop/450x300/gravity/center"""
6486cd900000000013036dcc,在上海工作就是,工作着工作着就去逛街了 工作着工作着就喝多了😴,20,0,2023-06-12T15:47:00,"""https://ci.xiaohongshu.com/09fde0c1-ebdf-5cfa-0fac-6dbc5fb9bb9b?imageMogr2/format/jpg/quality/92/auto-orient/strip/crop/450x300/gravity/center"""
6486db750000000014025fe8,иҮӘз•ҷрҹ’»еҢ—дә¬е’–е•ЎеҺ…еҠһе…¬еҸӢеҘҪеәҰжөӢиҜ„в“ұйҳ…е’–е•Ў,"рҹ“Қйҳ…е’–е•Ў   рҹҹ§рҹҹ§рҹҹ§рҹҹ§рҹҹ§ еҸҢдә• 	 рҹӘ‘жЎҢжӨ…й«ҳеәҰпјҡрҹҹ§рҹҹ§рҹҹ§рҹҹ§рҹҹ§ жүҖжңүжЎҢжӨ…й«ҳеәҰеқҮеҗҲйҖӮеҠһе…¬пјҢжңЁиҙЁжЎҢйқўеҸҜд»Ҙз”Ёйј ж ҮгҖӮжӨ…еӯҗеёҰйқ иғҢжү¶жүӢпјҢеғҸжҳҜе°ҸжІҷеҸ‘пјҢз”ҡиҮіеҸҜд»ҘзӘқйҮҢйқўзқЎгҖӮ 	 рҹ”Ңз”өжәҗпјҡрҹҹ§рҹҹ§рҹҹ§рҹҹ§рҹҹ§ е“Әе“ӘйғҪжңүпјҢдәҢжҘјеҗ§еҸ°жңҖдҪігҖӮ 	 рҹҢҗзҪ‘з»ңпјҡрҹҹ§рҹҹ§рҹҹ§рҹҹ§в¬ңпёҸ е…¬ејҖзҡ„дёҚеҘҪз”Ёзҡ„ж—¶еҖҷпјҢеҸҜд»Ҙй—®еә—е‘ҳиҰҒе‘ҳе·ҘwifiзЁіе®ҡгҖӮ 	 вҳ•пёҸе’–е•Ўпјҡрҹҹ§рҹҹ§рҹҹ§рҹҹ§в¬ңпёҸ еҹәзЎҖж¬ҫйҪҗе…ЁгҖӮ 	 рҹҚҪпёҸйӨҗйЈҹпјҡрҹҹ§рҹҹ§рҹҹ§рҹҹ§рҹҹ§ еҗғзҡ„жҢәеӨҡгҖӮ 	 рҹҡҪеҚ«з”ҹй—ҙпјҡрҹҹ§рҹҹ§рҹҹ§рҹҹ§рҹҹ§ зӢ¬з«ӢеҚ«з”ҹй—ҙпјҢдёҖжҘјпјҢи№Іеқ‘пјҢе№ІеҮҖгҖӮ 	 рҹ”үзҺҜеўғеЈ°йҹіпјҡрҹҹ§рҹҹ§рҹҹ§рҹҹ§рҹҹ§ е·ҘдҪңж—ҘгҖҒеҸҜд»ҘиҜҙеҮ д№ҺжүҖжңүдәәйғҪеңЁеҠһе…¬гҖӮжү“з”өиҜқзҡ„йғҪдјҡиҮӘи§үеҮәй—ЁгҖӮ 	 рҹҡүдәӨйҖҡпјҡрҹҹ§рҹҹ§рҹҹ§рҹҹ§рҹҹ§ ең°й“Ғз«ҷжӯҘиЎҢ10minпјҢжү“иҪҰеҲ°й—ЁеҸЈпјҢиҮӘй©ҫеҒңйҡ”еЈҒе•Ҷеңәең°дёӢгҖӮ 	 рҹ‘Ҙеә§дҪҚж•°пјҡрҹҹ§рҹҹ§рҹҹ§рҹҹ§рҹҹ§ дёӨеұӮзҡ„з©әй—ҙпјҢдҪҚзҪ®еҫҲеӨҡпјҢдҪҶд№ҹеҫҲе®№жҳ“еқҗж»ЎгҖӮ",115,0,2023-06-12T16:46:00,"""https://ci.xiaohongshu.com/18ba57cc-223c-cd4b-ad38-9085443ad8b5?imageMogr2/format/jpg/quality/92/auto-orient/strip/crop/450x300/gravity/center"""
6486e20b0000000013006edd,欧洲远程工签之马耳他数字游民签证,"马耳他政府对于数字游民的态度比较开放，2021年马耳他推出数字游民签证。这个签证允许数字游民在马耳他停留长达一年，并且可以在马耳他境内远程工作，但是不能在马耳他本地的公司工作。 马耳他数字游民签证要求： 1.有效护照 2.远程收入——您必须以雇员或自由职业者的身份工作，或者在马耳他境外拥有一家企业 3.每月 2,700 欧元——您必须每月至少赚取 2,700 欧元，并拥有最近三个月的收入证明和银行对账单 4.完整的申请——填写申请表，签名，然后通过电子邮件发送给马耳他居留机构 5.签证费 	 #中创侨智",1,0,2023-06-12T17:14:00,"""https://ci.xiaohongshu.com/e125ebda-a1eb-d7a8-97b3-56e831d817c9?imageMogr2/format/jpg/quality/92/auto-orient/strip/crop/450x300/gravity/center"""
6486e67c0000000014026f56,程序员换行第一天-迷茫,30岁转行开始做程序员，36岁迎来行业寒冬光荣毕业。 已经在家空窗两个月了，简历投了上百份，面试都没几个。反观我亲爱的队友，比我管娃的时间多的多，照顾家庭也更多，从去年年中开始，大部分月份收入都是我的两倍了，我想是不是该再次转转行，去尝试一下新的道路了,6,0,2023-06-12T17:33:00,"""https://ci.xiaohongshu.com/805d16f4-e186-444e-169e-c1fed7f806e1?imageMogr2/format/jpg/quality/92/auto-orient/strip/crop/450x300/gravity/center"""
6486e9c10000000013005482,直播预告｜2万+女性友好社区的秘密揭晓！,"RW实验室x野趣乡居 安徽快闪共居系列活动【壹】 	 👏她乡@WomenOverseas她乡 来RW做客啦！ 	 和大家聊一聊全球性别友好社区的从0到1之路 👉创建和运营性别友好社区需要几步呢？ 👉为什么需要一个性别友好的社区？ 👉没有某信的社群可以存在吗？ 👉运营社区时会遇到的困难与挑战？ 👉为爱发电可以发多久呢？ …… 	 欢迎感兴趣的朋友一起来玩～ 	 👩分享人：@穿堂风_simona 	 👋参与方式： 1.安徽线下共居社区@野趣乡居wildhomestay 2.线上同步视频号直播 	 ⏰分享时间：6月13日（周二）19:00",7,0,2023-06-12T17:47:00,"""https://ci.xiaohongshu.com/1a3e8296-3ce7-68ac-74f2-563c55e17fda?imageMogr2/format/jpg/quality/92/auto-orient/strip/crop/450x300/gravity/center"""
6486ef4d000000001300694e,数字游民第4️⃣站 上海,上海整体挺OK的 舒服  方便 新 物价也还OK 尤其是住房 比北京好多了,1,0,2023-06-12T18:11:00,"""https://ci.xiaohongshu.com/9ef0f5b0-8df2-2d57-00f9-85bf58f2a499?imageMogr2/format/jpg/quality/92/auto-orient/strip/crop/450x300/gravity/center"""
6486f36f0000000027029987,一些数字游民日常,一些数字游民日常,0,0,2023-06-12T18:29:00,"""https://ci.xiaohongshu.com/5c6da957-a41f-0b33-d459-31bf08cb00cd?imageMogr2/format/jpg/quality/92/auto-orient/strip/crop/450x300/gravity/center"""
6487013e000000000800d46e,我可以通过什么方式加入数字游民？,"加入数字游民需要具备一定的数字技能和灵活性，以下是一些常见的加入数字游民的方式： 	 学习数字技能：要成为数字游民，需要掌握一些数字技能，例如编程、网站设计、数字营销、社交媒体管理等。可以通过在线学习平台、自学或参加培训课程来学习这些技能。 寻找远程工作机会：可以通过在线招聘平台、社交媒体、网络论坛等渠道寻找远程工作机会。需要注意的是，远程工作机会通常需要有一定的经验和技能，因此可以先在传统办公室工作一段时间积累经验，然后逐渐过渡到远程工作。 自主创业：如果有好的创业想法，可以通过在线工具和数字营销来创办自己的公司或开展自己的业务。自主创业需要具备创新精神和风险承受能力，同时也需要一定的商业和管理知识。 加入数字游民社群：可以加入数字游民社群，与其他数字游民交流和分享经验，获取有用的信息和资源。数字游民社群通常可以在社交媒体、网络论坛、线下活动等地方找到。 总之，加入数字游民需要具备数字技能和灵活性，需要不断学习和适应新的工作模式和技术，同时也需要积极参与社群和交流，才能成功地实现数字游民生活。 	 希望有一天我们都能成为数字游民，到世界各地走走看看！一起加油吧！",1,0,2023-06-12T19:27:00,"""https://ci.xiaohongshu.com/e2e7eb08-1d69-0dee-be6f-43edacd4a4d2?imageMogr2/format/jpg/quality/92/auto-orient/strip/crop/450x300/gravity/center"""
64870239000000001300cb89,1%的人才知道西班牙即将推出数字游民签证,"🌐「数字游民签证」是为了吸引可以通过网络远程办公的人到西班牙居住和生活而设立的🏡 	 👩‍💻数字游民指的是那些不需要固定上班地点，依靠互联网就能谋生的人群。据英国《卫报》报道，尽管西班牙还未公布详细细则，但预计这种签证的初始有效期为一年，并可续签至zui多五年，配偶和子女也可一同申请👨‍👩‍👧‍👦 · 📋申请条件： 1⃣ 申请者必须来自欧盟以外的国家 2⃣ 过去一年中一直通过远程办公在西班牙以外的企业或机构工作 3⃣ 申请者必须在西班牙有住所，并能提供财力证明 · 💼数字移民福利： 在西班牙居住的前四年内，持有「数字游民签证」的人可享受15%的优惠税率，而当地标准税率为25%💰 · 🌍其他国家情况： 目前已有15个欧洲国家推出类似的「数字游民签证」，各国的申请标准有所不同。例如，克罗地亚要求申请者月收入不低于2300欧元，冰岛要求达到7100欧元，葡萄牙则要求不低于700欧元。据估计，西班牙将将zui低月收入门槛设定在约2000欧元左右💡 · 🌈这是一项令人振奋的消息！有了「数字游民签证」，你可以在西班牙享受悠闲生活，同时拥有更低的税率💼 	 👉想了解更多详细信息？在评论区交流或戳📥我头像旁的💬我会为你提供专业解答❗",2,0,2023-06-12T19:32:00,"""https://ci.xiaohongshu.com/b524224c-8781-11ab-fa6b-c1593f487810?imageMogr2/format/jpg/quality/92/auto-orient/strip/crop/450x300/gravity/center"""
64870307000000002701134c,人类学和数字游民的相互研究|今晚线上会议,"👋有人收到做学术研究或人类学的同学 邀请数字游民做访谈吗？ 	 今晚八点打算结合学术与实践的相关人员交流， 探索更多这种新生活方式的可能性 🐧会议 512-893-528 也是上周参加香港自由职业嘉年华三天的想法 近半年，在数字游民旅居的路上 经常收到学术研究同学的私讯。他们通常是人类学、社会学、新闻传媒等相关的学生，可能在写毕业论文或专题访谈调研。 秉持、践行王阳明先生的“知行合一”。 	 今晚周一夜话，邀请学术研究与社会实践相关的朋友一起交流、对谈。 	 🦹‍♀️数字游民文倩：好奇学术派的同学何以选定这个主题研究，目前收集到哪些样本资讯，这项研究对数字游民群体有何帮助或指引，对你个人有何影响？ 	 🧑‍🏫学术研究星空：从工作状态和情况着手；数字游民生活方式的展现或后果；从线上到线下的社交情况、心理状况到职业发展的细节与维度；灵活就业的社会保障何在？ 	 参与 星空：华中科大社会学转新闻系，香港PolyU交换生，目前在苏格兰旅游局中文帐号实习 文倩：数字游民2年+，环球旅居40+国家，支教老师，706香港社群共创",0,0,2023-06-12T19:35:00,"""https://ci.xiaohongshu.com/fdc0fac8-038d-8d56-54de-8b4f9c66a8d7?imageMogr2/format/jpg/quality/92/auto-orient/strip/crop/450x300/gravity/center"""
648704bd00000000130319a5,西安适合数字游民的咖啡厅☕️HEA,"☕️ 我去过好几次，因为太喜欢这家店的环境了 	 整个咖啡厅是白色和原木色的色调，空间宽敞，布置也简约，有多种座位类型，还有相对私密的小包间和会议室，整体很安静 - 最初是被这家店外的风景所吸引，一面通透的大玻璃窗，一抬头就能看到城墙，护城河，绿树，看电脑久了就净化一下眼睛 - 关于饮品：有咖啡、气泡水、甜品等，对于只为工作学习环境，也不怎么懂咖啡的我来说，这些到没怎么考虑 - 很适合办公人群、学习人群、数字游民来。因为我也是自由工作，会继续发现一些适合工作学习的好地方 	 ☕️：HEA 📍: 环城西路南段1号天品西岸一层1-15A室",4,0,2023-06-12T19:42:00,"""https://ci.xiaohongshu.com/4bacea8c-af86-9449-56f6-bdcfab1fbcc1?imageMogr2/format/jpg/quality/92/auto-orient/strip/crop/450x300/gravity/center"""
