id,title,content,likes,collects,date,image
647eb666000000000800ceea,朱拉隆功大学｜去撒野！别设限！,"如果可以就一直读书吧 无论外面的街道在嘈杂 走入校园内就是安静与自然 	 我想要体验式的读书 而不是为了一个专业 一纸文凭 	 我想去不同的地方了解更多的文化 认识更多有趣的人 表达彼此的想法 碰撞火花 看世界 去感受 重要的是过程啊 	 回想大学时光其实已经过的挺有趣的 但旅居后才发现那时候的自己思维很窄 没想过gap year 没想过换专业 只想着就认真把它读完 	 很少的去探索自己感兴趣的 就上课 熬夜画图 建模 有很多想法方案可老师却说没法实现 	 而现在发现 没什么不能实现的 我当时的方案都在这次的旅途中看到了 	 我们自己不应该设限 我们的想法不应该设限 我们的生命不应该设限 	 我身边也有不少同学 读了本专业的本科再到研究生 可花费了如此多的时间去读书 做创意 出来后去画图 或是很单一的工作 虽然是每个人的选择 但我觉得为此沮丧 是因为我曾看过她们发光的想法 而现在只能为了所谓的生活选择这样的一种方式 被不是设计专业的“指导”着如何做设计 	 如果觉得现在的状态不舒服 不如给自己个机会去旅居 真的在路上会发现没那么多障碍 因为每天都是充满希望与新鲜 会不断打破曾经的想法 慢慢去了解自己 认识自己 会见识各种各样没看到的有趣 这时候你会发现 自己被打开了 世界被打开了 思路被打开了 脑中的版图变得更广 拥抱new world✨",5,0,2023-06-06T12:30:00,"""https://ci.xiaohongshu.com/6a6ea4d3-a874-e5b5-fb94-d47692f01b92?imageMogr2/format/jpg/quality/92/auto-orient/strip/crop/450x300/gravity/center"""
647ec7780000000013006cdf,数字游民的一天，做饭,简简单单又一天，做饭。,1,0,2023-06-06T13:43:00,"""https://ci.xiaohongshu.com/e9546bd1-dd9a-6912-21af-9f771d5e53cb?imageMogr2/format/jpg/quality/92/auto-orient/strip/crop/450x300/gravity/center"""
647ed89100000000120326a2,数字游民在海南：只有一个电影院的城市,数字游民在海南：只有一个电影院的城市,0,0,2023-06-06T14:56:00,"""https://ci.xiaohongshu.com/6a04db66-31ae-0222-5d53-8aeb30c8dd68?imageMogr2/format/jpg/quality/92/auto-orient/strip/crop/450x300/gravity/center"""
647ed8cd000000000703ac69,义工招募丨在青城山开始一段特别的旅居时光,"⛰️  绿树阴浓，夏日的午后有些漫不经心，在蝉鸣中显得悠长却不枯燥——欢迎前来开始一段为期一个月的旅居时光。原自艺术驻舍位于青城山，是一个自然、艺术与建筑邂逅对话的场所；拥有11间客房、餐厅、咖啡厅、多功能厅、中庭及户外花园，致力于实践艺术介入乡村社区的多种可能性，帮助公众深入体验在地文化。 	 📍 工作地点：青城山原自艺术驻舍 	 ⏰ 服务时间：𝟸𝟶𝟸𝟹.𝟽.𝟷 - 𝟽.𝟹𝟷 或 𝟾.𝟷 - 𝟾.𝟹𝟷 	 你可以收获： 1.原生自然、被艺术环绕的工作环境； 2.宽松愉悦的工作氛围； 3.可爱而又充满创造力的共事伙伴； 4.服务期间的免费食宿； 5.义工津贴； 6.义工服务证明。 	 我们需要你： 1.协助门店的日常运营，如现场接待与维护； 2.协助进行简单的饮品餐食制作及客户服务； 3.参与原自艺术驻地计划的落地过程，协助艺术家驻地创作、布展及展览维护。 	 我们期待你： 1.性格热情开朗，擅长沟通，喜欢与人打交道，有良好的服务意识； 2.认同我们的理念，有团队合作精神，责任心强，灵活应变能力强； 3.有良好的抗压能力，能适应山间生活。 	 加分项! 擅长摄影或掌握插花、咖啡饮品制作技能 	 📮 请将简历发送至shop@originature.com.cn，邮件标题为“青城山义工+姓名”，期待你的加入",1205,0,2023-06-06T14:57:00,"""https://ci.xiaohongshu.com/fd2436db-a99e-c8e0-a95a-a8cb03040619?imageMogr2/format/jpg/quality/92/auto-orient/strip/crop/450x300/gravity/center"""
647edd87000000001203eb86,大湾区数字游民看过来～自由职业者嘉年华,"大湾区自由职业峰会嘉年华 将在明天6月7日开始，一连三日 是疫情后最大的自由职业者嘉年华🎉 	 👋新职人x新业态x新自由 	 日日有两岸三地，高人才展开分享对话 	 除了自由职业，更提供创业合作机会🔆 	 主办方本身是全球最大创业社区 在深圳、香港和广州 	 创业者分享来自澳大利亚，意大利，印度等国家的个人创业者 	 中国706青年空间驻深圳及香港🇭🇰 亦组队参加，连续三日更有来自 香港和深圳的706er 做讲者分享 6月7日 706深圳•大鹏半岛 Web3 space 数字游民社区负责人(相2) 今天的更多内容和讲者请丝 明后天的精彩人物与内容也会提前一日发佈",5,0,2023-06-06T15:17:00,"""https://ci.xiaohongshu.com/4964ed38-397e-8272-0c7f-6bef958da814?imageMogr2/format/jpg/quality/92/auto-orient/strip/crop/450x300/gravity/center"""
647ee72f000000000703bc88,2023，年全球最适合数字游民居住的16个城市,1、葡萄牙 里斯本 2、澳大利亚 墨尔本 3、泰国 清迈 4、印度尼西亚 巴厘岛 长谷 5、印度尼西亚 巴厘岛 乌布 6、越南 胡志明 7、南非 开普敦 8、匈牙利 布达佩斯 9、德国 柏林 10、西班牙 巴塞罗那 11、西班牙 大加那利群岛 拉斯帕耳马斯 12、巴西 里约热内卢 13、哥伦比亚 麦德林 14、哥斯达黎加 什特雷莎 15、墨西哥 图卢姆 16、美国 德克萨斯 奥斯汀,3,0,2023-06-06T15:58:00,"""https://ci.xiaohongshu.com/e1d1c1bf-e8c7-47e0-4184-5db8e7ed2050?imageMogr2/format/jpg/quality/92/auto-orient/strip/crop/450x300/gravity/center"""
647ef3730000000027002fb4,找海外旅居搭子！环游世界！八月底出发～,打算八月底出发，去格鲁吉亚，土耳其，约旦！后面还会去澳洲跟新西兰，如果签证顺利的话。 本人女生，远程办公，在国内有差不多两年的旅居经历，上个月刚从东南亚旅居回来。 随缘找旅居搭子，不住一个房间，但是可以一起玩！不穷游，也不富游hhh，可以一起做攻略，费用aa，喜欢看风景！有富士喜欢拍照但不会一直拍！ 周末双休，由于有时差，所以工作日下午也可以出去逛～比较佛系，当不了特种兵，但守时守信！ 如果有一样是远程办公的姐妹就更好了～自由职业，辞职旅游，都可以！主要是结伴安全一点,9,0,2023-06-06T16:50:00,"""https://ci.xiaohongshu.com/d48a9892-b9e5-71c4-7f59-73e65e47d38f?imageMogr2/format/jpg/quality/92/auto-orient/strip/crop/450x300/gravity/center"""
647ef6d700000000130067d9,想要一个全是这种图的评论区,想要一个全是这种图的评论区,0,0,2023-06-06T17:05:00,"""https://ci.xiaohongshu.com/3931d924-8591-e46a-21b9-29907fdeb7a4?imageMogr2/format/jpg/quality/92/auto-orient/strip/crop/450x300/gravity/center"""
647ef79000000000140275b7,清迈大学太宠学生了😭这样一大盘！才8块❗️❗️,"又是猪脚饭的一天， 在清迈不知道吃啥就吃猪脚饭啊 这家食堂摊位才40🐷啊，加一个蛋也才5🐷 肉巨多看图 	 - 55555 可惜下周要搬去古城了，因为一盘猪脚饭对清迈大学产生了巨大的不舍（当然当然，不舍得的还有图书馆啦，数字游民们，图书馆真的很适合工作💼前提是你可以解决网络的问题，用truemove的卡就可以自动连上热点，不然的话校园网是只有学生可用的 - 📍清迈大学食堂（具体见图5） 💰menu见图4",18,0,2023-06-06T17:08:00,"""https://ci.xiaohongshu.com/abafe236-c7b9-8e1b-bcf9-bf870421041c?imageMogr2/format/jpg/quality/92/auto-orient/strip/crop/450x300/gravity/center"""
647ef89a00000000270002fc,左滑倒数我从公司毕业咯💐离开上海倒计时👀,".  Day1⃣️1⃣️！  . 昨天正式结束了坐班打工的日子～ 结束的突然也不突然吧 没有特别特别的感觉 手里现有事情忙完了周一参加了一次月会 跟老板聊了聊兼职的事情就毕业啦🎓！ . 昨天晚上去吃饭还发现餐厅背后有个巨大的海报 特别应景！“something exciting is coming soon”当时看到真的觉得太棒啦 跟朋友聊天还说生活真的就会有这么多的巧合瞬间 让你自己更明确！给你力量！ . 在 和  留下了不少回忆呐！ 可以第一时间感受vlog里记录的快乐哈哈哈哈 剪视频很多时候真的会被恩宝笑鼠每次ann发布我都会一次又一次看剪过的视频 去看弹幕 每次在某些设计的点 大家笑的很开心的时候 就会觉得有被鼓励到 弹幕给了我很多动力！ 在公司和大家一起打包pr礼盒 一起线下活动 搭建场地 虽然遇到很多困难 现在想想也是和大家一起完成了 挺开心哒～希望大家都越来越好！ . 今天是free的第一天 整理家里需要二手和要打包回家以及去大理的东西 慢慢来 陆续约上海的朋友见面 好好的道别这个生活了五六年的城市啦 ！ . 从最开始的浦东新区张江高科到现在静安区陕西北路 （跟转租的小朋友聊天还说我们用了四五年时间从郊区搬到市中心 刚毕业都可以住市中心了 羡慕嘞！） . 我们也在计划找一天去上海所有租住过的房子重游故地 哈哈哈 时间真的很紧迫诶！定了17号上海飞成都的机票（先把闲置物品扔回家 一整个举家搬迁 我妈肯定扛不动我的行李哇 心疼麻麻） 	  后续如果有什么优惠的小tips！分享！ . 我现在就在p9这一堆衣服边上趴着在码字 当下突然想记录分享一下！ .  挺好  也挺好 两个城市都有各自的闪光点 现在我要去拥抱一下自然啦！ 希望在大理有更多的创作的灵感创造更多的美好 我会继续保持  保持分享哒！ . 感谢关注的每一个崽！ 我会分享更多生活美好 做个 ！ .       #去大理带什么？🤪",2,0,2023-06-06T17:12:00,"""https://ci.xiaohongshu.com/0570a5b1-ce9a-e45c-0190-b5baa1370cd1?imageMogr2/format/jpg/quality/92/auto-orient/strip/crop/450x300/gravity/center"""
647f037d00000000140278cf,巴厘岛一周数字游民,巴厘岛一周数字游民,1,0,2023-06-06T17:59:00,"""https://ci.xiaohongshu.com/23eb9a30-8206-dbdb-6f6a-8caa9f32b3d3?imageMogr2/format/jpg/quality/92/auto-orient/strip/crop/450x300/gravity/center"""
647f05840000000007039eeb,点燃白日梦｜面基数字游民，泰酷辣！,"终于，就在上周日，也就是6月4日，“点燃白日梦”线下分享会在TX淮海｜年轻力中心成功举办。两位数字游民@AbsoluteJean 和@数字游民Solar 都分享了她们精彩的故事和思考。她们都让我看到另一种生活方式的可能性，而且即便她们没有在上班，她们也在不断努力、不断探索，充满了活力，也给了我很多思路让我重新探索。 	 作为这个活动的策划者，我觉得能一起做这个活动是一件非常有缘且有趣的事情，而且在这个过程中我也认识了很多小伙伴，和可爱的@卷二不卷 和@好小一只xuur 一起合作完成了这个活动，而且真真面基快乐呀呀呀。 	 结束快乐的晚餐后，我还有幸和@卷二不卷 @裸辞小张  @AbsoluteJean 一起录了播客。第一次录播客让我觉得很新奇，而且聊天过程非常轻松愉快，每个人都有很多自己的思考，现在非常期待这期播客赶紧上架呀。 	 作为一名仍然在搬砖的打工狗🐶，我更像是数字游民的观察者。我发现数字游民虽然不再每天上班打卡，但这并不代表完全躺平。相反，他们非常积极提升自己、努力做各种尝试。他们会把精力放在自我价值的提升和体现，这其实反映出他们内驱力很强，其实也是在疯狂内卷自己。在和他们沟通的过程中，我感受到了大家澎湃的生命力，同时也给予我很大的鼓励。 最后，希望每一个曾经有白日梦💭的你，可以找回你曾经的梦想，每个梦想都是一粒种子，也许有一天就会发芽🌱、开花🌼、结果🍒。",4,0,2023-06-06T18:08:00,"""https://ci.xiaohongshu.com/3b7df1d2-18d7-9b9e-affc-1521941877ed?imageMogr2/format/jpg/quality/92/auto-orient/strip/crop/450x300/gravity/center"""
647f0dcb0000000013017008,数字游民往事#7 大理,在泰国的数字游民生活非常惬意，因此我非常希望可以持续这种生活方式。回国后我把眼光投向了大理——在我印象中，大理是一个很多独立撰稿人/自由职业者生活的地方，风景优美、气候温和、咖啡厅众多、活动也丰富，有着和清迈类似的vibe；但是我找了一圈之后都没有在大理发现任何类似的社区，因此，更多是出于自己需求的考虑，我和朋友在大理成立了国内第一个数字游民社区——Dali Hub。两年后，它成为了国内数字游民绕不开的一环。,3,0,2023-06-06T18:43:00,"""https://ci.xiaohongshu.com/a7a1b888-ece8-0a37-b88f-2fdf2598e1c1?imageMogr2/format/jpg/quality/92/auto-orient/strip/crop/450x300/gravity/center"""
647f14790000000011013489,靓仔出街,偶遇新加坡知名不上班博主@勇闯天涯大丫丫,10,0,2023-06-06T19:11:00,"""https://ci.xiaohongshu.com/d44f5fbc-bfb9-65a7-3d39-e4e8fcc6edc6?imageMogr2/format/jpg/quality/92/auto-orient/strip/crop/450x300/gravity/center"""
647f17f4000000001300def4,这里的海在发光耶，好蓝好喜欢,"“宝贝，眼里有光了✨” 这组照片的灵魂就是眼里终于有光了，对比之前上班时候的自己，真的快乐了很多，也勇敢、成长了很多，怎么说希望光一直在吧！ 	 “你真是天选打工人😖” 来文昌旅居的第二天，旅居地成员这样形容我，工作时间我真的一直在忙碌，整个人累晕的状态，有一种换个地方上班的感觉，但又对于远程工作和旅居有了新的认识，打破自己的固有状态重新建构生活方式，很奇妙也充满挑战，加油！ 	 “巴厘岛的第一语言是印尼语🌅” 很瓜的以为是英语哈哈，这里的老板主要项目是在巴厘岛，真想去！可是因为目前的远程工作除了方式是远程，工作性质实际上跟线下上班相同，还是过于局限自由，所以吧对于我命里带创业的这件事要开始多多思考了，虽然目前不敢承担成本风险，但也要积累起来！希望在巴厘岛的那个时候，可以随心安排所有时间",3,0,2023-06-06T19:26:00,"""https://ci.xiaohongshu.com/33ded04e-1d27-775a-273e-359576a08669?imageMogr2/format/jpg/quality/92/auto-orient/strip/crop/450x300/gravity/center"""
647f253400000000130067de,我震惊了,"因为不想陷入不断找工作的循环当中，觉得自己做点事情，搞搞跨境。 结果交了一些学费，发现原来在fb上投广告的号都是盗来的，因为号是消耗品，自己养号太难了。 并且如果是做fb marketplace，容易被号主发现，就需要把账号密码改掉 我震了个大惊，无法直视整个行业了。 原来全都是基于灰色之上的 	 就没有什么正直一点的行业吗，我执行力强，本来还是挺有信心的，结果发现行业不对劲",2,0,2023-06-06T20:23:00,"""https://ci.xiaohongshu.com/b13e70a6-c41a-b8f3-082b-0c3a54d028c9?imageMogr2/format/jpg/quality/92/auto-orient/strip/crop/450x300/gravity/center"""
647f27380000000013037ce6,6.6 FreeLab远程工作机会合辑,今天给大家推荐28个远程工作机会 💻 包括运营、文案、设计、插画、开发、剪辑、翻译等远程兼职/全职/外包项目工作 🔍 感兴趣的小伙伴，可以点击图片查看岗位详情 🙌 只要你符合岗位要求，就能不限于地理位置，实现在家也能工作的自由！ 👇 报名方法可以后台踢踢哦～,2,0,2023-06-06T20:31:00,"""https://ci.xiaohongshu.com/38849be4-b0f2-ea37-c7d1-316ce6ceceb7?imageMogr2/format/jpg/quality/92/auto-orient/strip/crop/450x300/gravity/center"""
647f330e000000001203d575,胡志明市，全球数字游民旅居热门城市,"越南胡志明市是一个充满活力和文化氛围的城市，也是东南亚地区旅游的热门选择之一。作为一个数字游民，我曾在那里旅居一个月，分享一些有关旅居的心得体验。 	 1、当然！最重要的是生活成本相对低，日常数钱数到手软的那种……入住当地的公寓或民宿，月租金一般在300-为500美元以下，同时当地食品价格也相对便宜。 	 2、越南拥有广阔的、快速发展的数字经济及电商市场，为数字游民提供了相对稳定的收入来源。 	 3、越南政府正在积极推动数字游民的发展。为了吸引更多的数字游民前来越南，越南政府制定了相关政策，如针对数字游民的签证政策和税收政策等，方便数字游民在当地工作和居住。大家都知道有一个对数字游民友好的政策是多么重要！ 	 4、越南的旅游资源太丰富！清凉寺、芽庄、岘港海滩、会安、大叻……而且重要的是这些景点之间都很容易到达！可以利用空闲时间探索越南的美食、文化和风景，跟各个国家的同伴结伴玩的同时，学习各种风土人情跟语言，简直不要太好玩！ 	 5、除了居住，办公空间是最重要的因素之一！胡志明市有很多成熟的共创空间可选择，以下是我跟周围数字游民朋友们的推荐： 	 Dreamplex: 这是胡志明市最大的共创空间 	 Saigon Hub: 100多个座位的聚会空间，同时提供共享办公室和虚拟办公室服务 	 THE OFFICE SAIGON: 它提供灵活办公区域和设备齐全的工作场所 	 Workshop: 拥有15,000平方米的私人和共享办公空间，配备先进的科技工具 	 Saigon Coworking: 这个空间提供日常办公室租赁、咖啡馆和沙龙形式的交流等服务 	 Start Coworking Campus: 提供创新者、创业者和数字游民自由办公空间 	 Dream Space紫薇星：提供高端私人办公室，可预订的交流空间 	 WeWork融侨国际中心：有很棒的团队空间、齐全的办公设备～为团队打造的空间 	 CirCO: 位于胡志明市中心，有丰富的每周定期的派对、社交活动与讲座等服务 	 Trường Đông Coworking Space: 这是越南唯一的学校共创空间，他们提供免费租赁给学生、老师和创业者～ 	 🍹 越南以其广阔的数字经济市场、相对低廉的生活成本、丰富的旅游资源以及政府的政策支持，吸引着越来越多的数字游民前来发展、旅行和生活。下一篇继续关于数字游民在越南旅居办公的生活成本分析～",14,0,2023-06-06T21:22:00,"""https://ci.xiaohongshu.com/5b35ca7d-0cd4-2232-ba6c-5453ba27d50d?imageMogr2/format/jpg/quality/92/auto-orient/strip/crop/450x300/gravity/center"""
647f345600000000270111df,数字游民钱从哪来 | 第一弹,"(一)数字游民改变了什么？ 	 在我的理解里，数字游民的一个核心点在于改变了个体的收入来源和成本结构。 	 不同于坐在固定办公地点、拿着固定薪酬的收入方式，数字游民有更灵活和多样的就业渠道——远程工作、兼职工作和自由职业；他们也不再局限于一隅之地，倾向于居住在低物价、低文娱成本的地区去降低生活支出，最大化收支差额，实现地理套利。 	 过去，我们的思维路径是“去一二线城市打拼➡️赚更多的钱➡️实现更好的生活”，但同时我们又面临着“更高的生活成本➡️更多的生存压力”。 	 现在，数字游民给我们提供了另一种可能性，“拿着一二线城市的工作薪酬➡️去低物价的城市生活➡️依靠物价差积累财富➡️实现更好生活”，其中隐含的路径是“低物价且高文娱价值的城市➡️更低的文娱成本，更多的精神享受”。这也就不难理解为什么游民更偏好像洱海、大理、巴塞罗那这样的旅游城市了。 	 这样的路径实现基础是：数字游民在“游”的过程中，仍然可以有稳定且和固定地点办公一致的高水平工作产出，这就要求办公条件不受地理限制，最典型的就是码农和依靠互联网的个体创作者（设计师、内容创作者等），低沟通需求，只要有电脑就可以。 	 web3也是相对更契合的行业，由于无国界和年轻化的特征，web3企业更加开放，用人方式更加多样，职工群体没有国界限制，组织形态发生了显著变化。更特别的是，web3领域的工作薪酬还支持以股权和crypto的形式发放，个体与组织的链接形式也从依附变成了共创。 	 发现了没有，web2的数字游民，变化的更在于成本结构，而web3的数字游民，变化的更在于收入结构。",3,0,2023-06-06T21:27:00,"""https://ci.xiaohongshu.com/81efcee4-5c86-1d4a-70f4-432145acd1b5?imageMogr2/format/jpg/quality/92/auto-orient/strip/crop/450x300/gravity/center"""
647f35350000000011012934,数字游民｜海南文昌 Serendipity空间,"数字游民的第一站，位于海南文昌的Serendipity空间，自然、悦己、疗愈的数字游民社区 	 🔺安利点：休闲感✅物价低✅自然风光✅ 	 跨圈社交，分享彼此的经历，每天一起出去兜风遛弯吃饭，谈工作、生活、价值观、下一个目的地，微风拂面时心情最chill，和其他来自五湖四海，不同个性、经历、职业的人在这里萍水相逢，往来友善又充满了人情味🤗 	 在椰林里栖息的村落，是我没见过的风土人情，晒得黝黑的打椰村民，聊天时突然砸落的🌴椰子，随处可见的木瓜和菠萝蜜，成片种植的荔枝和莲雾，黑山羊🐐、小鸭子🦆、小猫咪🐱、路边值班的狗🐶……这一切治愈了都市里的游魂。 	 镇上的惬意悠闲，不禁让我感叹他们好像从不因生存而忧，早茶文化深入人心，下午三四点总是坐满了人，各式各样但要趁热吃的糕点🍮，可以续杯的红茶和奶茶🍵，美味一绝的汤粉，特色椰奶和清补凉，肥美鲜嫩的文昌鸡，让我的味蕾大满足，价格也实惠👍 	 🔺以下槽点仅供参考：性价比❌链接性❌便民性❌ 	 雨季的气候不宜人，一个星期的雨之后，接踵而来的是让人难以忍受的闷热，房间没有空调热到要起疹，居民楼旁边是一个餐馆，晚上挺吵闹，椰林里蚊虫叮咬无处不在，几乎没办法呆太久就要逃离了，取快递要去镇上不方便。 	 另外作为一个数字游民空间，服务性和链接性都不够强，生活用品需要我们反映情况才提供，网络不太好，住的前几天房间甚至根本连不上，住了半个月仅有一两场活动，靠大家自发组织，主理人也不太能见到 	 如果想接触大自然，感受海南农村的风土人情，这里会是不错的放松选择，但也只值得住一到两周，到此一游即可",2,0,2023-06-06T21:31:00,"""https://ci.xiaohongshu.com/0f1061df-79e4-49ce-6b2d-bf9b52f0196e?imageMogr2/format/jpg/quality/92/auto-orient/strip/crop/450x300/gravity/center"""
647f36a10000000027011d21,二黑琪白马奇遇记,"毫不出奇，家里有了四只猫。加上去年走丢的白小琪，其实我是五个小宝的铲屎官。 	 白小二来的最晚，才不到一个月。不到三个月大的小家伙非常聪明，性格活泼开朗，发自内心的快乐。他的到来让原住民白小白惊慌失措，好像家里最快乐猫咪的称号被抢让他很不爽小二。因此花了很多时间适应跟小二相处。很长一段时间，小白都是嘟嘟囔囔的，从书橱跳到空调，再飞到衣橱上自闭舔毛。 	 白小黑是最早爱上小二的，可能小小的贝贝让他想起自己小时候猫传腹的衰弱和无助。所以他像大哥哥一样带着小二，嬉闹玩耍睡在一起。 	 白小马一如即往的大叔模样，淡定从容。对身边的变化默默观察。白小琪走丢以后小马忽然成熟了，也淡然了。经历了七天失去小琪的不吃不喝抑郁后，他仿佛得道高僧般，情绪毫无波澜。 	 去年十月还只有小马和小琪。刚想带他们出门见见世面，琪琪走了。朋友阿姨送来刚捡的流浪猫小白小黑。前几天又来了小二。仿佛命中注定，我就是要跟他们五小只结缘，也注定要带着“身骑白马“在路上。 	 对。身骑白马是我刚捡到小马时最喜欢的歌。所以小马是白小马，小琪是白小琪。后来有了白小白，白小黑(深），小二特别像琪琪，所以是二二。有了他们，我成了二黑琪白马。 	 六月，我们一起走天涯。",3,0,2023-06-06T21:37:00,"""https://ci.xiaohongshu.com/19642667-9035-f9de-baf0-1e9f7489307f?imageMogr2/format/jpg/quality/92/auto-orient/strip/crop/450x300/gravity/center"""
