id,title,content,likes,collects,date,image
6477158b0000000027010e5a,28岁单身女青年 毕业七年不想上班我怎么办？,"我大概是这个时代反叛的缩影。啥都想干都感兴趣都懂一点但都不精深。不想上班，我毕业之后7年没上过班但凭借着兴趣拥有很多个职业身份。 	 ▪️我大学学的酒店管理毕业在上海一个五星酒店实习工资不到四千。实在干不下去不想上班的我就开始思考那我去干啥？ ▪️出于对居住的热爱以及专业相关。我辞职开民宿，在第一套成功运营后拿到投资在上海市中心拥有了10套民宿入住率90%以上。也通过这个方式认识了很多活跃在上海的不上班的年轻人。 ▪️在一段时间投入时间精力后我实现了旅居的生活方式。19年我没有在上海超一个月的时间，去了五次韩国三次日本在泰国跨年，又去欧洲和美国都待了一个月。 ▪️然而也在遇到疫情之后这个生活被改变。出于自己对摄影和写作的兴趣以及在一些平台发布自己的观点，在疫情中转型民宿做拍摄场地，逐渐以free的形式接到一些工作包括拍摄文案等。接触到小红书后开始做一些外包的广告项目。 ▪️因为旺盛的表达欲我开始做一档叫做“去你家做客”的播客，请了很多在上海但不上班的年轻女性来聊一聊关于工作和居住在上海的泛访谈节目，旨在给相似的挣扎在上班和freelance之间的人们一些灵感和启发。 ▪️我的人生规划是三十岁之前不想要正经事只去玩儿，看世界，拓宽眼界，做想做的事，尽可能体验一切可能。在三十岁之后再去做一些关于改变和创造的事情，比如为女性创造更好的教育和就业，提升自我价值，当然也有赚钱的部分。而现在我28岁。 ▪️去年年底我准备申请美研同时也在东南亚旅居了大半年。清迈待了四个月，巴厘岛待了两个月，还去了马来西亚，越南。 ▪️最近我拿到UW传媒的录取，以多年的创业以及自由职业工作经验。我只申请了这一个项目也成功拿到了这一个项目的offer。九月份入学，我会重新回到学生时代，准备开启新的人生篇章。 ▪️反正人生做什么选择都会痛苦，不如选喜欢的。说不定就另辟蹊径反而和成功殊途同归呢？我不想上班，我就用自由职业的方式生活，靠复合型收入养活自己。我想去旅居，我就真正踏上行程，成为一名世界流浪儿。我真的变得开心和充实。虽然我仍然还会拥有困惑和迟疑，但是没有内耗。因为每一天我都在过着我的理想生活。刚毕业时的我绝对想不到现在的自己会活得这么自由。",253,0,2023-05-31T17:38:00,"""https://ci.xiaohongshu.com/cbeb9778-84f0-4870-81a3-5074dee695a5?imageMogr2/format/jpg/quality/92/auto-orient/strip/crop/450x300/gravity/center"""
6477183a000000001303d16c,陈皓老师给我的三个建议,"嗨，我是阿乐。今天跟大家分享陈皓老师给我的三个建议，一直影响着我30岁以后的工作和生活。 	 2020年第一天，我还沉浸在初到荷兰体验新生活的无限美好中，以及对明天的未知带来的无限期待中，踌躇满志地开始了很多探索和尝试。 	 也斗胆给陈皓老师发邮件探讨他当时在博客（酷壳）与大家探讨独立思考的话题《使用简单的逻辑方法进行独立思考》，顺便在邮件结尾简单地介绍了我是谁，我在做的事，以及新年快乐。 	 没想到他主动在tg上回复了我。 他说我的故事很有趣：来到欧洲、创作内容（当时在做播客）鼓励更多人探索自我、探索世界，不断成长。 	 他说，看起来我有很明确的目标；但他大概也很清楚，创作会是一条非常艰难的路。所以他主动给了我几个建议： 	 1）坚持阅读、学习、探索、思考，直到这些变成日常习惯。 	 2）专注2-3个主题，直到成为这个领域的专家。这样就能成为老师、教练或导师有能力去影响他人。 	 3）理想比计划更重要。关键是找到你可以为之奋斗一生的理想。 	 当付出无果、陷入深深地自我怀疑中时，他的建议总是引导我坚持下去：调整，然后继续前进。 	 我也慢慢发现，带给我自信和强烈信念感的，不是我走到了哪里，而是拥有的阅读和思考的习惯，以及从中学习和探索出的一套思维和行动的体系。 	 作为INTP，我们只需要找到一个真正内心认可的目标，找到内在的渴望，便能够调动所有的能力去行动；但同时，无欲无求的状态也让我们很难看清楚什么是“可以为之奋斗一生的理想”。 	 但在他身上我看到一个正直、理想主义的技术人如何作为布道者影响他人。软件工程师不仅仅是技术和逻辑，也有一个美丽的乌托邦，把逻辑的浪漫、思想的自由、有趣的灵魂散养在里头，用来抵御他人的干扰，聚焦对自己真正重要的人和事。 	         #你看过陈皓老师的技术博客吗？",12,0,2023-05-31T18:19:00,"""https://ci.xiaohongshu.com/948b1b37-4730-9103-8680-06d6dc4c96e9?imageMogr2/format/jpg/quality/92/auto-orient/strip/crop/450x300/gravity/center"""
64771daf0000000014026849,8个低成本小众好玩的小县城，来了只想躺平,离职流浪快三个月了 出发前就知道热门旅游地不是我的目的地 而是去了国内十几个小县城 💕很爱这种有生活感又好玩的小众城市 也给大家分享⓼个适合躺平的旅居城市🌷 好几个也是我接下来的目的地🌇 - ⓵“流浪汉”聚集地： 大理、安吉 ⓶小众青年文化 ： 景德镇、泉州 ⓷平价海岛冲浪： 青岛、惠州 ⓸温暖过冬必选： 万宁、西昌 - 另外 这几个月还去了东莞，汕尾，揭阳和随州 都是并不知名的城市 但在这些小县城我开始学会享受松弛和自由 对我来说，旅行的意义就是 重新捡拾对生活的感知，对自己的感知 也愿大家每次出发都可以 &quot;调动所有的感官，去拥抱你去到的地方&quot; - 这里是不想打工，正在流浪中国的普通美女👧🏻小羊，最近在邛海的民宿里给朋友当全职保姆，期待未来在路上能认识更多有故事的朋友👫,43,0,2023-05-31T18:13:00,"""https://ci.xiaohongshu.com/70aefa56-9a39-13c4-0e7b-961659fb92d5?imageMogr2/format/jpg/quality/92/auto-orient/strip/crop/450x300/gravity/center"""
64772b31000000001303483c,在迪拜当数字游民,回顾自己的过往经历找到适合自己的技能和专业知识，可以帮助你最适合你的项目和客户的类型，并有效地推销你的服务。 如果可以的话展示成套的作品，向潜在客户展示你的专业知识和能力。你的作品集应该包括你最引以为豪的项目经历，你是如何处理过往的问题，拿到什么成果，你服务过的客户的推荐信，以及你的报价。 社交网络的广泛建立可以让你与潜在客户建立联系，并积极探索与其他自由职业者和行业专业人士的关系。很多人都愿意与你分享经验，只要你足够真诚和主动。 设置费率和条款时要研究一下所在领域其他自由职业者的薪资水平，一开始可能以较低价格获得成交，再由逐渐累积的客户转介绍和复购而涨价 在迪拜做数字游民可以通过注册为独资经营者或成立有限责任公司来实现。了解成为数字游民的法律要求和规定是很重要的，所以一定要寻求专业建议，以确保你是合规的。 最后，为了吸引客户和发展业务，有效地营销和推广你的服务是很重要的。考虑建立一个网站，创建社交媒体账户，并利用在线营销工具来接触潜在客户，建立你的品牌。 感兴趣的创业者欢迎聊聊,1,0,2023-05-31T19:10:00,"""https://ci.xiaohongshu.com/7fe3aed8-6264-9996-0a9c-893e7ae3b92e?imageMogr2/format/jpg/quality/92/auto-orient/strip/crop/450x300/gravity/center"""
64772cac000000001203ff8c,一觉醒来互联网🛜都发生了什么❓,"✅微信视频号上线3大原创能力 ✅日本政府拟推出“数字游民签证” ✅全球最大广告公司WPP与英伟达展开合作，利用生成式AI大批量制作广告内容 ✅中国网络文学海外用户超1.5亿人 	 🔍海螺邦是一个自由职业者求职平台~ 💸会文案、会设计的友友都可以来海螺邦星空创作站尝试接单~ 💎快来赏金广场开启一段属于你的兼职、副业、自由职业生涯吧~ 	 🐚我是海小螺，自由职业|设计灵感|文案分享|职场干货",2,0,2023-05-31T19:17:00,"""https://ci.xiaohongshu.com/76ced0a7-e3cb-a1a5-73dd-3357e8ba2703?imageMogr2/format/jpg/quality/92/auto-orient/strip/crop/450x300/gravity/center"""
64773573000000001303e7dd,数字游民计划｜稳定的收入,"【说在前面】原本数字游民计划只是想想，但自从开始写小红书后，便倒逼自己去行动，从最开始的收纳整理，到消费观转变，再到收入分配的调整，目前整个进度比我计划的要快要顺利😀 	 ‼️那么我是如何增加线上稳定收入的呢？ 	 目前我的收入主要来源于授课，含线上和线下课程～ 	 线下课程：全是小班课，相对稳定，转介绍也很Ok，收入占比最大 	 线上课程：私教为主，课程比较本土化，能覆盖部分收入，但是周期有限，不宜长期发展 	 整个收入来源还是比较单一的，而且不稳定性也存在，如果一旦选择完全线上办公，大部分收入都会受影响，所以再三考量还是找了平台的线上英语老师兼职，确保线上收入的稳定性，同时正好又是我想上的课程，一举两得 	 当然还有很多线上兼职：比如写文书，帮忙申请国外学校，资源对接等等，这些我都有做过，都没有上课那么踏实和稳定，而且我更想专注在一件事上，把这件事做好做精，再考虑其他～",0,0,2023-05-31T19:54:00,"""https://ci.xiaohongshu.com/952fd870-f95f-e472-8ed1-831cca7f0506?imageMogr2/format/jpg/quality/92/auto-orient/strip/crop/450x300/gravity/center"""
647737da0000000027012a5f,少时不懂农村好，长大方知忘不了,"哈哈哈半年旅行基本结束了，已经回家里的农村旅居了，自己家单独一个小山头，也没什么人来串门，只听得到鸡鸣犬吠鸟啾啾，感觉能过很久清净日子。 	 十几岁时候种的枇杷树，后来心心念念能吃它的果子，今年也算抓住尾巴吃了几颗，希望还能多吃几年。 	 快20年没待过的农村老家，竟然有了旅行的感觉。好像只要能睡觉、有自来水、甚至有WiFi，虽然快递不方便，和在其他地方也没什么差别。 	 陪着爷爷奶奶帮帮小忙，过两天再去赶躺集，就跟小时候一样。",4,0,2023-06-01T10:00:00,"""https://ci.xiaohongshu.com/50ff1546-6e69-d7fd-0750-3a6070983397?imageMogr2/format/jpg/quality/92/auto-orient/strip/crop/450x300/gravity/center"""
64773ca50000000014026d4f,5.31 FreeLab远程工作机会合辑,今天给大家推荐35个远程工作机会 💻 包括运营、文案、设计、插画、开发、剪辑、翻译等远程兼职/全职/外包项目工作 🔍 感兴趣的小伙伴，可以点击图片查看岗位详情 🙌 只要你符合岗位要求，就能不限于地理位置，实现在家也能工作的自由！ 👇 报名方法可以后台踢踢哦～,6,0,2023-05-31T20:25:00,"""https://ci.xiaohongshu.com/9d2835dc-7ddb-2b5f-3669-17b19efdbe6b?imageMogr2/format/jpg/quality/92/auto-orient/strip/crop/450x300/gravity/center"""
64773e6300000000270106dd,好想搬到海岛上去生活啊,没有数字游民的技能。有什么工作是能在加勒比海岛上远程操作，挣着与澳大利亚工资持平的收入吗？只要飓风不吹断网 图一🇯🇲 牙买加 图二三🇦🇼 阿鲁巴 图四五🇦🇬 安提瓜 图六🇺🇸 美属维珍群岛,1,0,2023-05-31T20:32:00,"""https://ci.xiaohongshu.com/eb8f8b28-2e7f-d9ac-a152-d25f5dbe3f0c?imageMogr2/format/jpg/quality/92/auto-orient/strip/crop/450x300/gravity/center"""
647748400000000013031c88,兼职 /远程UI设计师,有需要兼职/远程UI设计师的客户吗？ 可以告诉我呀🥳,2,0,2023-05-31T21:14:00,"""https://ci.xiaohongshu.com/be2445ae-6635-7b33-a9d9-cdb55911d51c?imageMogr2/format/jpg/quality/92/auto-orient/strip/crop/450x300/gravity/center"""
64774f9400000000130049c4,99%的人都不知道，腾冲真正的宝藏秘境在这,"来腾冲玩和顺古镇，还是银杏村和火山温泉？ 	 如果你像我一样，漂在北上广深，是城市绿化和郊野公园满足不了的自然爱好者，那以上这些地方，只会让你错过真正的腾冲。 	 作为前北漂兼互联网从业者，我曾用半年跑遍云南，最终俘获我的，不是人人从众的大理，不是复刻城市、大同小异的旅居楼盘，而是离腾冲50公里的界头村庄，在这结结实实做了三年山里人，我也发现了另一个游离于“旅游套话”外的腾冲～ 	 ✅【放大100倍的野性江南】 	 界头藏在群山里，靠近缅甸边境， 却绝非你想象中的“穷乡僻壤”； 东北的黑土地，100倍于江南的山地 高山环抱的河谷田野，土地夹森林的瑞士风光， 黑熊、猴子横行的高黎贡山， 春夏秋冬都是种植季的黄金气候， 现代人关于田园、荒野的所有想象，你都能在这找到！ 	 ✅【原始丛林的巨木秃杉】 	 山里每棵树都长着松萝 堪比北美原始森林的巨大秃杉林 有着三个人也抱不住的肚量 田间地头也常见180高玉米、巨人般烟叶 满月般的卷心菜、可以单手练举重的萝卜… 同样是野，西藏的自然是冷漠的，给人压迫感 这里的自然却充满生命力 会真的给人满血复活的生活勇气！ 	 ✅【随手宫崎骏的田园花海】 	 7-8月万寿菊花开，碰上雨季云雾缭绕 搭配层叠的绿、万寿菊的黄简直就是仙境！ 碰上晴天，天蓝得像油漆、云重到像会掉下来， 无论摘花、收花，苹果直出都像宫崎骏的动画！ 1-3月又有油菜花海， 比罗平层次丰富，又比婺源广阔随意 按理说到处都在照抄的油菜花海很俗气， 但它在这儿却少见的清新脱俗，让人很服气！ 	 🚌交通： 追求便利——租车自驾 时间充足——坐客运车：机场小巴直达【通利达客运站】，找去【界头】的车，客运车也同时提供包车服务巡游乡村。 	 ⏰推荐季节： 6-10月为雨季，适合避暑，可观万寿菊，也能看云雾缭绕的山地仙境 	 11-3月为干季，阳光灿烂，雨水很少，能温暖过冬，也能看油菜花海。",34,0,2023-05-31T21:45:00,"""https://ci.xiaohongshu.com/a93b14d9-2210-64cc-797d-9aab8451b8fe?imageMogr2/format/jpg/quality/92/auto-orient/strip/crop/450x300/gravity/center"""
6477563800000000130118a7,我暂停了2年4个月の环球数字游民旅居,"🪐暂停了我的环球数字游民旅居，回到香港。 🇭🇰香港有数字游民吗？ 有！但大家仍习惯叫freelancer， 学术研究的学生有顺潮流用这词 🙌(收到挺多访谈邀请) 	 疫情期间，我正好辞去香港立法会体制工作， 出去环球旅行&amp;旅居🌍 至今走了:2022年4月✈️ 环亚(respect新加坡)、欧洲(东西南北中走遍🗼)及非洲 	 2023年初，体验旅居海南岛3️⃣个数字游民社区，还共建了其中一个疗愈身心的自然空间🌿 2021年重游祖国大陆大山大海， 期间用一学期参与四川大凉山支教项目👩‍🏫 85年世代的我，🈚️婚姻束缚🈚️事业捆绑 港台成长的经历让我自如穿梭， 没有社会⏱，内心焦虑拉扯，🚫PUA 只活出了自已，生机勃勃、快乐热烈👯‍♀️ 行有余力，我想爱具体的人❤️ 「给予20人笃定感」的计划招募 大数据运行一波，陆港台红薯🍠",11,0,2023-05-31T22:14:00,"""https://ci.xiaohongshu.com/50cb21c8-bdfe-ce48-1713-095a6c768424?imageMogr2/format/jpg/quality/92/auto-orient/strip/crop/450x300/gravity/center"""
647757f30000000014026eb7,日本拟出台“数字游民签证”,据日本每日新闻和《读卖新闻》5月28日消息，日本政府计划出台“数字游民签证”政策，希望通过为高技能人才创造便利环境促进访日游客消费。数字游民指不需要到固定地点上班、依靠互联网便可谋生的人群。,4,0,2023-05-31T22:21:00,"""https://ci.xiaohongshu.com/06fd187a-2d6d-37d5-e7c5-5d0b06576cca?imageMogr2/format/jpg/quality/92/auto-orient/strip/crop/450x300/gravity/center"""
64775cc50000000013013ad4,数字游民·流浪地球｜南京,数字游民·流浪地球｜南京,2,0,2023-05-31T22:42:00,"""https://ci.xiaohongshu.com/41c6a6be-156d-5ac9-436f-16bb7d2ea966?imageMogr2/format/jpg/quality/92/auto-orient/strip/crop/450x300/gravity/center"""
6477607d000000000703b9f1,裸辞后看了这4部剧 我决定再也不上班了,- Hi~ 我是在新疆生活的数字游民绾晏，今天分享下我的收藏夹… - 🎬&lt;重启人生&gt; · 麻美是一名30+的平凡公务员，有天在和朋友约会后回家的路上遭遇了车祸。 当麻美恢复意识时，她发现自己来到了一个纯白的空间中，一位前台告诉麻美她已经s了。 · 现在的麻美有两个选择，一是转世投tai，成为在危地马拉生活的食蚁兽，另一个是投tai回到婴儿时期自己自己身体里，再活一遍，依靠积累阴德，以换取能够转世成人的机会… 🍧 强推理由 · 大约是在这部出圈爆火之后，前段时间偶尔翻来做背景音。但意外的好看，尤其是麻美为拯救好友而立志成为女机长那段。看得时候有感慨，也有思考… 如果重启，我会做什么选择呢？ - 🎬&lt;什么都不想做&gt; · 28岁的春天，决定从今天开始什么都不做！宣布人生罢工——一个寻找28岁青春逗号的计划。 讲述了在28岁罢工并发现&quot;自我&quot;的女子和虽然是数学神童，却在图书馆担任合同工的男子相遇，治yu彼此伤痛的人情MELO，为了什么都不做而来到村里经历太多事情后的样子，引起现代人的共鸣。 · 🍧强推理由 · 这部真的给到了我力量，开头看到春天从地铁下来，看向窗外的模样。 看到她决定离开「去td」职场的反击，看到她背着行囊来到一个小城，从酗酒到晨跑，从躺平到重新找到生活的目标。 不由得感叹，生活还是得慢慢耕耘才会有答案… - 🎬&lt;种地吧&gt; · 节目记录了10位年轻人，踏踏实实地用191天时间，在142亩土地上，播种、灌溉、施肥、收获。从一粒麦子变成麦田，看到自己耕作的土地变成诗歌图园，以此传递“认真做好一件事”这种态度的实际意义和人生价值。 · 🍧强推理由 · 从年后开始追，连刷十几集，这段时间睡前的播客都换做他们直播的后台播放。 看着他们白干，看着他们从爱豆成为土地的孩子。 真的强推！！！ - 🎬&lt;我的解放日志&gt; · 住在京畿道山浦市的姐弟三人因为工作，媒体都要往返首尔，早上七点出门，还要卡着末班车回家，他们受够了日复一日毫无变化的成年生活，决定要在平凡无奇的人生中，寻找成就感和自由。 · 🍧强推理由 · 有点丧，但又有点释放。记忆里的画面是姐弟三人走在回家的路上，不打招呼好像没有家人的亲昵。 想来 生活在城市边缘的人儿，每一个人都有自己的不容易… ·,18,0,2023-05-31T22:58:00,"""https://ci.xiaohongshu.com/8203b9d9-19aa-df38-63ff-fb6e9bca056b?imageMogr2/format/jpg/quality/92/auto-orient/strip/crop/450x300/gravity/center"""
64776a8f000000000800cd52,有谁能比农村更懂松弛感呢,从北京搬到大山里，最喜欢的事儿是晒晒太阳吹吹风，也因此爱上了骑车的自由感，骑车飞在田野上，或者席地而坐看太阳下山、云像海浪翻涌，没有kpi，没有deadline，也没什么人生大事，仅仅只是脚踏实地的活着，生活就很充实了～,2,0,2023-05-31T23:41:00,"""https://ci.xiaohongshu.com/d4e68ef3-c04e-e506-9b58-ff4a76541246?imageMogr2/format/jpg/quality/92/auto-orient/strip/crop/450x300/gravity/center"""
647778ec000000001203c64f,笑死！儿童节礼物是把我的丑照画成画🙂,"最近NCC社区有一系列创意炸裂的活动，早上在玻璃顶上布展的时候，不行被朋友拍下来，瞬间画成了画送给我，并且在全社区流传。。听我说，谢谢你 	 欢迎大家报名活动，来找我们玩呀～",2,0,2023-06-01T00:42:00,"""https://ci.xiaohongshu.com/4d723740-1f3c-998a-6ca2-1416e83e15f0?imageMogr2/format/jpg/quality/92/auto-orient/strip/crop/450x300/gravity/center"""
647782f90000000013009ff0,数字游民的一天,数字游民的一天,6,0,2023-06-01T01:25:00,"""https://ci.xiaohongshu.com/7a630d85-7443-6e40-d741-3bf7c73279ac?imageMogr2/format/jpg/quality/92/auto-orient/strip/crop/450x300/gravity/center"""
6477d0d50000000011012164,数字游民｜陆台港表达不同,近期内地很火🔥的数字游民 回到香港🇭🇰发现叫:数码牧民 香港有个“数码港”， 更多还是习惯叫英文freelancer 而和台湾朋友说起，都叫作“数位游牧” 还好英文只有一个Digital Nomad 😂 三地文化游走的日常～ 交流更多发现,6,0,2023-06-01T06:57:00,"""https://ci.xiaohongshu.com/79ef9f08-eaf3-a052-68a1-d7b78643b34e?imageMogr2/format/jpg/quality/92/auto-orient/strip/crop/450x300/gravity/center"""
6477df070000000013002ad5,一个3岁+成长教练的月度总结,"五月躺平一周，几乎让我觉得自己毫无产出，复盘后还是可以释怀不少 此文昨日先在公号发布，有人反馈说O定的目标不够具体，不够smart 	 是，说的没错。也给我提了个醒，以后会更具体可衡量一些，比如把某些kr直接拎出来作为O，不过我也想了一下，我这个OKR是写给自己看的，和企业里使用场景主要有2点差异： 1、不需要有上下游的同事来拆分我的O， 2、允许更多探索和开放性",3,0,2023-06-01T07:57:00,"""https://ci.xiaohongshu.com/ee2c27a7-a90e-800b-0d08-f6c36d1c5da2?imageMogr2/format/jpg/quality/92/auto-orient/strip/crop/450x300/gravity/center"""
6477ed05000000001300b17b,你是“数字游民”吗？今日面试热点(6.1),【面试热点解析】： 数字游民，网络用语中指无需办公室等固定工作场所，而是利用网络数字手段完成工作的人。 疫情以来，越来越多的公司为员工提供“随处办公”的选项。实现工作空间自由，开启“数字游民”的生活方式，越来越受年轻人青睐。,1,0,2023-06-01T08:57:00,"""https://ci.xiaohongshu.com/90b6efbd-b78b-5a8e-c174-73b4d16d61aa?imageMogr2/format/jpg/quality/92/auto-orient/strip/crop/450x300/gravity/center"""
64780205000000000800ddc6,数字游民·流浪地球｜湖州,数字游民·流浪地球｜湖州,2,0,2023-06-01T10:27:00,"""https://ci.xiaohongshu.com/8f7021e8-f967-b07d-836d-4d03b9b9b0ae?imageMogr2/format/jpg/quality/92/auto-orient/strip/crop/450x300/gravity/center"""
64780b8a000000001203370f,六点起来画画 这美女有点对眼是怎么回事..,"NCC的六一节系列派对之一，趁着太阳不热，六点多就起来画画。艺术教育老师阿其带大家画画，将童年的快乐时光定格成画面画在NCC的天台上，因为现在大家总在说原生家庭、童年创伤对我们的影响，但童年的快乐记忆往往被我们忽略掉了，就算再苦，童年快乐的记忆。 	 所以有人画跳房子，有人画太阳花，有人抽象地表达了童年的情绪，而我画了我想象中的母亲和我和姐姐，三个女人的童年记忆，是我最重要的人生底色。 	 祝大家儿童节快乐，想点快乐的童年往事吧～",4,0,2023-06-01T11:07:00,"""https://ci.xiaohongshu.com/d2f2486c-fd0c-635a-3d12-19ec8a345852?imageMogr2/format/jpg/quality/92/auto-orient/strip/crop/450x300/gravity/center"""
